Sheet: qry_blendcomposition_details
A1: Gas_ID | B1: shortlisted | C1: Gas_Group | D1: GG_name | E1: gas_name_display | F1: gas_name_IA | G1: Component_ID | H1: comp_group | I1: Comp_group_name | J1: component_name_display | K1: component_name_IA | L1: reported_other_explanation | M1: Percentage | N1: GWP_AR4_100 | O1: GWP_AR4_100_HFC
A2: 1 | B2: of:=FALSE() -> 0 | C2: 10 | D2: SF6 pseudo-group | E2: SF6 | F2: SF6 | G2: 1 | H2: 10 | I2: SF6 pseudo-group | J2: SF6 | K2: SF6 | M2: 1 | N2: 22800 | O2: 0
A3: 2 | B3: of:=FALSE() -> 0 | C3: 1 | D3: HFCs | E3: HFC-23 (trifluoromethane, fluoroform) | F3: HFC-23 | G3: 2 | H3: 1 | I3: HFCs | J3: HFC-23 (trifluoromethane, fluoroform) | K3: HFC-23 | M3: 1 | N3: 14800 | O3: 14800
A4: 3 | B4: of:=FALSE() -> 0 | C4: 1 | D4: HFCs | E4: HFC-32 (difluoromethane) | F4: HFC-32 | G4: 3 | H4: 1 | I4: HFCs | J4: HFC-32 (difluoromethane) | K4: HFC-32 | M4: 1 | N4: 675 | O4: 675
A5: 4 | B5: of:=FALSE() -> 0 | C5: 1 | D5: HFCs | E5: HFC-41 (fluoromethane, methyl fluoride) | F5: HFC-41 | G5: 4 | H5: 1 | I5: HFCs | J5: HFC-41 (fluoromethane, methyl fluoride) | K5: HFC-41 | M5: 1 | N5: 92 | O5: 92
A6: 5 | B6: of:=FALSE() -> 0 | C6: 1 | D6: HFCs | E6: HFC-125 (pentafluoroethane) | F6: HFC-125 | G6: 5 | H6: 1 | I6: HFCs | J6: HFC-125 (pentafluoroethane) | K6: HFC-125 | M6: 1 | N6: 3500 | O6: 3500
A7: 6 | B7: of:=FALSE() -> 0 | C7: 1 | D7: HFCs | E7: HFC-134 (1,1,2,2-tetrafluoroethane) | F7: HFC-134 | G7: 6 | H7: 1 | I7: HFCs | J7: HFC-134 (1,1,2,2-tetrafluoroethane) | K7: HFC-134 | M7: 1 | N7: 1100 | O7: 1100
A8: 7 | B8: of:=FALSE() -> 0 | C8: 1 | D8: HFCs | E8: HFC-134a (1,1,1,2-tetrafluoroethane) | F8: HFC-134a | G8: 7 | H8: 1 | I8: HFCs | J8: HFC-134a (1,1,1,2-tetrafluoroethane) | K8: HFC-134a | M8: 1 | N8: 1430 | O8: 1430
A9: 8 | B9: of:=FALSE() -> 0 | C9: 1 | D9: HFCs | E9: HFC-143 (1,1,2-trifluoroethane) | F9: HFC-143 | G9: 8 | H9: 1 | I9: HFCs | J9: HFC-143 (1,1,2-trifluoroethane) | K9: HFC-143 | M9: 1 | N9: 353 | O9: 353
A10: 9 | B10: of:=FALSE() -> 0 | C10: 1 | D10: HFCs | E10: HFC-143a (1,1,1-trifluoroethane) | F10: HFC-143a | G10: 9 | H10: 1 | I10: HFCs | J10: HFC-143a (1,1,1-trifluoroethane) | K10: HFC-143a | M10: 1 | N10: 4470 | O10: 4470
A11: 10 | B11: of:=FALSE() -> 0 | C11: 1 | D11: HFCs | E11: HFC-152a (1,1-difluoroethane) | F11: HFC-152a | G11: 10 | H11: 1 | I11: HFCs | J11: HFC-152a (1,1-difluoroethane) | K11: HFC-152a | M11: 1 | N11: 124 | O11: 124
A12: 11 | B12: of:=FALSE() -> 0 | C12: 1 | D12: HFCs | E12: HFC-227ea (1,1,1,2,3,3,3-heptafluoropropane) | F12: HFC-227ea | G12: 11 | H12: 1 | I12: HFCs | J12: HFC-227ea (1,1,1,2,3,3,3-heptafluoropropane) | K12: HFC-227ea | M12: 1 | N12: 3220 | O12: 3220
A13: 12 | B13: of:=FALSE() -> 0 | C13: 1 | D13: HFCs | E13: HFC-236cb (1,1,1,2,2,3-hexafluoropropane) | F13: HFC-236cb | G13: 12 | H13: 1 | I13: HFCs | J13: HFC-236cb (1,1,1,2,2,3-hexafluoropropane) | K13: HFC-236cb | M13: 1 | N13: 1340 | O13: 1340
A14: 13 | B14: of:=FALSE() -> 0 | C14: 1 | D14: HFCs | E14: HFC-236ea (1,1,1,2,3,3-hexafluoropropane) | F14: HFC-236ea | G14: 13 | H14: 1 | I14: HFCs | J14: HFC-236ea (1,1,1,2,3,3-hexafluoropropane) | K14: HFC-236ea | M14: 1 | N14: 1370 | O14: 1370
A15: 14 | B15: of:=FALSE() -> 0 | C15: 1 | D15: HFCs | E15: HFC-236fa (1,1,1,3,3,3-hexafluoropropane) | F15: HFC-236fa | G15: 14 | H15: 1 | I15: HFCs | J15: HFC-236fa (1,1,1,3,3,3-hexafluoropropane) | K15: HFC-236fa | M15: 1 | N15: 9810 | O15: 9810
A16: 15 | B16: of:=FALSE() -> 0 | C16: 1 | D16: HFCs | E16: HFC-245ca (1,1,2,2,3-pentafluoropropane) | F16: HFC-245ca | G16: 15 | H16: 1 | I16: HFCs | J16: HFC-245ca (1,1,2,2,3-pentafluoropropane) | K16: HFC-245ca | M16: 1 | N16: 693 | O16: 693
A17: 16 | B17: of:=FALSE() -> 0 | C17: 1 | D17: HFCs | E17: HFC-245fa (1,1,1,3,3-pentafluoropropane) | F17: HFC-245fa | G17: 16 | H17: 1 | I17: HFCs | J17: HFC-245fa (1,1,1,3,3-pentafluoropropane) | K17: HFC-245fa | M17: 1 | N17: 1030 | O17: 1030
A18: 17 | B18: of:=FALSE() -> 0 | C18: 1 | D18: HFCs | E18: HFC-365mfc (1,1,1,3,3-pentafluorobutane) | F18: HFC-365mfc | G18: 17 | H18: 1 | I18: HFCs | J18: HFC-365mfc (1,1,1,3,3-pentafluorobutane) | K18: HFC-365mfc | M18: 1 | N18: 794 | O18: 794
A19: 18 | B19: of:=FALSE() -> 0 | C19: 1 | D19: HFCs | E19: HFC-43-10mee (1,1,1,2,2,3,4,5,5,5-decafluoropentane) | F19: HFC-43-10mee | G19: 18 | H19: 1 | I19: HFCs | J19: HFC-43-10mee (1,1,1,2,2,3,4,5,5,5-decafluoropentane) | K19: HFC-43-10mee | M19: 1 | N19: 1640 | O19: 1640
A20: 19 | B20: of:=FALSE() -> 0 | C20: 2 | D20: PFCs | E20: PFC-14 (CF4) | F20: PFC-14 | G20: 19 | H20: 2 | I20: PFCs | J20: PFC-14 (CF4) | K20: PFC-14 | M20: 1 | N20: 7390 | O20: 0
A21: 20 | B21: of:=FALSE() -> 0 | C21: 2 | D21: PFCs | E21: PFC-116 (C2F6) | F21: PFC-116 | G21: 20 | H21: 2 | I21: PFCs | J21: PFC-116 (C2F6) | K21: PFC-116 | M21: 1 | N21: 12200 | O21: 0
A22: 21 | B22: of:=FALSE() -> 0 | C22: 2 | D22: PFCs | E22: PFC-218 (C3F8) | F22: PFC-218 | G22: 21 | H22: 2 | I22: PFCs | J22: PFC-218 (C3F8) | K22: PFC-218 | M22: 1 | N22: 8830 | O22: 0
A23: 22 | B23: of:=FALSE() -> 0 | C23: 2 | D23: PFCs | E23: PFC-c-318 (c-C4F8) | F23: PFC-c-318 | G23: 22 | H23: 2 | I23: PFCs | J23: PFC-c-318 (c-C4F8) | K23: PFC-c-318 | M23: 1 | N23: 10300 | O23: 0
A24: 23 | B24: of:=FALSE() -> 0 | C24: 2 | D24: PFCs | E24: PFC-3-1-10 (C4F10) | F24: PFC-3-1-10 | G24: 23 | H24: 2 | I24: PFCs | J24: PFC-3-1-10 (C4F10) | K24: PFC-3-1-10 | M24: 1 | N24: 8860 | O24: 0
A25: 24 | B25: of:=FALSE() -> 0 | C25: 2 | D25: PFCs | E25: PFC-4-1-12 (C5F12) | F25: PFC-4-1-12 | G25: 24 | H25: 2 | I25: PFCs | J25: PFC-4-1-12 (C5F12) | K25: PFC-4-1-12 | M25: 1 | N25: 9160 | O25: 0
A26: 25 | B26: of:=FALSE() -> 0 | C26: 2 | D26: PFCs | E26: PFC-5-1-14 (C6F14) | F26: PFC-5-1-14 | G26: 25 | H26: 2 | I26: PFCs | J26: PFC-5-1-14 (C6F14) | K26: PFC-5-1-14 | M26: 1 | N26: 9300 | O26: 0
A27: 26 | B27: of:=TRUE() -> 1 | C27: 7 | D27: HFC mixtures | E27: R-404A | F27: R-404A | G27: 5 | H27: 1 | I27: HFCs | J27: HFC-125 (pentafluoroethane) | K27: HFC-125 | M27: 0.44 | N27: 3500 | O27: 3500
A28: 26 | B28: of:=TRUE() -> 1 | C28: 7 | D28: HFC mixtures | E28: R-404A | F28: R-404A | G28: 7 | H28: 1 | I28: HFCs | J28: HFC-134a (1,1,1,2-tetrafluoroethane) | K28: HFC-134a | M28: 0.04 | N28: 1430 | O28: 1430
A29: 26 | B29: of:=TRUE() -> 1 | C29: 7 | D29: HFC mixtures | E29: R-404A | F29: R-404A | G29: 9 | H29: 1 | I29: HFCs | J29: HFC-143a (1,1,1-trifluoroethane) | K29: HFC-143a | M29: 0.52 | N29: 4470 | O29: 4470
A30: 27 | B30: of:=TRUE() -> 1 | C30: 7 | D30: HFC mixtures | E30: R-407C | F30: R-407C | G30: 3 | H30: 1 | I30: HFCs | J30: HFC-32 (difluoromethane) | K30: HFC-32 | M30: 0.23 | N30: 675 | O30: 675
A31: 27 | B31: of:=TRUE() -> 1 | C31: 7 | D31: HFC mixtures | E31: R-407C | F31: R-407C | G31: 5 | H31: 1 | I31: HFCs | J31: HFC-125 (pentafluoroethane) | K31: HFC-125 | M31: 0.25 | N31: 3500 | O31: 3500
A32: 27 | B32: of:=TRUE() -> 1 | C32: 7 | D32: HFC mixtures | E32: R-407C | F32: R-407C | G32: 7 | H32: 1 | I32: HFCs | J32: HFC-134a (1,1,1,2-tetrafluoroethane) | K32: HFC-134a | M32: 0.52 | N32: 1430 | O32: 1430
A33: 28 | B33: of:=TRUE() -> 1 | C33: 7 | D33: HFC mixtures | E33: R-507A | F33: R-507A | G33: 5 | H33: 1 | I33: HFCs | J33: HFC-125 (pentafluoroethane) | K33: HFC-125 | M33: 0.5 | N33: 3500 | O33: 3500
A34: 28 | B34: of:=TRUE() -> 1 | C34: 7 | D34: HFC mixtures | E34: R-507A | F34: R-507A | G34: 9 | H34: 1 | I34: HFCs | J34: HFC-143a (1,1,1-trifluoroethane) | K34: HFC-143a | M34: 0.5 | N34: 4470 | O34: 4470
A35: 29 | B35: of:=TRUE() -> 1 | C35: 7 | D35: HFC mixtures | E35: R-410A | F35: R-410A | G35: 3 | H35: 1 | I35: HFCs | J35: HFC-32 (difluoromethane) | K35: HFC-32 | M35: 0.5 | N35: 675 | O35: 675
A36: 29 | B36: of:=TRUE() -> 1 | C36: 7 | D36: HFC mixtures | E36: R-410A | F36: R-410A | G36: 5 | H36: 1 | I36: HFCs | J36: HFC-125 (pentafluoroethane) | K36: HFC-125 | M36: 0.5 | N36: 3500 | O36: 3500
A37: 34 | B37: of:=FALSE() -> 0 | C37: 7 | D37: HFC mixtures | E37: Mix: HFC-152a:70%; Other (no F-gas of Regulation (EC) 842/2006):30% | F37: Mix: HFC-152a:70%; Other (no F-gas of Regulation (EC) 842/2006):30% | G37: 10 | H37: 1 | I37: HFCs | J37: HFC-152a (1,1-difluoroethane) | K37: HFC-152a | M37: 0.7 | N37: 124 | O37: 124
A38: 34 | B38: of:=FALSE() -> 0 | C38: 7 | D38: HFC mixtures | E38: Mix: HFC-152a:70%; Other (no F-gas of Regulation (EC) 842/2006):30% | F38: Mix: HFC-152a:70%; Other (no F-gas of Regulation (EC) 842/2006):30% | G38: 213 | H38: 6 | I38: Non-fluorinated substances | J38: E-170 (Dimethyl ether) | K38: Dimethyl ether | M38: 0.3 | N38: 1 | O38: 0
A39: 35 | B39: of:=FALSE() -> 0 | C39: 7 | D39: HFC mixtures | E39: Mix: HFC-125:86%; C3F8:9%; Other (no F-gas of Regulation (EC) 842/2006):5% | F39: Mix: HFC-125:86%; C3F8:9%; Other (no F-gas of Regulation (EC) 842/2006):5% | G39: 5 | H39: 1 | I39: HFCs | J39: HFC-125 (pentafluoroethane) | K39: HFC-125 | M39: 0.86 | N39: 3500 | O39: 3500
A40: 35 | B40: of:=FALSE() -> 0 | C40: 7 | D40: HFC mixtures | E40: Mix: HFC-125:86%; C3F8:9%; Other (no F-gas of Regulation (EC) 842/2006):5% | F40: Mix: HFC-125:86%; C3F8:9%; Other (no F-gas of Regulation (EC) 842/2006):5% | G40: 21 | H40: 2 | I40: PFCs | J40: PFC-218 (C3F8) | K40: PFC-218 | M40: 0.09 | N40: 8830 | O40: 0
A41: 35 | B41: of:=FALSE() -> 0 | C41: 7 | D41: HFC mixtures | E41: Mix: HFC-125:86%; C3F8:9%; Other (no F-gas of Regulation (EC) 842/2006):5% | F41: Mix: HFC-125:86%; C3F8:9%; Other (no F-gas of Regulation (EC) 842/2006):5% | G41: 218 | H41: 6 | I41: Non-fluorinated substances | J41: R-290 (Propane) | K41: Propane | M41: 0.05 | N41: 3 | O41: 0
A42: 37 | B42: of:=TRUE() -> 1 | C42: 7 | D42: HFC mixtures | E42: R-417A | F42: R-417A | G42: 5 | H42: 1 | I42: HFCs | J42: HFC-125 (pentafluoroethane) | K42: HFC-125 | M42: 0.466 | N42: 3500 | O42: 3500
A43: 37 | B43: of:=TRUE() -> 1 | C43: 7 | D43: HFC mixtures | E43: R-417A | F43: R-417A | G43: 7 | H43: 1 | I43: HFCs | J43: HFC-134a (1,1,1,2-tetrafluoroethane) | K43: HFC-134a | M43: 0.5 | N43: 1430 | O43: 1430
A44: 37 | B44: of:=TRUE() -> 1 | C44: 7 | D44: HFC mixtures | E44: R-417A | F44: R-417A | G44: 219 | H44: 6 | I44: Non-fluorinated substances | J44: R-600 (Butane) | K44: Butane | M44: 0.034 | N44: 4 | O44: 0
A45: 38 | B45: of:=TRUE() -> 1 | C45: 7 | D45: HFC mixtures | E45: R-422A | F45: R-422A | G45: 5 | H45: 1 | I45: HFCs | J45: HFC-125 (pentafluoroethane) | K45: HFC-125 | M45: 0.851 | N45: 3500 | O45: 3500
A46: 38 | B46: of:=TRUE() -> 1 | C46: 7 | D46: HFC mixtures | E46: R-422A | F46: R-422A | G46: 7 | H46: 1 | I46: HFCs | J46: HFC-134a (1,1,1,2-tetrafluoroethane) | K46: HFC-134a | M46: 0.115 | N46: 1430 | O46: 1430
A47: 38 | B47: of:=TRUE() -> 1 | C47: 7 | D47: HFC mixtures | E47: R-422A | F47: R-422A | G47: 220 | H47: 6 | I47: Non-fluorinated substances | J47: R-600A (Isobutane) | K47: Isobutane | M47: 0.034 | N47: 3 | O47: 0
A48: 39 | B48: of:=TRUE() -> 1 | C48: 7 | D48: HFC mixtures | E48: R-422D | F48: R-422D | G48: 5 | H48: 1 | I48: HFCs | J48: HFC-125 (pentafluoroethane) | K48: HFC-125 | M48: 0.651 | N48: 3500 | O48: 3500
A49: 39 | B49: of:=TRUE() -> 1 | C49: 7 | D49: HFC mixtures | E49: R-422D | F49: R-422D | G49: 7 | H49: 1 | I49: HFCs | J49: HFC-134a (1,1,1,2-tetrafluoroethane) | K49: HFC-134a | M49: 0.315 | N49: 1430 | O49: 1430
A50: 39 | B50: of:=TRUE() -> 1 | C50: 7 | D50: HFC mixtures | E50: R-422D | F50: R-422D | G50: 220 | H50: 6 | I50: Non-fluorinated substances | J50: R-600A (Isobutane) | K50: Isobutane | M50: 0.034 | N50: 3 | O50: 0
A51: 40 | B51: of:=TRUE() -> 1 | C51: 7 | D51: HFC mixtures | E51: R-424A | F51: R-424A | G51: 5 | H51: 1 | I51: HFCs | J51: HFC-125 (pentafluoroethane) | K51: HFC-125 | M51: 0.505 | N51: 3500 | O51: 3500
A52: 40 | B52: of:=TRUE() -> 1 | C52: 7 | D52: HFC mixtures | E52: R-424A | F52: R-424A | G52: 7 | H52: 1 | I52: HFCs | J52: HFC-134a (1,1,1,2-tetrafluoroethane) | K52: HFC-134a | M52: 0.47 | N52: 1430 | O52: 1430
A53: 40 | B53: of:=TRUE() -> 1 | C53: 7 | D53: HFC mixtures | E53: R-424A | F53: R-424A | G53: 219 | H53: 6 | I53: Non-fluorinated substances | J53: R-600 (Butane) | K53: Butane | M53: 0.01 | N53: 4 | O53: 0
A54: 40 | B54: of:=TRUE() -> 1 | C54: 7 | D54: HFC mixtures | E54: R-424A | F54: R-424A | G54: 220 | H54: 6 | I54: Non-fluorinated substances | J54: R-600A (Isobutane) | K54: Isobutane | M54: 0.009 | N54: 3 | O54: 0
A55: 40 | B55: of:=TRUE() -> 1 | C55: 7 | D55: HFC mixtures | E55: R-424A | F55: R-424A | G55: 222 | H55: 6 | I55: Non-fluorinated substances | J55: R-601A (Isopentane) | K55: Isopentane | M55: 0.006 | N55: 5 | O55: 0
A56: 41 | B56: of:=TRUE() -> 1 | C56: 7 | D56: HFC mixtures | E56: R-426A | F56: R-426A | G56: 5 | H56: 1 | I56: HFCs | J56: HFC-125 (pentafluoroethane) | K56: HFC-125 | M56: 0.051 | N56: 3500 | O56: 3500
A57: 41 | B57: of:=TRUE() -> 1 | C57: 7 | D57: HFC mixtures | E57: R-426A | F57: R-426A | G57: 7 | H57: 1 | I57: HFCs | J57: HFC-134a (1,1,1,2-tetrafluoroethane) | K57: HFC-134a | M57: 0.93 | N57: 1430 | O57: 1430
A58: 41 | B58: of:=TRUE() -> 1 | C58: 7 | D58: HFC mixtures | E58: R-426A | F58: R-426A | G58: 219 | H58: 6 | I58: Non-fluorinated substances | J58: R-600 (Butane) | K58: Butane | M58: 0.013 | N58: 4 | O58: 0
A59: 41 | B59: of:=TRUE() -> 1 | C59: 7 | D59: HFC mixtures | E59: R-426A | F59: R-426A | G59: 220 | H59: 6 | I59: Non-fluorinated substances | J59: R-600A (Isobutane) | K59: Isobutane | M59: 0.006 | N59: 3 | O59: 0
A60: 42 | B60: of:=TRUE() -> 1 | C60: 7 | D60: HFC mixtures | E60: R-427A | F60: R-427A | G60: 3 | H60: 1 | I60: HFCs | J60: HFC-32 (difluoromethane) | K60: HFC-32 | M60: 0.15 | N60: 675 | O60: 675
A61: 42 | B61: of:=TRUE() -> 1 | C61: 7 | D61: HFC mixtures | E61: R-427A | F61: R-427A | G61: 5 | H61: 1 | I61: HFCs | J61: HFC-125 (pentafluoroethane) | K61: HFC-125 | M61: 0.25 | N61: 3500 | O61: 3500
A62: 42 | B62: of:=TRUE() -> 1 | C62: 7 | D62: HFC mixtures | E62: R-427A | F62: R-427A | G62: 7 | H62: 1 | I62: HFCs | J62: HFC-134a (1,1,1,2-tetrafluoroethane) | K62: HFC-134a | M62: 0.5 | N62: 1430 | O62: 1430
A63: 42 | B63: of:=TRUE() -> 1 | C63: 7 | D63: HFC mixtures | E63: R-427A | F63: R-427A | G63: 9 | H63: 1 | I63: HFCs | J63: HFC-143a (1,1,1-trifluoroethane) | K63: HFC-143a | M63: 0.1 | N63: 4470 | O63: 4470
A64: 43 | B64: of:=TRUE() -> 1 | C64: 7 | D64: HFC mixtures | E64: R-428A | F64: R-428A | G64: 5 | H64: 1 | I64: HFCs | J64: HFC-125 (pentafluoroethane) | K64: HFC-125 | M64: 0.775 | N64: 3500 | O64: 3500
A65: 43 | B65: of:=TRUE() -> 1 | C65: 7 | D65: HFC mixtures | E65: R-428A | F65: R-428A | G65: 9 | H65: 1 | I65: HFCs | J65: HFC-143a (1,1,1-trifluoroethane) | K65: HFC-143a | M65: 0.2 | N65: 4470 | O65: 4470
A66: 43 | B66: of:=TRUE() -> 1 | C66: 7 | D66: HFC mixtures | E66: R-428A | F66: R-428A | G66: 218 | H66: 6 | I66: Non-fluorinated substances | J66: R-290 (Propane) | K66: Propane | M66: 0.006 | N66: 3 | O66: 0
A67: 43 | B67: of:=TRUE() -> 1 | C67: 7 | D67: HFC mixtures | E67: R-428A | F67: R-428A | G67: 220 | H67: 6 | I67: Non-fluorinated substances | J67: R-600A (Isobutane) | K67: Isobutane | M67: 0.019 | N67: 3 | O67: 0
A68: 44 | B68: of:=TRUE() -> 1 | C68: 7 | D68: HFC mixtures | E68: R-434A | F68: R-434A | G68: 5 | H68: 1 | I68: HFCs | J68: HFC-125 (pentafluoroethane) | K68: HFC-125 | M68: 0.632 | N68: 3500 | O68: 3500
A69: 44 | B69: of:=TRUE() -> 1 | C69: 7 | D69: HFC mixtures | E69: R-434A | F69: R-434A | G69: 7 | H69: 1 | I69: HFCs | J69: HFC-134a (1,1,1,2-tetrafluoroethane) | K69: HFC-134a | M69: 0.16 | N69: 1430 | O69: 1430
A70: 44 | B70: of:=TRUE() -> 1 | C70: 7 | D70: HFC mixtures | E70: R-434A | F70: R-434A | G70: 9 | H70: 1 | I70: HFCs | J70: HFC-143a (1,1,1-trifluoroethane) | K70: HFC-143a | M70: 0.18 | N70: 4470 | O70: 4470
A71: 44 | B71: of:=TRUE() -> 1 | C71: 7 | D71: HFC mixtures | E71: R-434A | F71: R-434A | G71: 220 | H71: 6 | I71: Non-fluorinated substances | J71: R-600A (Isobutane) | K71: Isobutane | M71: 0.028 | N71: 3 | O71: 0
A72: 45 | B72: of:=TRUE() -> 1 | C72: 7 | D72: HFC mixtures | E72: R-437A | F72: R-437A | G72: 5 | H72: 1 | I72: HFCs | J72: HFC-125 (pentafluoroethane) | K72: HFC-125 | M72: 0.195 | N72: 3500 | O72: 3500
A73: 45 | B73: of:=TRUE() -> 1 | C73: 7 | D73: HFC mixtures | E73: R-437A | F73: R-437A | G73: 7 | H73: 1 | I73: HFCs | J73: HFC-134a (1,1,1,2-tetrafluoroethane) | K73: HFC-134a | M73: 0.785 | N73: 1430 | O73: 1430
A74: 45 | B74: of:=TRUE() -> 1 | C74: 7 | D74: HFC mixtures | E74: R-437A | F74: R-437A | G74: 219 | H74: 6 | I74: Non-fluorinated substances | J74: R-600 (Butane) | K74: Butane | M74: 0.014 | N74: 4 | O74: 0
A75: 45 | B75: of:=TRUE() -> 1 | C75: 7 | D75: HFC mixtures | E75: R-437A | F75: R-437A | G75: 221 | H75: 6 | I75: Non-fluorinated substances | J75: R-601 (Pentane) | K75: Pentane | M75: 0.006 | N75: 5 | O75: 0
A76: 46 | B76: of:=TRUE() -> 1 | C76: 7 | D76: HFC mixtures | E76: R-508B | F76: R-508B | G76: 2 | H76: 1 | I76: HFCs | J76: HFC-23 (trifluoromethane, fluoroform) | K76: HFC-23 | M76: 0.46 | N76: 14800 | O76: 14800
A77: 46 | B77: of:=TRUE() -> 1 | C77: 7 | D77: HFC mixtures | E77: R-508B | F77: R-508B | G77: 20 | H77: 2 | I77: PFCs | J77: PFC-116 (C2F6) | K77: PFC-116 | M77: 0.54 | N77: 12200 | O77: 0
A78: 48 | B78: of:=FALSE() -> 0 | C78: 7 | D78: HFC mixtures | E78: R-407D | F78: R-407D | G78: 3 | H78: 1 | I78: HFCs | J78: HFC-32 (difluoromethane) | K78: HFC-32 | M78: 0.15 | N78: 675 | O78: 675
A79: 48 | B79: of:=FALSE() -> 0 | C79: 7 | D79: HFC mixtures | E79: R-407D | F79: R-407D | G79: 5 | H79: 1 | I79: HFCs | J79: HFC-125 (pentafluoroethane) | K79: HFC-125 | M79: 0.15 | N79: 3500 | O79: 3500
A80: 48 | B80: of:=FALSE() -> 0 | C80: 7 | D80: HFC mixtures | E80: R-407D | F80: R-407D | G80: 7 | H80: 1 | I80: HFCs | J80: HFC-134a (1,1,1,2-tetrafluoroethane) | K80: HFC-134a | M80: 0.7 | N80: 1430 | O80: 1430
A81: 49 | B81: of:=FALSE() -> 0 | C81: 7 | D81: HFC mixtures | E81: R-408A | F81: R-408A | G81: 5 | H81: 1 | I81: HFCs | J81: HFC-125 (pentafluoroethane) | K81: HFC-125 | M81: 0.07 | N81: 3500 | O81: 3500
A82: 49 | B82: of:=FALSE() -> 0 | C82: 7 | D82: HFC mixtures | E82: R-408A | F82: R-408A | G82: 9 | H82: 1 | I82: HFCs | J82: HFC-143a (1,1,1-trifluoroethane) | K82: HFC-143a | M82: 0.46 | N82: 4470 | O82: 4470
A83: 49 | B83: of:=FALSE() -> 0 | C83: 7 | D83: HFC mixtures | E83: R-408A | F83: R-408A | G83: 128 | H83: 11 | I83: Other gases | J83: Other (no F-gas of Regulation 517/2014) | K83: Other | M83: 0.47
A84: 52 | B84: of:=TRUE() -> 1 | C84: 7 | D84: HFC mixtures | E84: R-413A | F84: R-413A | G84: 7 | H84: 1 | I84: HFCs | J84: HFC-134a (1,1,1,2-tetrafluoroethane) | K84: HFC-134a | M84: 0.88 | N84: 1430 | O84: 1430
A85: 52 | B85: of:=TRUE() -> 1 | C85: 7 | D85: HFC mixtures | E85: R-413A | F85: R-413A | G85: 21 | H85: 2 | I85: PFCs | J85: PFC-218 (C3F8) | K85: PFC-218 | M85: 0.09 | N85: 8830 | O85: 8830
A86: 52 | B86: of:=TRUE() -> 1 | C86: 7 | D86: HFC mixtures | E86: R-413A | F86: R-413A | G86: 220 | H86: 6 | I86: Non-fluorinated substances | J86: R-600A (Isobutane) | K86: Isobutane | M86: 0.03 | N86: 3 | O86: 3
A87: 54 | B87: of:=TRUE() -> 1 | C87: 7 | D87: HFC mixtures | E87: R-422B | F87: R-422B | G87: 5 | H87: 1 | I87: HFCs | J87: HFC-125 (pentafluoroethane) | K87: HFC-125 | M87: 0.55 | N87: 3500 | O87: 3500
A88: 54 | B88: of:=TRUE() -> 1 | C88: 7 | D88: HFC mixtures | E88: R-422B | F88: R-422B | G88: 7 | H88: 1 | I88: HFCs | J88: HFC-134a (1,1,1,2-tetrafluoroethane) | K88: HFC-134a | M88: 0.42 | N88: 1430 | O88: 1430
A89: 54 | B89: of:=TRUE() -> 1 | C89: 7 | D89: HFC mixtures | E89: R-422B | F89: R-422B | G89: 219 | H89: 6 | I89: Non-fluorinated substances | J89: R-600 (Butane) | K89: Butane | M89: 0.03 | N89: 4 | O89: 4
A90: 70 | B90: of:=FALSE() -> 0 | C90: 7 | D90: HFC mixtures | E90: Mix: HFC-227ea:13%; HFC-365mfc:87% | F90: Mix: HFC-227ea:13%; HFC-365mfc:87% | G90: 11 | H90: 1 | I90: HFCs | J90: HFC-227ea (1,1,1,2,3,3,3-heptafluoropropane) | K90: HFC-227ea | M90: 0.13 | N90: 3220 | O90: 3220
A91: 70 | B91: of:=FALSE() -> 0 | C91: 7 | D91: HFC mixtures | E91: Mix: HFC-227ea:13%; HFC-365mfc:87% | F91: Mix: HFC-227ea:13%; HFC-365mfc:87% | G91: 17 | H91: 1 | I91: HFCs | J91: HFC-365mfc (1,1,1,3,3-pentafluorobutane) | K91: HFC-365mfc | M91: 0.87 | N91: 794 | O91: 794
A92: 80 | B92: of:=TRUE() -> 1 | C92: 7 | D92: HFC mixtures | E92: R-423A | F92: R-423A | G92: 7 | H92: 1 | I92: HFCs | J92: HFC-134a (1,1,1,2-tetrafluoroethane) | K92: HFC-134a | M92: 0.525 | N92: 1430 | O92: 1430
A93: 80 | B93: of:=TRUE() -> 1 | C93: 7 | D93: HFC mixtures | E93: R-423A | F93: R-423A | G93: 11 | H93: 1 | I93: HFCs | J93: HFC-227ea (1,1,1,2,3,3,3-heptafluoropropane) | K93: HFC-227ea | M93: 0.475 | N93: 3220 | O93: 3220
A94: 85 | B94: of:=TRUE() -> 1 | C94: 7 | D94: HFC mixtures | E94: R-401A | F94: R-401A | G94: 10 | H94: 1 | I94: HFCs | J94: HFC-152a (1,1-difluoroethane) | K94: HFC-152a | M94: 0.13 | N94: 124 | O94: 124
A95: 85 | B95: of:=TRUE() -> 1 | C95: 7 | D95: HFC mixtures | E95: R-401A | F95: R-401A | G95: 128 | H95: 11 | I95: Other gases | J95: Other (no F-gas of Regulation 517/2014) | K95: Other | M95: 0.87
A96: 86 | B96: of:=FALSE() -> 0 | C96: 7 | D96: HFC mixtures | E96: R-401B | F96: R-401B | G96: 10 | H96: 1 | I96: HFCs | J96: HFC-152a (1,1-difluoroethane) | K96: HFC-152a | M96: 0.11 | N96: 124 | O96: 124
A97: 86 | B97: of:=FALSE() -> 0 | C97: 7 | D97: HFC mixtures | E97: R-401B | F97: R-401B | G97: 128 | H97: 11 | I97: Other gases | J97: Other (no F-gas of Regulation 517/2014) | K97: Other | M97: 0.89
A98: 87 | B98: of:=FALSE() -> 0 | C98: 7 | D98: HFC mixtures | E98: R-402A | F98: R-402A | G98: 5 | H98: 1 | I98: HFCs | J98: HFC-125 (pentafluoroethane) | K98: HFC-125 | M98: 0.6 | N98: 3500 | O98: 3500
A99: 87 | B99: of:=FALSE() -> 0 | C99: 7 | D99: HFC mixtures | E99: R-402A | F99: R-402A | G99: 128 | H99: 11 | I99: Other gases | J99: Other (no F-gas of Regulation 517/2014) | K99: Other | L99: HCFC-22 | M99: 0.38
A100: 87 | B100: of:=FALSE() -> 0 | C100: 7 | D100: HFC mixtures | E100: R-402A | F100: R-402A | G100: 218 | H100: 6 | I100: Non-fluorinated substances | J100: R-290 (Propane) | K100: Propane | M100: 0.02 | N100: 3 | O100: 3
A101: 89 | B101: of:=TRUE() -> 1 | C101: 7 | D101: HFC mixtures | E101: R-407A | F101: R-407A | G101: 3 | H101: 1 | I101: HFCs | J101: HFC-32 (difluoromethane) | K101: HFC-32 | M101: 0.2 | N101: 675 | O101: 675
A102: 89 | B102: of:=TRUE() -> 1 | C102: 7 | D102: HFC mixtures | E102: R-407A | F102: R-407A | G102: 5 | H102: 1 | I102: HFCs | J102: HFC-125 (pentafluoroethane) | K102: HFC-125 | M102: 0.4 | N102: 3500 | O102: 3500
A103: 89 | B103: of:=TRUE() -> 1 | C103: 7 | D103: HFC mixtures | E103: R-407A | F103: R-407A | G103: 7 | H103: 1 | I103: HFCs | J103: HFC-134a (1,1,1,2-tetrafluoroethane) | K103: HFC-134a | M103: 0.4 | N103: 1430 | O103: 1430
A104: 91 | B104: of:=TRUE() -> 1 | C104: 7 | D104: HFC mixtures | E104: R-407F | F104: R-407F | G104: 3 | H104: 1 | I104: HFCs | J104: HFC-32 (difluoromethane) | K104: HFC-32 | M104: 0.3 | N104: 675 | O104: 675
A105: 91 | B105: of:=TRUE() -> 1 | C105: 7 | D105: HFC mixtures | E105: R-407F | F105: R-407F | G105: 5 | H105: 1 | I105: HFCs | J105: HFC-125 (pentafluoroethane) | K105: HFC-125 | M105: 0.3 | N105: 3500 | O105: 3500
A106: 91 | B106: of:=TRUE() -> 1 | C106: 7 | D106: HFC mixtures | E106: R-407F | F106: R-407F | G106: 7 | H106: 1 | I106: HFCs | J106: HFC-134a (1,1,1,2-tetrafluoroethane) | K106: HFC-134a | M106: 0.4 | N106: 1430 | O106: 1430
A107: 96 | B107: of:=TRUE() -> 1 | C107: 7 | D107: HFC mixtures | E107: R-508A | F107: R-508A | G107: 2 | H107: 1 | I107: HFCs | J107: HFC-23 (trifluoromethane, fluoroform) | K107: HFC-23 | M107: 0.39 | N107: 14800 | O107: 14800
A108: 96 | B108: of:=TRUE() -> 1 | C108: 7 | D108: HFC mixtures | E108: R-508A | F108: R-508A | G108: 20 | H108: 2 | I108: PFCs | J108: PFC-116 (C2F6) | K108: PFC-116 | M108: 0.61 | N108: 12200 | O108: 12200
A109: 104 | B109: of:=FALSE() -> 0 | C109: 9 | D109: Non-HFC mixtures | E109: R-403B | F109: R-403B | G109: 21 | H109: 2 | I109: PFCs | J109: PFC-218 (C3F8) | K109: PFC-218 | M109: 0.39 | N109: 8830 | O109: 8830
A110: 104 | B110: of:=FALSE() -> 0 | C110: 9 | D110: Non-HFC mixtures | E110: R-403B | F110: R-403B | G110: 128 | H110: 11 | I110: Other gases | J110: Other (no F-gas of Regulation 517/2014) | K110: Other | M110: 0.61
A111: 128 | B111: of:=FALSE() -> 0 | C111: 11 | D111: Other gases | E111: Other (no F-gas of Regulation 517/2014) | F111: Other | G111: 128 | H111: 11 | I111: Other gases | J111: Other (no F-gas of Regulation 517/2014) | K111: Other | M111: 1
A112: 135 | B112: of:=FALSE() -> 0 | C112: 7 | D112: HFC mixtures | E112: Mix: HFC-134a: 12%; Other (no F-gas of Regulation (EC) 842/2006): 88%; | F112: Mix: HFC-134a: 12%; Other (no F-gas of Regulation (EC) 842/2006): 88%; | G112: 7 | H112: 1 | I112: HFCs | J112: HFC-134a (1,1,1,2-tetrafluoroethane) | K112: HFC-134a | M112: 0.12 | N112: 1430 | O112: 1430
A113: 135 | B113: of:=FALSE() -> 0 | C113: 7 | D113: HFC mixtures | E113: Mix: HFC-134a: 12%; Other (no F-gas of Regulation (EC) 842/2006): 88%; | F113: Mix: HFC-134a: 12%; Other (no F-gas of Regulation (EC) 842/2006): 88%; | G113: 128 | H113: 11 | I113: Other gases | J113: Other (no F-gas of Regulation 517/2014) | K113: Other | M113: 0.88
A114: 136 | B114: of:=FALSE() -> 0 | C114: 7 | D114: HFC mixtures | E114: Mix: HFC-152a: 50%; Other (no F-gas of Regulation (EC) 842/2006): 50%; | F114: Mix: HFC-152a: 50%; Other (no F-gas of Regulation (EC) 842/2006): 50%; | G114: 10 | H114: 1 | I114: HFCs | J114: HFC-152a (1,1-difluoroethane) | K114: HFC-152a | M114: 0.5 | N114: 124 | O114: 124
A115: 136 | B115: of:=FALSE() -> 0 | C115: 7 | D115: HFC mixtures | E115: Mix: HFC-152a: 50%; Other (no F-gas of Regulation (EC) 842/2006): 50%; | F115: Mix: HFC-152a: 50%; Other (no F-gas of Regulation (EC) 842/2006): 50%; | G115: 128 | H115: 11 | I115: Other gases | J115: Other (no F-gas of Regulation 517/2014) | K115: Other | M115: 0.5
A116: 137 | B116: of:=TRUE() -> 1 | C116: 7 | D116: HFC mixtures | E116: R-417B | F116: R-417B | G116: 5 | H116: 1 | I116: HFCs | J116: HFC-125 (pentafluoroethane) | K116: HFC-125 | M116: 0.79 | N116: 3500 | O116: 3500
A117: 137 | B117: of:=TRUE() -> 1 | C117: 7 | D117: HFC mixtures | E117: R-417B | F117: R-417B | G117: 7 | H117: 1 | I117: HFCs | J117: HFC-134a (1,1,1,2-tetrafluoroethane) | K117: HFC-134a | M117: 0.183 | N117: 1430 | O117: 1430
A118: 137 | B118: of:=TRUE() -> 1 | C118: 7 | D118: HFC mixtures | E118: R-417B | F118: R-417B | G118: 219 | H118: 6 | I118: Non-fluorinated substances | J118: R-600 (Butane) | K118: Butane | M118: 0.027 | N118: 4 | O118: 4
A119: 140 | B119: of:=FALSE() -> 0 | C119: 9 | D119: Non-HFC mixtures | E119: Mix: C2F6: 6.5%; Other (no F-gas of Regulation (EC) 842/2006): 93.5% | F119: Mix: C2F6: 6.5%; Other (no F-gas of Regulation (EC) 842/2006): 93.5% | G119: 20 | H119: 2 | I119: PFCs | J119: PFC-116 (C2F6) | K119: PFC-116 | M119: 0.065 | N119: 12200 | O119: 12200
A120: 140 | B120: of:=FALSE() -> 0 | C120: 9 | D120: Non-HFC mixtures | E120: Mix: C2F6: 6.5%; Other (no F-gas of Regulation (EC) 842/2006): 93.5% | F120: Mix: C2F6: 6.5%; Other (no F-gas of Regulation (EC) 842/2006): 93.5% | G120: 128 | H120: 11 | I120: Other gases | J120: Other (no F-gas of Regulation 517/2014) | K120: Other | L120: oxygen | M120: 0.935
A121: 143 | B121: of:=FALSE() -> 0 | C121: 1 | D121: HFCs | E121: HFC-152 (1,2-difluoroethane) | F121: HFC-152 | G121: 129 | H121: 1 | I121: HFCs | J121: HFC-152 (1,2-difluoroethane) | K121: HFC-152 | M121: 1 | N121: 53 | O121: 53
A122: 144 | B122: of:=FALSE() -> 0 | C122: 1 | D122: HFCs | E122: HFC-161 (fluoroethane, ethyl fluoride) | F122: HFC-161 | G122: 130 | H122: 1 | I122: HFCs | J122: HFC-161 (fluoroethane, ethyl fluoride) | K122: HFC-161 | M122: 1 | N122: 12 | O122: 12
A123: 145 | B123: of:=FALSE() -> 0 | C123: 3 | D123: Unsaturated HFCs and HCFCs | E123: HCFC-1233xf | F123: HCFC-1233xf | G123: 138 | H123: 3 | I123: Unsaturated HFCs and HCFCs | J123: HCFC-1233xf | K123: HCFC-1233xf | M123: 1 | N123: 1 | O123: 1
A124: 146 | B124: of:=FALSE() -> 0 | C124: 3 | D124: Unsaturated HFCs and HCFCs | E124: HCFC-1233zd | F124: HCFC-1233zd | G124: 137 | H124: 3 | I124: Unsaturated HFCs and HCFCs | J124: HCFC-1233zd | K124: HCFC-1233zd | M124: 1 | N124: 4.5 | O124: 4.5
A125: 147 | B125: of:=FALSE() -> 0 | C125: 3 | D125: Unsaturated HFCs and HCFCs | E125: HFC-1234ze | F125: HFC-1234ze | G125: 135 | H125: 3 | I125: Unsaturated HFCs and HCFCs | J125: HFC-1234ze | K125: HFC-1234ze | M125: 1 | N125: 7 | O125: 7
A126: 148 | B126: of:=FALSE() -> 0 | C126: 3 | D126: Unsaturated HFCs and HCFCs | E126: HFC-1336mzz | F126: HFC-1336mzz | G126: 136 | H126: 3 | I126: Unsaturated HFCs and HCFCs | J126: HFC-1336mzz | K126: HFC-1336mzz | M126: 1 | N126: 9 | O126: 9
A127: 149 | B127: of:=FALSE() -> 0 | C127: 4 | D127: HFEs and alcohols | E127: - (CF2)4CH (OH) - | F127: - (CF2)4CH (OH) - | G127: 206 | H127: 4 | I127: HFEs and alcohols | J127: - (CF2)4CH (OH) - | K127: - (CF2)4CH (OH) - | M127: 1 | N127: 73 | O127: 73
A128: 150 | B128: of:=FALSE() -> 0 | C128: 4 | D128: HFEs and alcohols | E128: 2,2,3,3,3-pentafluoropropanol | F128: 2,2,3,3,3-pentafluoropropanol | G128: 189 | H128: 4 | I128: HFEs and alcohols | J128: 2,2,3,3,3-pentafluoropropanol | K128: 2,2,3,3,3-pentafluoropropanol | M128: 1 | N128: 42 | O128: 42
A129: 151 | B129: of:=FALSE() -> 0 | C129: 4 | D129: HFEs and alcohols | E129: bis(trifluoromethyl)-methanol | F129: bis(trifluoromethyl)-methanol | G129: 190 | H129: 4 | I129: HFEs and alcohols | J129: bis(trifluoromethyl)-methanol | K129: bis(trifluoromethyl)-methanol | M129: 1 | N129: 195 | O129: 195
A130: 152 | B130: of:=FALSE() -> 0 | C130: 4 | D130: HFEs and alcohols | E130: HCFE-235da2 (isofluorane) | F130: HCFE-235da2 (isofluorane) | G130: 176 | H130: 4 | I130: HFEs and alcohols | J130: HCFE-235da2 (isofluorane) | K130: HCFE-235da2 (isofluorane) | M130: 1 | N130: 350 | O130: 350
A131: 153 | B131: of:=FALSE() -> 0 | C131: 4 | D131: HFEs and alcohols | E131: HFE 263fb2 | F131: HFE 263fb2 | G131: 195 | H131: 4 | I131: HFEs and alcohols | J131: HFE 263fb2 | K131: HFE 263fb2 | M131: 1 | N131: 11 | O131: 11
A132: 154 | B132: of:=FALSE() -> 0 | C132: 4 | D132: HFEs and alcohols | E132: HFE 365 mcf3 | F132: HFE 365 mcf3 | G132: 204 | H132: 4 | I132: HFEs and alcohols | J132: HFE 365 mcf3 | K132: HFE 365 mcf3 | M132: 1 | N132: 11 | O132: 11
A133: 155 | B133: of:=FALSE() -> 0 | C133: 4 | D133: HFEs and alcohols | E133: HFE-125 | F133: HFE-125 | G133: 173 | H133: 4 | I133: HFEs and alcohols | J133: HFE-125 | K133: HFE-125 | M133: 1 | N133: 14900 | O133: 14900
A134: 156 | B134: of:=FALSE() -> 0 | C134: 4 | D134: HFEs and alcohols | E134: HFE-134 | F134: HFE-134 | G134: 174 | H134: 4 | I134: HFEs and alcohols | J134: HFE-134 | K134: HFE-134 | M134: 1 | N134: 6320 | O134: 6320
A135: 157 | B135: of:=FALSE() -> 0 | C135: 4 | D135: HFEs and alcohols | E135: HFE-143a | F135: HFE-143a | G135: 175 | H135: 4 | I135: HFEs and alcohols | J135: HFE-143a | K135: HFE-143a | M135: 1 | N135: 756 | O135: 756
A136: 158 | B136: of:=FALSE() -> 0 | C136: 4 | D136: HFEs and alcohols | E136: HFE-227ea | F136: HFE-227ea | G136: 191 | H136: 4 | I136: HFEs and alcohols | J136: HFE-227ea | K136: HFE-227ea | M136: 1 | N136: 1540 | O136: 1540
A137: 159 | B137: of:=FALSE() -> 0 | C137: 4 | D137: HFEs and alcohols | E137: HFE-236ca12 (HG-10) | F137: HFE-236ca12 (HG-10) | G137: 186 | H137: 4 | I137: HFEs and alcohols | J137: HFE-236ca12 (HG-10) | K137: HFE-236ca12 (HG-10) | M137: 1 | N137: 2800 | O137: 2800
A138: 160 | B138: of:=FALSE() -> 0 | C138: 4 | D138: HFEs and alcohols | E138: HFE-236ea2 (desfluoran) | F138: HFE-236ea2 (desfluoran) | G138: 192 | H138: 4 | I138: HFEs and alcohols | J138: HFE-236ea2 (desfluoran) | K138: HFE-236ea2 (desfluoran) | M138: 1 | N138: 989 | O138: 989
A139: 161 | B139: of:=FALSE() -> 0 | C139: 4 | D139: HFEs and alcohols | E139: HFE-236fa | F139: HFE-236fa | G139: 193 | H139: 4 | I139: HFEs and alcohols | J139: HFE-236fa | K139: HFE-236fa | M139: 1 | N139: 487 | O139: 487
A140: 162 | B140: of:=FALSE() -> 0 | C140: 4 | D140: HFEs and alcohols | E140: HFE-245cb2 | F140: HFE-245cb2 | G140: 177 | H140: 4 | I140: HFEs and alcohols | J140: HFE-245cb2 | K140: HFE-245cb2 | M140: 1 | N140: 708 | O140: 708
A141: 163 | B141: of:=FALSE() -> 0 | C141: 4 | D141: HFEs and alcohols | E141: HFE-245fa1 | F141: HFE-245fa1 | G141: 194 | H141: 4 | I141: HFEs and alcohols | J141: HFE-245fa1 | K141: HFE-245fa1 | M141: 1 | N141: 286 | O141: 286
A142: 164 | B142: of:=FALSE() -> 0 | C142: 4 | D142: HFEs and alcohols | E142: HFE-245fa2 | F142: HFE-245fa2 | G142: 178 | H142: 4 | I142: HFEs and alcohols | J142: HFE-245fa2 | K142: HFE-245fa2 | M142: 1 | N142: 659 | O142: 659
A143: 165 | B143: of:=FALSE() -> 0 | C143: 4 | D143: HFEs and alcohols | E143: HFE-254cb2 | F143: HFE-254cb2 | G143: 179 | H143: 4 | I143: HFEs and alcohols | J143: HFE-254cb2 | K143: HFE-254cb2 | M143: 1 | N143: 359 | O143: 359
A144: 166 | B144: of:=FALSE() -> 0 | C144: 4 | D144: HFEs and alcohols | E144: HFE-329 mcc2 | F144: HFE-329 mcc2 | G144: 196 | H144: 4 | I144: HFEs and alcohols | J144: HFE-329 mcc2 | K144: HFE-329 mcc2 | M144: 1 | N144: 919 | O144: 919
A145: 167 | B145: of:=FALSE() -> 0 | C145: 4 | D145: HFEs and alcohols | E145: HFE-338 mcf2 | F145: HFE-338 mcf2 | G145: 197 | H145: 4 | I145: HFEs and alcohols | J145: HFE-338 mcf2 | K145: HFE-338 mcf2 | M145: 1 | N145: 552 | O145: 552
A146: 168 | B146: of:=FALSE() -> 0 | C146: 4 | D146: HFEs and alcohols | E146: HFE-338mmz1 | F146: HFE-338mmz1 | G146: 198 | H146: 4 | I146: HFEs and alcohols | J146: HFE-338mmz1 | K146: HFE-338mmz1 | M146: 1 | N146: 380 | O146: 380
A147: 169 | B147: of:=FALSE() -> 0 | C147: 4 | D147: HFEs and alcohols | E147: HFE-338pcc13 (HG-01) | F147: HFE-338pcc13 (HG-01) | G147: 187 | H147: 4 | I147: HFEs and alcohols | J147: HFE-338pcc13 (HG-01) | K147: HFE-338pcc13 (HG-01) | M147: 1 | N147: 1500 | O147: 1500
A148: 170 | B148: of:=FALSE() -> 0 | C148: 4 | D148: HFEs and alcohols | E148: HFE-347 mcc3 (HFE-7000) | F148: HFE-347 mcc3 (HFE-7000) | G148: 180 | H148: 4 | I148: HFEs and alcohols | J148: HFE-347 mcc3 (HFE-7000) | K148: HFE-347 mcc3 (HFE-7000) | M148: 1 | N148: 575 | O148: 575
A149: 171 | B149: of:=FALSE() -> 0 | C149: 4 | D149: HFEs and alcohols | E149: HFE-347 mcf2 | F149: HFE-347 mcf2 | G149: 199 | H149: 4 | I149: HFEs and alcohols | J149: HFE-347 mcf2 | K149: HFE-347 mcf2 | M149: 1 | N149: 374 | O149: 374
A150: 172 | B150: of:=FALSE() -> 0 | C150: 4 | D150: HFEs and alcohols | E150: HFE-347mmy1 | F150: HFE-347mmy1 | G150: 188 | H150: 4 | I150: HFEs and alcohols | J150: HFE-347mmy1 | K150: HFE-347mmy1 | M150: 1 | N150: 343 | O150: 343
A151: 173 | B151: of:=FALSE() -> 0 | C151: 4 | D151: HFEs and alcohols | E151: HFE-347pcf2 | F151: HFE-347pcf2 | G151: 181 | H151: 4 | I151: HFEs and alcohols | J151: HFE-347pcf2 | K151: HFE-347pcf2 | M151: 1 | N151: 580 | O151: 580
A152: 174 | B152: of:=FALSE() -> 0 | C152: 4 | D152: HFEs and alcohols | E152: HFE-356 mec3 | F152: HFE-356 mec3 | G152: 200 | H152: 4 | I152: HFEs and alcohols | J152: HFE-356 mec3 | K152: HFE-356 mec3 | M152: 1 | N152: 101 | O152: 101
A153: 175 | B153: of:=FALSE() -> 0 | C153: 4 | D153: HFEs and alcohols | E153: HFE-356mm1 | F153: HFE-356mm1 | G153: 201 | H153: 4 | I153: HFEs and alcohols | J153: HFE-356mm1 | K153: HFE-356mm1 | M153: 1 | N153: 27 | O153: 27
A154: 176 | B154: of:=FALSE() -> 0 | C154: 4 | D154: HFEs and alcohols | E154: HFE-356pcc3 | F154: HFE-356pcc3 | G154: 182 | H154: 4 | I154: HFEs and alcohols | J154: HFE-356pcc3 | K154: HFE-356pcc3 | M154: 1 | N154: 110 | O154: 110
A155: 177 | B155: of:=FALSE() -> 0 | C155: 4 | D155: HFEs and alcohols | E155: HFE-356pcf2 | F155: HFE-356pcf2 | G155: 202 | H155: 4 | I155: HFEs and alcohols | J155: HFE-356pcf2 | K155: HFE-356pcf2 | M155: 1 | N155: 265 | O155: 265
A156: 178 | B156: of:=FALSE() -> 0 | C156: 4 | D156: HFEs and alcohols | E156: HFE-356pcf3 | F156: HFE-356pcf3 | G156: 203 | H156: 4 | I156: HFEs and alcohols | J156: HFE-356pcf3 | K156: HFE-356pcf3 | M156: 1 | N156: 502 | O156: 502
A157: 179 | B157: of:=FALSE() -> 0 | C157: 4 | D157: HFEs and alcohols | E157: HFE-374pc2 | F157: HFE-374pc2 | G157: 205 | H157: 4 | I157: HFEs and alcohols | J157: HFE-374pc2 | K157: HFE-374pc2 | M157: 1 | N157: 557 | O157: 557
A158: 180 | B158: of:=FALSE() -> 0 | C158: 4 | D158: HFEs and alcohols | E158: HFE-43-10pccc124 (H-Galden 1040x) HG-11 | F158: HFE-43-10pccc124 (H-Galden 1040x) HG-11 | G158: 185 | H158: 4 | I158: HFEs and alcohols | J158: HFE-43-10pccc124 (H-Galden 1040x) HG-11 | K158: HFE-43-10pccc124 (H-Galden 1040x) HG-11 | M158: 1 | N158: 1870 | O158: 1870
A159: 181 | B159: of:=FALSE() -> 0 | C159: 4 | D159: HFEs and alcohols | E159: HFE-449sl (HFE-7100) | F159: HFE-449sl (HFE-7100) | G159: 183 | H159: 4 | I159: HFEs and alcohols | J159: HFE-449sl (HFE-7100) | K159: HFE-449sl (HFE-7100) | M159: 1 | N159: 297 | O159: 297
A160: 182 | B160: of:=FALSE() -> 0 | C160: 4 | D160: HFEs and alcohols | E160: HFE-569sf2 (HFE-7200) | F160: HFE-569sf2 (HFE-7200) | G160: 184 | H160: 4 | I160: HFEs and alcohols | J160: HFE-569sf2 (HFE-7200) | K160: HFE-569sf2 (HFE-7200) | M160: 1 | N160: 59 | O160: 59
A161: 183 | B161: of:=FALSE() -> 0 | C161: 5 | D161: Other perfluorinated compounds | E161: NF3 (nitrogen trifluoride) | F161: nitrogen trifluoride | G161: 208 | H161: 5 | I161: Other perfluorinated compounds | J161: NF3 (nitrogen trifluoride) | K161: nitrogen trifluoride | M161: 1 | N161: 17200 | O161: 17200
A162: 184 | B162: of:=FALSE() -> 0 | C162: 5 | D162: Other perfluorinated compounds | E162: c-C3F6 (perfluorocyclopropane) | F162: perfluorocyclopropane | G162: 210 | H162: 5 | I162: Other perfluorinated compounds | J162: c-C3F6 (perfluorocyclopropane) | K162: perfluorocyclopropane | M162: 1 | N162: 17340 | O162: 17340
A163: 185 | B163: of:=FALSE() -> 0 | C163: 5 | D163: Other perfluorinated compounds | E163: PFPMIE (perfluoropolymethylisopropylether) | F163: perfluoropolymethylisopropylether (PFPMIE) | G163: 207 | H163: 5 | I163: Other perfluorinated compounds | J163: PFPMIE (perfluoropolymethylisopropylether) | K163: perfluoropolymethylisopropylether (PFPMIE) | M163: 1 | N163: 10300 | O163: 10300
A164: 186 | B164: of:=FALSE() -> 0 | C164: 5 | D164: Other perfluorinated compounds | E164: SF5CF3 (trifluoromethyl sulphur pentafluoride) | F164: trifluoromethyl sulphur pentafluoride | G164: 209 | H164: 5 | I164: Other perfluorinated compounds | J164: SF5CF3 (trifluoromethyl sulphur pentafluoride) | K164: trifluoromethyl sulphur pentafluoride | M164: 1 | N164: 17700 | O164: 17700
A165: 187 | B165: of:=TRUE() -> 1 | C165: 7 | D165: HFC mixtures | E165: Unspecified mix of F-gases containing HFCs for destruction | F165: Unspecified mix of F-gases containing HFCs for destruction | G165: 230 | H165: 1 | I165: HFCs | J165: unspecified gas for destruction | K165: unspecified gas for destruction | M165: 1 | N165: 0 | O165: 0
A166: 188 | B166: of:=TRUE() -> 1 | C166: 7 | D166: HFC mixtures | E166: R-442A | F166: R-442A | G166: 3 | H166: 1 | I166: HFCs | J166: HFC-32 (difluoromethane) | K166: HFC-32 | M166: 0.31 | N166: 675 | O166: 675
A167: 188 | B167: of:=TRUE() -> 1 | C167: 7 | D167: HFC mixtures | E167: R-442A | F167: R-442A | G167: 5 | H167: 1 | I167: HFCs | J167: HFC-125 (pentafluoroethane) | K167: HFC-125 | M167: 0.31 | N167: 3500 | O167: 3500
A168: 188 | B168: of:=TRUE() -> 1 | C168: 7 | D168: HFC mixtures | E168: R-442A | F168: R-442A | G168: 7 | H168: 1 | I168: HFCs | J168: HFC-134a (1,1,1,2-tetrafluoroethane) | K168: HFC-134a | M168: 0.3 | N168: 1430 | O168: 1430
A169: 188 | B169: of:=TRUE() -> 1 | C169: 7 | D169: HFC mixtures | E169: R-442A | F169: R-442A | G169: 10 | H169: 1 | I169: HFCs | J169: HFC-152a (1,1-difluoroethane) | K169: HFC-152a | M169: 0.03 | N169: 124 | O169: 124
A170: 188 | B170: of:=TRUE() -> 1 | C170: 7 | D170: HFC mixtures | E170: R-442A | F170: R-442A | G170: 11 | H170: 1 | I170: HFCs | J170: HFC-227ea (1,1,1,2,3,3,3-heptafluoropropane) | K170: HFC-227ea | M170: 0.05 | N170: 3220 | O170: 3220
A171: 189 | B171: of:=TRUE() -> 1 | C171: 7 | D171: HFC mixtures | E171: R-438A | F171: R-438A | G171: 3 | H171: 1 | I171: HFCs | J171: HFC-32 (difluoromethane) | K171: HFC-32 | M171: 0.085 | N171: 675 | O171: 675
A172: 189 | B172: of:=TRUE() -> 1 | C172: 7 | D172: HFC mixtures | E172: R-438A | F172: R-438A | G172: 5 | H172: 1 | I172: HFCs | J172: HFC-125 (pentafluoroethane) | K172: HFC-125 | M172: 0.45 | N172: 3500 | O172: 3500
A173: 189 | B173: of:=TRUE() -> 1 | C173: 7 | D173: HFC mixtures | E173: R-438A | F173: R-438A | G173: 7 | H173: 1 | I173: HFCs | J173: HFC-134a (1,1,1,2-tetrafluoroethane) | K173: HFC-134a | M173: 0.442 | N173: 1430 | O173: 1430
A174: 189 | B174: of:=TRUE() -> 1 | C174: 7 | D174: HFC mixtures | E174: R-438A | F174: R-438A | G174: 219 | H174: 6 | I174: Non-fluorinated substances | J174: R-600 (Butane) | K174: Butane | M174: 0.017 | N174: 4 | O174: 4
A175: 189 | B175: of:=TRUE() -> 1 | C175: 7 | D175: HFC mixtures | E175: R-438A | F175: R-438A | G175: 222 | H175: 6 | I175: Non-fluorinated substances | J175: R-601A (Isopentane) | K175: Isopentane | M175: 0.006 | N175: 5 | O175: 5
A176: 190 | B176: of:=FALSE() -> 0 | C176: 3 | D176: Unsaturated HFCs and HCFCs | E176: HFC-1234yf | F176: HFC-1234yf | G176: 231 | H176: 3 | I176: Unsaturated HFCs and HCFCs | J176: HFC-1234yf | K176: HFC-1234yf | M176: 1 | N176: 4 | O176: 4
A177: 191 | B177: of:=FALSE() -> 0 | C177: 7 | D177: HFC mixtures | E177: Mix: HFC-365mfc: 93%; HFC-227ea: 7% | F177: Mix: HFC-365mfc: 93%; HFC-227ea: 7% | G177: 11 | H177: 1 | I177: HFCs | J177: HFC-227ea (1,1,1,2,3,3,3-heptafluoropropane) | K177: HFC-227ea | M177: 0.07 | N177: 3220 | O177: 3220
A178: 191 | B178: of:=FALSE() -> 0 | C178: 7 | D178: HFC mixtures | E178: Mix: HFC-365mfc: 93%; HFC-227ea: 7% | F178: Mix: HFC-365mfc: 93%; HFC-227ea: 7% | G178: 17 | H178: 1 | I178: HFCs | J178: HFC-365mfc (1,1,1,3,3-pentafluorobutane) | K178: HFC-365mfc | M178: 0.93 | N178: 794 | O178: 794
A179: 192 | B179: of:=FALSE() -> 0 | C179: 7 | D179: HFC mixtures | E179: Mix: HFC-152a: 60%; Dimethyl ether: 40% | F179: Mix: HFC-152a: 60%; Dimethyl ether: 40% | G179: 10 | H179: 1 | I179: HFCs | J179: HFC-152a (1,1-difluoroethane) | K179: HFC-152a | M179: 0.6 | N179: 124 | O179: 124
A180: 192 | B180: of:=FALSE() -> 0 | C180: 7 | D180: HFC mixtures | E180: Mix: HFC-152a: 60%; Dimethyl ether: 40% | F180: Mix: HFC-152a: 60%; Dimethyl ether: 40% | G180: 213 | H180: 6 | I180: Non-fluorinated substances | J180: E-170 (Dimethyl ether) | K180: Dimethyl ether | M180: 0.4 | N180: 1 | O180: 1
A181: 193 | B181: of:=FALSE() -> 0 | C181: 7 | D181: HFC mixtures | E181: Mix: Dimethyl ether: 60%; HFC-152a: 40% | F181: Mix: Dimethyl ether: 60%; HFC-152a: 40% | G181: 10 | H181: 1 | I181: HFCs | J181: HFC-152a (1,1-difluoroethane) | K181: HFC-152a | M181: 0.4 | N181: 124 | O181: 124
A182: 193 | B182: of:=FALSE() -> 0 | C182: 7 | D182: HFC mixtures | E182: Mix: Dimethyl ether: 60%; HFC-152a: 40% | F182: Mix: Dimethyl ether: 60%; HFC-152a: 40% | G182: 213 | H182: 6 | I182: Non-fluorinated substances | J182: E-170 (Dimethyl ether) | K182: Dimethyl ether | M182: 0.6 | N182: 1 | O182: 1
A183: 196 | B183: of:=FALSE() -> 0 | C183: 7 | D183: HFC mixtures | E183: Mix: HFC-1234ze: 58%; HFC-134a: 42% | F183: Mix: HFC-1234ze: 58%; HFC-134a: 42% | G183: 7 | H183: 1 | I183: HFCs | J183: HFC-134a (1,1,1,2-tetrafluoroethane) | K183: HFC-134a | M183: 0.42 | N183: 1430 | O183: 1430
A184: 196 | B184: of:=FALSE() -> 0 | C184: 7 | D184: HFC mixtures | E184: Mix: HFC-1234ze: 58%; HFC-134a: 42% | F184: Mix: HFC-1234ze: 58%; HFC-134a: 42% | G184: 135 | H184: 3 | I184: Unsaturated HFCs and HCFCs | J184: HFC-1234ze | K184: HFC-1234ze | M184: 0.58 | N184: 7 | O184: 7
A185: 199 | B185: of:=FALSE() -> 0 | C185: 7 | D185: HFC mixtures | E185: Mix: HFC-134a: 87%; HFC-152a: 13% | F185: Mix: HFC-134a: 87%; HFC-152a: 13% | G185: 7 | H185: 1 | I185: HFCs | J185: HFC-134a (1,1,1,2-tetrafluoroethane) | K185: HFC-134a | M185: 0.87 | N185: 1430 | O185: 1430
A186: 199 | B186: of:=FALSE() -> 0 | C186: 7 | D186: HFC mixtures | E186: Mix: HFC-134a: 87%; HFC-152a: 13% | F186: Mix: HFC-134a: 87%; HFC-152a: 13% | G186: 10 | H186: 1 | I186: HFCs | J186: HFC-152a (1,1-difluoroethane) | K186: HFC-152a | M186: 0.13 | N186: 124 | O186: 124
A187: 200 | B187: of:=FALSE() -> 0 | C187: 7 | D187: HFC mixtures | E187: Mix: HFC-365mfc: 92%; HFC-227ea: 8% | F187: Mix: HFC-365mfc: 92%; HFC-227ea: 8% | G187: 11 | H187: 1 | I187: HFCs | J187: HFC-227ea (1,1,1,2,3,3,3-heptafluoropropane) | K187: HFC-227ea | M187: 0.08 | N187: 3220 | O187: 3220
A188: 200 | B188: of:=FALSE() -> 0 | C188: 7 | D188: HFC mixtures | E188: Mix: HFC-365mfc: 92%; HFC-227ea: 8% | F188: Mix: HFC-365mfc: 92%; HFC-227ea: 8% | G188: 17 | H188: 1 | I188: HFCs | J188: HFC-365mfc (1,1,1,3,3-pentafluorobutane) | K188: HFC-365mfc | M188: 0.92 | N188: 794 | O188: 794
A189: 201 | B189: of:=FALSE() -> 0 | C189: 7 | D189: HFC mixtures | E189: Mix: PFC-14: 30.51%; HFC-236fa: 30.35%; HFC-23: 22.05%; HFC-125: 11.02%; Other (Argon): 6.07% | F189: Mix: PFC-14: 30.51%; HFC-236fa: 30.35%; HFC-23: 22.05%; HFC-125: 11.02%; Other (Argon): 6.07% | G189: 2 | H189: 1 | I189: HFCs | J189: HFC-23 (trifluoromethane, fluoroform) | K189: HFC-23 | M189: 0.2205 | N189: 14800 | O189: 14800
A190: 201 | B190: of:=FALSE() -> 0 | C190: 7 | D190: HFC mixtures | E190: Mix: PFC-14: 30.51%; HFC-236fa: 30.35%; HFC-23: 22.05%; HFC-125: 11.02%; Other (Argon): 6.07% | F190: Mix: PFC-14: 30.51%; HFC-236fa: 30.35%; HFC-23: 22.05%; HFC-125: 11.02%; Other (Argon): 6.07% | G190: 5 | H190: 1 | I190: HFCs | J190: HFC-125 (pentafluoroethane) | K190: HFC-125 | M190: 0.1102 | N190: 3500 | O190: 3500
A191: 201 | B191: of:=FALSE() -> 0 | C191: 7 | D191: HFC mixtures | E191: Mix: PFC-14: 30.51%; HFC-236fa: 30.35%; HFC-23: 22.05%; HFC-125: 11.02%; Other (Argon): 6.07% | F191: Mix: PFC-14: 30.51%; HFC-236fa: 30.35%; HFC-23: 22.05%; HFC-125: 11.02%; Other (Argon): 6.07% | G191: 14 | H191: 1 | I191: HFCs | J191: HFC-236fa (1,1,1,3,3,3-hexafluoropropane) | K191: HFC-236fa | M191: 0.3035 | N191: 9810 | O191: 9810
A192: 201 | B192: of:=FALSE() -> 0 | C192: 7 | D192: HFC mixtures | E192: Mix: PFC-14: 30.51%; HFC-236fa: 30.35%; HFC-23: 22.05%; HFC-125: 11.02%; Other (Argon): 6.07% | F192: Mix: PFC-14: 30.51%; HFC-236fa: 30.35%; HFC-23: 22.05%; HFC-125: 11.02%; Other (Argon): 6.07% | G192: 19 | H192: 2 | I192: PFCs | J192: PFC-14 (CF4) | K192: PFC-14 | M192: 0.3051 | N192: 7390 | O192: 7390
A193: 201 | B193: of:=FALSE() -> 0 | C193: 7 | D193: HFC mixtures | E193: Mix: PFC-14: 30.51%; HFC-236fa: 30.35%; HFC-23: 22.05%; HFC-125: 11.02%; Other (Argon): 6.07% | F193: Mix: PFC-14: 30.51%; HFC-236fa: 30.35%; HFC-23: 22.05%; HFC-125: 11.02%; Other (Argon): 6.07% | G193: 128 | H193: 11 | I193: Other gases | J193: Other (no F-gas of Regulation 517/2014) | K193: Other | L193: Argon | M193: 0.0607
A194: 203 | B194: of:=FALSE() -> 0 | C194: 7 | D194: HFC mixtures | E194: Mix: PFC-14: 31.91%; HFC-236fa: 29.52%; HFC-23: 23.94%; HFC-125: 10.73%; Other (Argon): 3.9% | F194: Mix: PFC-14: 31.91%; HFC-236fa: 29.52%; HFC-23: 23.94%; HFC-125: 10.73%; Other (Argon): 3.9% | G194: 2 | H194: 1 | I194: HFCs | J194: HFC-23 (trifluoromethane, fluoroform) | K194: HFC-23 | M194: 0.2394 | N194: 14800 | O194: 14800
A195: 203 | B195: of:=FALSE() -> 0 | C195: 7 | D195: HFC mixtures | E195: Mix: PFC-14: 31.91%; HFC-236fa: 29.52%; HFC-23: 23.94%; HFC-125: 10.73%; Other (Argon): 3.9% | F195: Mix: PFC-14: 31.91%; HFC-236fa: 29.52%; HFC-23: 23.94%; HFC-125: 10.73%; Other (Argon): 3.9% | G195: 5 | H195: 1 | I195: HFCs | J195: HFC-125 (pentafluoroethane) | K195: HFC-125 | M195: 0.1073 | N195: 3500 | O195: 3500
A196: 203 | B196: of:=FALSE() -> 0 | C196: 7 | D196: HFC mixtures | E196: Mix: PFC-14: 31.91%; HFC-236fa: 29.52%; HFC-23: 23.94%; HFC-125: 10.73%; Other (Argon): 3.9% | F196: Mix: PFC-14: 31.91%; HFC-236fa: 29.52%; HFC-23: 23.94%; HFC-125: 10.73%; Other (Argon): 3.9% | G196: 14 | H196: 1 | I196: HFCs | J196: HFC-236fa (1,1,1,3,3,3-hexafluoropropane) | K196: HFC-236fa | M196: 0.2952 | N196: 9810 | O196: 9810
A197: 203 | B197: of:=FALSE() -> 0 | C197: 7 | D197: HFC mixtures | E197: Mix: PFC-14: 31.91%; HFC-236fa: 29.52%; HFC-23: 23.94%; HFC-125: 10.73%; Other (Argon): 3.9% | F197: Mix: PFC-14: 31.91%; HFC-236fa: 29.52%; HFC-23: 23.94%; HFC-125: 10.73%; Other (Argon): 3.9% | G197: 19 | H197: 2 | I197: PFCs | J197: PFC-14 (CF4) | K197: PFC-14 | M197: 0.3191 | N197: 7390 | O197: 7390
A198: 203 | B198: of:=FALSE() -> 0 | C198: 7 | D198: HFC mixtures | E198: Mix: PFC-14: 31.91%; HFC-236fa: 29.52%; HFC-23: 23.94%; HFC-125: 10.73%; Other (Argon): 3.9% | F198: Mix: PFC-14: 31.91%; HFC-236fa: 29.52%; HFC-23: 23.94%; HFC-125: 10.73%; Other (Argon): 3.9% | G198: 128 | H198: 11 | I198: Other gases | J198: Other (no F-gas of Regulation 517/2014) | K198: Other | L198: Argon | M198: 0.039
A199: 204 | B199: of:=FALSE() -> 0 | C199: 7 | D199: HFC mixtures | E199: Mix: PFC-14: 48.56%; HFC-125: 25.49%; HFC-23: 16.7%; Other (Argon): 9.25% | F199: Mix: PFC-14: 48.56%; HFC-125: 25.49%; HFC-23: 16.7%; Other (Argon): 9.25% | G199: 2 | H199: 1 | I199: HFCs | J199: HFC-23 (trifluoromethane, fluoroform) | K199: HFC-23 | M199: 0.167 | N199: 14800 | O199: 14800
A200: 204 | B200: of:=FALSE() -> 0 | C200: 7 | D200: HFC mixtures | E200: Mix: PFC-14: 48.56%; HFC-125: 25.49%; HFC-23: 16.7%; Other (Argon): 9.25% | F200: Mix: PFC-14: 48.56%; HFC-125: 25.49%; HFC-23: 16.7%; Other (Argon): 9.25% | G200: 5 | H200: 1 | I200: HFCs | J200: HFC-125 (pentafluoroethane) | K200: HFC-125 | M200: 0.2549 | N200: 3500 | O200: 3500
A201: 204 | B201: of:=FALSE() -> 0 | C201: 7 | D201: HFC mixtures | E201: Mix: PFC-14: 48.56%; HFC-125: 25.49%; HFC-23: 16.7%; Other (Argon): 9.25% | F201: Mix: PFC-14: 48.56%; HFC-125: 25.49%; HFC-23: 16.7%; Other (Argon): 9.25% | G201: 19 | H201: 2 | I201: PFCs | J201: PFC-14 (CF4) | K201: PFC-14 | M201: 0.4856 | N201: 7390 | O201: 7390
A202: 204 | B202: of:=FALSE() -> 0 | C202: 7 | D202: HFC mixtures | E202: Mix: PFC-14: 48.56%; HFC-125: 25.49%; HFC-23: 16.7%; Other (Argon): 9.25% | F202: Mix: PFC-14: 48.56%; HFC-125: 25.49%; HFC-23: 16.7%; Other (Argon): 9.25% | G202: 128 | H202: 11 | I202: Other gases | J202: Other (no F-gas of Regulation 517/2014) | K202: Other | L202: Argon | M202: 0.0925
A203: 205 | B203: of:=FALSE() -> 0 | C203: 7 | D203: HFC mixtures | E203: Mix: PFC-14: 40.95%; HFC-23: 29.64%; HFC-125: 13.09%; HFC-245fa: 9.85%; Other (Argon): 6.47% | F203: Mix: PFC-14: 40.95%; HFC-23: 29.64%; HFC-125: 13.09%; HFC-245fa: 9.85%; Other (Argon): 6.47% | G203: 2 | H203: 1 | I203: HFCs | J203: HFC-23 (trifluoromethane, fluoroform) | K203: HFC-23 | M203: 0.2964 | N203: 14800 | O203: 14800
A204: 205 | B204: of:=FALSE() -> 0 | C204: 7 | D204: HFC mixtures | E204: Mix: PFC-14: 40.95%; HFC-23: 29.64%; HFC-125: 13.09%; HFC-245fa: 9.85%; Other (Argon): 6.47% | F204: Mix: PFC-14: 40.95%; HFC-23: 29.64%; HFC-125: 13.09%; HFC-245fa: 9.85%; Other (Argon): 6.47% | G204: 5 | H204: 1 | I204: HFCs | J204: HFC-125 (pentafluoroethane) | K204: HFC-125 | M204: 0.1309 | N204: 3500 | O204: 3500
A205: 205 | B205: of:=FALSE() -> 0 | C205: 7 | D205: HFC mixtures | E205: Mix: PFC-14: 40.95%; HFC-23: 29.64%; HFC-125: 13.09%; HFC-245fa: 9.85%; Other (Argon): 6.47% | F205: Mix: PFC-14: 40.95%; HFC-23: 29.64%; HFC-125: 13.09%; HFC-245fa: 9.85%; Other (Argon): 6.47% | G205: 16 | H205: 1 | I205: HFCs | J205: HFC-245fa (1,1,1,3,3-pentafluoropropane) | K205: HFC-245fa | M205: 0.0985 | N205: 1030 | O205: 1030
A206: 205 | B206: of:=FALSE() -> 0 | C206: 7 | D206: HFC mixtures | E206: Mix: PFC-14: 40.95%; HFC-23: 29.64%; HFC-125: 13.09%; HFC-245fa: 9.85%; Other (Argon): 6.47% | F206: Mix: PFC-14: 40.95%; HFC-23: 29.64%; HFC-125: 13.09%; HFC-245fa: 9.85%; Other (Argon): 6.47% | G206: 19 | H206: 2 | I206: PFCs | J206: PFC-14 (CF4) | K206: PFC-14 | M206: 0.4095 | N206: 7390 | O206: 7390
A207: 205 | B207: of:=FALSE() -> 0 | C207: 7 | D207: HFC mixtures | E207: Mix: PFC-14: 40.95%; HFC-23: 29.64%; HFC-125: 13.09%; HFC-245fa: 9.85%; Other (Argon): 6.47% | F207: Mix: PFC-14: 40.95%; HFC-23: 29.64%; HFC-125: 13.09%; HFC-245fa: 9.85%; Other (Argon): 6.47% | G207: 128 | H207: 11 | I207: Other gases | J207: Other (no F-gas of Regulation 517/2014) | K207: Other | L207: Argon | M207: 0.0647
A208: 206 | B208: of:=FALSE() -> 0 | C208: 7 | D208: HFC mixtures | E208: Mix: PFC-14: 38.2%; HFC-125: 19.1%; HFC-23: 18.13%; HFC-245fa: 14.38%; Other (Argon): 10.19% | F208: Mix: PFC-14: 38.2%; HFC-125: 19.1%; HFC-23: 18.13%; HFC-245fa: 14.38%; Other (Argon): 10.19% | G208: 2 | H208: 1 | I208: HFCs | J208: HFC-23 (trifluoromethane, fluoroform) | K208: HFC-23 | M208: 0.1813 | N208: 14800 | O208: 14800
A209: 206 | B209: of:=FALSE() -> 0 | C209: 7 | D209: HFC mixtures | E209: Mix: PFC-14: 38.2%; HFC-125: 19.1%; HFC-23: 18.13%; HFC-245fa: 14.38%; Other (Argon): 10.19% | F209: Mix: PFC-14: 38.2%; HFC-125: 19.1%; HFC-23: 18.13%; HFC-245fa: 14.38%; Other (Argon): 10.19% | G209: 5 | H209: 1 | I209: HFCs | J209: HFC-125 (pentafluoroethane) | K209: HFC-125 | M209: 0.191 | N209: 3500 | O209: 3500
A210: 206 | B210: of:=FALSE() -> 0 | C210: 7 | D210: HFC mixtures | E210: Mix: PFC-14: 38.2%; HFC-125: 19.1%; HFC-23: 18.13%; HFC-245fa: 14.38%; Other (Argon): 10.19% | F210: Mix: PFC-14: 38.2%; HFC-125: 19.1%; HFC-23: 18.13%; HFC-245fa: 14.38%; Other (Argon): 10.19% | G210: 16 | H210: 1 | I210: HFCs | J210: HFC-245fa (1,1,1,3,3-pentafluoropropane) | K210: HFC-245fa | M210: 0.1438 | N210: 1030 | O210: 1030
A211: 206 | B211: of:=FALSE() -> 0 | C211: 7 | D211: HFC mixtures | E211: Mix: PFC-14: 38.2%; HFC-125: 19.1%; HFC-23: 18.13%; HFC-245fa: 14.38%; Other (Argon): 10.19% | F211: Mix: PFC-14: 38.2%; HFC-125: 19.1%; HFC-23: 18.13%; HFC-245fa: 14.38%; Other (Argon): 10.19% | G211: 19 | H211: 2 | I211: PFCs | J211: PFC-14 (CF4) | K211: PFC-14 | M211: 0.382 | N211: 7390 | O211: 7390
A212: 206 | B212: of:=FALSE() -> 0 | C212: 7 | D212: HFC mixtures | E212: Mix: PFC-14: 38.2%; HFC-125: 19.1%; HFC-23: 18.13%; HFC-245fa: 14.38%; Other (Argon): 10.19% | F212: Mix: PFC-14: 38.2%; HFC-125: 19.1%; HFC-23: 18.13%; HFC-245fa: 14.38%; Other (Argon): 10.19% | G212: 128 | H212: 11 | I212: Other gases | J212: Other (no F-gas of Regulation 517/2014) | K212: Other | L212: Argon | M212: 0.1019
A213: 207 | B213: of:=FALSE() -> 0 | C213: 7 | D213: HFC mixtures | E213: Mix: HFC-236fa: 38.42%; PFC-14: 27.99%; HFC-23: 16%; Other (Argon): 10.66%; HFC-125: 6.93% | F213: Mix: HFC-236fa: 38.42%; PFC-14: 27.99%; HFC-23: 16%; Other (Argon): 10.66%; HFC-125: 6.93% | G213: 2 | H213: 1 | I213: HFCs | J213: HFC-23 (trifluoromethane, fluoroform) | K213: HFC-23 | M213: 0.16 | N213: 14800 | O213: 14800
A214: 207 | B214: of:=FALSE() -> 0 | C214: 7 | D214: HFC mixtures | E214: Mix: HFC-236fa: 38.42%; PFC-14: 27.99%; HFC-23: 16%; Other (Argon): 10.66%; HFC-125: 6.93% | F214: Mix: HFC-236fa: 38.42%; PFC-14: 27.99%; HFC-23: 16%; Other (Argon): 10.66%; HFC-125: 6.93% | G214: 5 | H214: 1 | I214: HFCs | J214: HFC-125 (pentafluoroethane) | K214: HFC-125 | M214: 0.0693 | N214: 3500 | O214: 3500
A215: 207 | B215: of:=FALSE() -> 0 | C215: 7 | D215: HFC mixtures | E215: Mix: HFC-236fa: 38.42%; PFC-14: 27.99%; HFC-23: 16%; Other (Argon): 10.66%; HFC-125: 6.93% | F215: Mix: HFC-236fa: 38.42%; PFC-14: 27.99%; HFC-23: 16%; Other (Argon): 10.66%; HFC-125: 6.93% | G215: 14 | H215: 1 | I215: HFCs | J215: HFC-236fa (1,1,1,3,3,3-hexafluoropropane) | K215: HFC-236fa | M215: 0.3842 | N215: 9810 | O215: 9810
A216: 207 | B216: of:=FALSE() -> 0 | C216: 7 | D216: HFC mixtures | E216: Mix: HFC-236fa: 38.42%; PFC-14: 27.99%; HFC-23: 16%; Other (Argon): 10.66%; HFC-125: 6.93% | F216: Mix: HFC-236fa: 38.42%; PFC-14: 27.99%; HFC-23: 16%; Other (Argon): 10.66%; HFC-125: 6.93% | G216: 19 | H216: 2 | I216: PFCs | J216: PFC-14 (CF4) | K216: PFC-14 | M216: 0.2799 | N216: 7390 | O216: 7390
A217: 207 | B217: of:=FALSE() -> 0 | C217: 7 | D217: HFC mixtures | E217: Mix: HFC-236fa: 38.42%; PFC-14: 27.99%; HFC-23: 16%; Other (Argon): 10.66%; HFC-125: 6.93% | F217: Mix: HFC-236fa: 38.42%; PFC-14: 27.99%; HFC-23: 16%; Other (Argon): 10.66%; HFC-125: 6.93% | G217: 128 | H217: 11 | I217: Other gases | J217: Other (no F-gas of Regulation 517/2014) | K217: Other | L217: Argon | M217: 0.1066
A218: 208 | B218: of:=FALSE() -> 0 | C218: 7 | D218: HFC mixtures | E218: Mix: HFC-236fa: 33.3%; PFC-14: 29.8%; HFC-23: 19.53%; HFC-125: 13.31%; Other (Argon): 4.06% | F218: Mix: HFC-236fa: 33.3%; PFC-14: 29.8%; HFC-23: 19.53%; HFC-125: 13.31%; Other (Argon): 4.06% | G218: 2 | H218: 1 | I218: HFCs | J218: HFC-23 (trifluoromethane, fluoroform) | K218: HFC-23 | M218: 0.1953 | N218: 14800 | O218: 14800
A219: 208 | B219: of:=FALSE() -> 0 | C219: 7 | D219: HFC mixtures | E219: Mix: HFC-236fa: 33.3%; PFC-14: 29.8%; HFC-23: 19.53%; HFC-125: 13.31%; Other (Argon): 4.06% | F219: Mix: HFC-236fa: 33.3%; PFC-14: 29.8%; HFC-23: 19.53%; HFC-125: 13.31%; Other (Argon): 4.06% | G219: 5 | H219: 1 | I219: HFCs | J219: HFC-125 (pentafluoroethane) | K219: HFC-125 | M219: 0.1331 | N219: 3500 | O219: 3500
A220: 208 | B220: of:=FALSE() -> 0 | C220: 7 | D220: HFC mixtures | E220: Mix: HFC-236fa: 33.3%; PFC-14: 29.8%; HFC-23: 19.53%; HFC-125: 13.31%; Other (Argon): 4.06% | F220: Mix: HFC-236fa: 33.3%; PFC-14: 29.8%; HFC-23: 19.53%; HFC-125: 13.31%; Other (Argon): 4.06% | G220: 14 | H220: 1 | I220: HFCs | J220: HFC-236fa (1,1,1,3,3,3-hexafluoropropane) | K220: HFC-236fa | M220: 0.333 | N220: 9810 | O220: 9810
A221: 208 | B221: of:=FALSE() -> 0 | C221: 7 | D221: HFC mixtures | E221: Mix: HFC-236fa: 33.3%; PFC-14: 29.8%; HFC-23: 19.53%; HFC-125: 13.31%; Other (Argon): 4.06% | F221: Mix: HFC-236fa: 33.3%; PFC-14: 29.8%; HFC-23: 19.53%; HFC-125: 13.31%; Other (Argon): 4.06% | G221: 19 | H221: 2 | I221: PFCs | J221: PFC-14 (CF4) | K221: PFC-14 | M221: 0.298 | N221: 7390 | O221: 7390
A222: 208 | B222: of:=FALSE() -> 0 | C222: 7 | D222: HFC mixtures | E222: Mix: HFC-236fa: 33.3%; PFC-14: 29.8%; HFC-23: 19.53%; HFC-125: 13.31%; Other (Argon): 4.06% | F222: Mix: HFC-236fa: 33.3%; PFC-14: 29.8%; HFC-23: 19.53%; HFC-125: 13.31%; Other (Argon): 4.06% | G222: 128 | H222: 11 | I222: Other gases | J222: Other (no F-gas of Regulation 517/2014) | K222: Other | L222: Argon | M222: 0.0406
A223: 209 | B223: of:=FALSE() -> 0 | C223: 7 | D223: HFC mixtures | E223: Mix: PFC-14: 31.14%; HFC-245fa: 30.83%; HFC-23: 23.25%; HFC-125: 12.32%; Other (Argon): 2.46% | F223: Mix: PFC-14: 31.14%; HFC-245fa: 30.83%; HFC-23: 23.25%; HFC-125: 12.32%; Other (Argon): 2.46% | G223: 2 | H223: 1 | I223: HFCs | J223: HFC-23 (trifluoromethane, fluoroform) | K223: HFC-23 | M223: 0.2325 | N223: 14800 | O223: 14800
A224: 209 | B224: of:=FALSE() -> 0 | C224: 7 | D224: HFC mixtures | E224: Mix: PFC-14: 31.14%; HFC-245fa: 30.83%; HFC-23: 23.25%; HFC-125: 12.32%; Other (Argon): 2.46% | F224: Mix: PFC-14: 31.14%; HFC-245fa: 30.83%; HFC-23: 23.25%; HFC-125: 12.32%; Other (Argon): 2.46% | G224: 5 | H224: 1 | I224: HFCs | J224: HFC-125 (pentafluoroethane) | K224: HFC-125 | M224: 0.1232 | N224: 3500 | O224: 3500
A225: 209 | B225: of:=FALSE() -> 0 | C225: 7 | D225: HFC mixtures | E225: Mix: PFC-14: 31.14%; HFC-245fa: 30.83%; HFC-23: 23.25%; HFC-125: 12.32%; Other (Argon): 2.46% | F225: Mix: PFC-14: 31.14%; HFC-245fa: 30.83%; HFC-23: 23.25%; HFC-125: 12.32%; Other (Argon): 2.46% | G225: 16 | H225: 1 | I225: HFCs | J225: HFC-245fa (1,1,1,3,3-pentafluoropropane) | K225: HFC-245fa | M225: 0.3083 | N225: 1030 | O225: 1030
A226: 209 | B226: of:=FALSE() -> 0 | C226: 7 | D226: HFC mixtures | E226: Mix: PFC-14: 31.14%; HFC-245fa: 30.83%; HFC-23: 23.25%; HFC-125: 12.32%; Other (Argon): 2.46% | F226: Mix: PFC-14: 31.14%; HFC-245fa: 30.83%; HFC-23: 23.25%; HFC-125: 12.32%; Other (Argon): 2.46% | G226: 19 | H226: 2 | I226: PFCs | J226: PFC-14 (CF4) | K226: PFC-14 | M226: 0.3114 | N226: 7390 | O226: 7390
A227: 209 | B227: of:=FALSE() -> 0 | C227: 7 | D227: HFC mixtures | E227: Mix: PFC-14: 31.14%; HFC-245fa: 30.83%; HFC-23: 23.25%; HFC-125: 12.32%; Other (Argon): 2.46% | F227: Mix: PFC-14: 31.14%; HFC-245fa: 30.83%; HFC-23: 23.25%; HFC-125: 12.32%; Other (Argon): 2.46% | G227: 128 | H227: 11 | I227: Other gases | J227: Other (no F-gas of Regulation 517/2014) | K227: Other | L227: Argon | M227: 0.0246
A228: 210 | B228: of:=FALSE() -> 0 | C228: 7 | D228: HFC mixtures | E228: Mix: PFC-14: 35.75%; HFC-245fa: 20.44%; HFC-23: 19.35%; HFC-125: 17.56%; Other (Argon): 6.9% | F228: Mix: PFC-14: 35.75%; HFC-245fa: 20.44%; HFC-23: 19.35%; HFC-125: 17.56%; Other (Argon): 6.9% | G228: 2 | H228: 1 | I228: HFCs | J228: HFC-23 (trifluoromethane, fluoroform) | K228: HFC-23 | M228: 0.1935 | N228: 14800 | O228: 14800
A229: 210 | B229: of:=FALSE() -> 0 | C229: 7 | D229: HFC mixtures | E229: Mix: PFC-14: 35.75%; HFC-245fa: 20.44%; HFC-23: 19.35%; HFC-125: 17.56%; Other (Argon): 6.9% | F229: Mix: PFC-14: 35.75%; HFC-245fa: 20.44%; HFC-23: 19.35%; HFC-125: 17.56%; Other (Argon): 6.9% | G229: 5 | H229: 1 | I229: HFCs | J229: HFC-125 (pentafluoroethane) | K229: HFC-125 | M229: 0.1756 | N229: 3500 | O229: 3500
A230: 210 | B230: of:=FALSE() -> 0 | C230: 7 | D230: HFC mixtures | E230: Mix: PFC-14: 35.75%; HFC-245fa: 20.44%; HFC-23: 19.35%; HFC-125: 17.56%; Other (Argon): 6.9% | F230: Mix: PFC-14: 35.75%; HFC-245fa: 20.44%; HFC-23: 19.35%; HFC-125: 17.56%; Other (Argon): 6.9% | G230: 16 | H230: 1 | I230: HFCs | J230: HFC-245fa (1,1,1,3,3-pentafluoropropane) | K230: HFC-245fa | M230: 0.2044 | N230: 1030 | O230: 1030
A231: 210 | B231: of:=FALSE() -> 0 | C231: 7 | D231: HFC mixtures | E231: Mix: PFC-14: 35.75%; HFC-245fa: 20.44%; HFC-23: 19.35%; HFC-125: 17.56%; Other (Argon): 6.9% | F231: Mix: PFC-14: 35.75%; HFC-245fa: 20.44%; HFC-23: 19.35%; HFC-125: 17.56%; Other (Argon): 6.9% | G231: 19 | H231: 2 | I231: PFCs | J231: PFC-14 (CF4) | K231: PFC-14 | M231: 0.3575 | N231: 7390 | O231: 7390
A232: 210 | B232: of:=FALSE() -> 0 | C232: 7 | D232: HFC mixtures | E232: Mix: PFC-14: 35.75%; HFC-245fa: 20.44%; HFC-23: 19.35%; HFC-125: 17.56%; Other (Argon): 6.9% | F232: Mix: PFC-14: 35.75%; HFC-245fa: 20.44%; HFC-23: 19.35%; HFC-125: 17.56%; Other (Argon): 6.9% | G232: 128 | H232: 11 | I232: Other gases | J232: Other (no F-gas of Regulation 517/2014) | K232: Other | L232: Argon | M232: 0.069
A233: 212 | B233: of:=FALSE() -> 0 | C233: 7 | D233: HFC mixtures | E233: Mix: PFC-14: 31.25%; HFC-236fa: 31.25%; HFC-125: 15.63%; HFC-23: 15.63%; Other (Argon): 6.24% | F233: Mix: PFC-14: 31.25%; HFC-236fa: 31.25%; HFC-125: 15.63%; HFC-23: 15.63%; Other (Argon): 6.24% | G233: 2 | H233: 1 | I233: HFCs | J233: HFC-23 (trifluoromethane, fluoroform) | K233: HFC-23 | M233: 0.1563 | N233: 14800 | O233: 14800
A234: 212 | B234: of:=FALSE() -> 0 | C234: 7 | D234: HFC mixtures | E234: Mix: PFC-14: 31.25%; HFC-236fa: 31.25%; HFC-125: 15.63%; HFC-23: 15.63%; Other (Argon): 6.24% | F234: Mix: PFC-14: 31.25%; HFC-236fa: 31.25%; HFC-125: 15.63%; HFC-23: 15.63%; Other (Argon): 6.24% | G234: 5 | H234: 1 | I234: HFCs | J234: HFC-125 (pentafluoroethane) | K234: HFC-125 | M234: 0.1563 | N234: 3500 | O234: 3500
A235: 212 | B235: of:=FALSE() -> 0 | C235: 7 | D235: HFC mixtures | E235: Mix: PFC-14: 31.25%; HFC-236fa: 31.25%; HFC-125: 15.63%; HFC-23: 15.63%; Other (Argon): 6.24% | F235: Mix: PFC-14: 31.25%; HFC-236fa: 31.25%; HFC-125: 15.63%; HFC-23: 15.63%; Other (Argon): 6.24% | G235: 14 | H235: 1 | I235: HFCs | J235: HFC-236fa (1,1,1,3,3,3-hexafluoropropane) | K235: HFC-236fa | M235: 0.3125 | N235: 9810 | O235: 9810
A236: 212 | B236: of:=FALSE() -> 0 | C236: 7 | D236: HFC mixtures | E236: Mix: PFC-14: 31.25%; HFC-236fa: 31.25%; HFC-125: 15.63%; HFC-23: 15.63%; Other (Argon): 6.24% | F236: Mix: PFC-14: 31.25%; HFC-236fa: 31.25%; HFC-125: 15.63%; HFC-23: 15.63%; Other (Argon): 6.24% | G236: 19 | H236: 2 | I236: PFCs | J236: PFC-14 (CF4) | K236: PFC-14 | M236: 0.3125 | N236: 7390 | O236: 7390
A237: 212 | B237: of:=FALSE() -> 0 | C237: 7 | D237: HFC mixtures | E237: Mix: PFC-14: 31.25%; HFC-236fa: 31.25%; HFC-125: 15.63%; HFC-23: 15.63%; Other (Argon): 6.24% | F237: Mix: PFC-14: 31.25%; HFC-236fa: 31.25%; HFC-125: 15.63%; HFC-23: 15.63%; Other (Argon): 6.24% | G237: 128 | H237: 11 | I237: Other gases | J237: Other (no F-gas of Regulation 517/2014) | K237: Other | L237: Argon | M237: 0.0624
A238: 213 | B238: of:=FALSE() -> 0 | C238: 7 | D238: HFC mixtures | E238: Mix: PFC-14: 23.53%; HFC-236fa: 23.53%; HFC-125: 23.53%; HFC-23: 23.53%; Other (Argon): 5.88% | F238: Mix: PFC-14: 23.53%; HFC-236fa: 23.53%; HFC-125: 23.53%; HFC-23: 23.53%; Other (Argon): 5.88% | G238: 2 | H238: 1 | I238: HFCs | J238: HFC-23 (trifluoromethane, fluoroform) | K238: HFC-23 | M238: 0.2353 | N238: 14800 | O238: 14800
A239: 213 | B239: of:=FALSE() -> 0 | C239: 7 | D239: HFC mixtures | E239: Mix: PFC-14: 23.53%; HFC-236fa: 23.53%; HFC-125: 23.53%; HFC-23: 23.53%; Other (Argon): 5.88% | F239: Mix: PFC-14: 23.53%; HFC-236fa: 23.53%; HFC-125: 23.53%; HFC-23: 23.53%; Other (Argon): 5.88% | G239: 5 | H239: 1 | I239: HFCs | J239: HFC-125 (pentafluoroethane) | K239: HFC-125 | M239: 0.2353 | N239: 3500 | O239: 3500
A240: 213 | B240: of:=FALSE() -> 0 | C240: 7 | D240: HFC mixtures | E240: Mix: PFC-14: 23.53%; HFC-236fa: 23.53%; HFC-125: 23.53%; HFC-23: 23.53%; Other (Argon): 5.88% | F240: Mix: PFC-14: 23.53%; HFC-236fa: 23.53%; HFC-125: 23.53%; HFC-23: 23.53%; Other (Argon): 5.88% | G240: 14 | H240: 1 | I240: HFCs | J240: HFC-236fa (1,1,1,3,3,3-hexafluoropropane) | K240: HFC-236fa | M240: 0.2353 | N240: 9810 | O240: 9810
A241: 213 | B241: of:=FALSE() -> 0 | C241: 7 | D241: HFC mixtures | E241: Mix: PFC-14: 23.53%; HFC-236fa: 23.53%; HFC-125: 23.53%; HFC-23: 23.53%; Other (Argon): 5.88% | F241: Mix: PFC-14: 23.53%; HFC-236fa: 23.53%; HFC-125: 23.53%; HFC-23: 23.53%; Other (Argon): 5.88% | G241: 19 | H241: 2 | I241: PFCs | J241: PFC-14 (CF4) | K241: PFC-14 | M241: 0.2353 | N241: 7390 | O241: 7390
A242: 213 | B242: of:=FALSE() -> 0 | C242: 7 | D242: HFC mixtures | E242: Mix: PFC-14: 23.53%; HFC-236fa: 23.53%; HFC-125: 23.53%; HFC-23: 23.53%; Other (Argon): 5.88% | F242: Mix: PFC-14: 23.53%; HFC-236fa: 23.53%; HFC-125: 23.53%; HFC-23: 23.53%; Other (Argon): 5.88% | G242: 128 | H242: 11 | I242: Other gases | J242: Other (no F-gas of Regulation 517/2014) | K242: Other | L242: Argon | M242: 0.0588
A243: 224 | B243: of:=FALSE() -> 0 | C243: 7 | D243: HFC mixtures | E243: Mix: HFC-236fa: 39.99%; PFC-14: 25.89%; HFC-23: 17.5%; HFC-125: 10.23%; Other (Argon): 6.39% | F243: Mix: HFC-236fa: 39.99%; PFC-14: 25.89%; HFC-23: 17.5%; HFC-125: 10.23%; Other (Argon): 6.39% | G243: 2 | H243: 1 | I243: HFCs | J243: HFC-23 (trifluoromethane, fluoroform) | K243: HFC-23 | M243: 0.175 | N243: 14800 | O243: 14800
A244: 224 | B244: of:=FALSE() -> 0 | C244: 7 | D244: HFC mixtures | E244: Mix: HFC-236fa: 39.99%; PFC-14: 25.89%; HFC-23: 17.5%; HFC-125: 10.23%; Other (Argon): 6.39% | F244: Mix: HFC-236fa: 39.99%; PFC-14: 25.89%; HFC-23: 17.5%; HFC-125: 10.23%; Other (Argon): 6.39% | G244: 5 | H244: 1 | I244: HFCs | J244: HFC-125 (pentafluoroethane) | K244: HFC-125 | M244: 0.1023 | N244: 3500 | O244: 3500
A245: 224 | B245: of:=FALSE() -> 0 | C245: 7 | D245: HFC mixtures | E245: Mix: HFC-236fa: 39.99%; PFC-14: 25.89%; HFC-23: 17.5%; HFC-125: 10.23%; Other (Argon): 6.39% | F245: Mix: HFC-236fa: 39.99%; PFC-14: 25.89%; HFC-23: 17.5%; HFC-125: 10.23%; Other (Argon): 6.39% | G245: 14 | H245: 1 | I245: HFCs | J245: HFC-236fa (1,1,1,3,3,3-hexafluoropropane) | K245: HFC-236fa | M245: 0.3999 | N245: 9810 | O245: 9810
A246: 224 | B246: of:=FALSE() -> 0 | C246: 7 | D246: HFC mixtures | E246: Mix: HFC-236fa: 39.99%; PFC-14: 25.89%; HFC-23: 17.5%; HFC-125: 10.23%; Other (Argon): 6.39% | F246: Mix: HFC-236fa: 39.99%; PFC-14: 25.89%; HFC-23: 17.5%; HFC-125: 10.23%; Other (Argon): 6.39% | G246: 19 | H246: 2 | I246: PFCs | J246: PFC-14 (CF4) | K246: PFC-14 | M246: 0.2589 | N246: 7390 | O246: 7390
A247: 224 | B247: of:=FALSE() -> 0 | C247: 7 | D247: HFC mixtures | E247: Mix: HFC-236fa: 39.99%; PFC-14: 25.89%; HFC-23: 17.5%; HFC-125: 10.23%; Other (Argon): 6.39% | F247: Mix: HFC-236fa: 39.99%; PFC-14: 25.89%; HFC-23: 17.5%; HFC-125: 10.23%; Other (Argon): 6.39% | G247: 128 | H247: 11 | I247: Other gases | J247: Other (no F-gas of Regulation 517/2014) | K247: Other | L247: Argon | M247: 0.0639
A248: 227 | B248: of:=FALSE() -> 0 | C248: 9 | D248: Non-HFC mixtures | E248: Mix: PFC-5-1-14: 33.334%; PFC-3-1-10: 33.333%; PFC-4-1-12: 33.333% | F248: Mix: PFC-5-1-14: 33.334%; PFC-3-1-10: 33.333%; PFC-4-1-12: 33.333% | G248: 23 | H248: 2 | I248: PFCs | J248: PFC-3-1-10 (C4F10) | K248: PFC-3-1-10 | M248: 0.33333 | N248: 8860 | O248: 8860
A249: 227 | B249: of:=FALSE() -> 0 | C249: 9 | D249: Non-HFC mixtures | E249: Mix: PFC-5-1-14: 33.334%; PFC-3-1-10: 33.333%; PFC-4-1-12: 33.333% | F249: Mix: PFC-5-1-14: 33.334%; PFC-3-1-10: 33.333%; PFC-4-1-12: 33.333% | G249: 24 | H249: 2 | I249: PFCs | J249: PFC-4-1-12 (C5F12) | K249: PFC-4-1-12 | M249: 0.33333 | N249: 9160 | O249: 9160
A250: 227 | B250: of:=FALSE() -> 0 | C250: 9 | D250: Non-HFC mixtures | E250: Mix: PFC-5-1-14: 33.334%; PFC-3-1-10: 33.333%; PFC-4-1-12: 33.333% | F250: Mix: PFC-5-1-14: 33.334%; PFC-3-1-10: 33.333%; PFC-4-1-12: 33.333% | G250: 25 | H250: 2 | I250: PFCs | J250: PFC-5-1-14 (C6F14) | K250: PFC-5-1-14 | M250: 0.33334 | N250: 9300 | O250: 9300
A251: 228 | B251: of:=FALSE() -> 0 | C251: 9 | D251: Non-HFC mixtures | E251: Mix: Other (C6F14): 33.334%; Other (C4F10): 33.333%; Other (C5F12): 33.333% | F251: Mix: Other (C6F14): 33.334%; Other (C4F10): 33.333%; Other (C5F12): 33.333% | G251: 128 | H251: 11 | I251: Other gases | J251: Other (no F-gas of Regulation 517/2014) | K251: Other | L251: C5F12 | M251: 0.33333
A252: 228 | B252: of:=FALSE() -> 0 | C252: 9 | D252: Non-HFC mixtures | E252: Mix: Other (C6F14): 33.334%; Other (C4F10): 33.333%; Other (C5F12): 33.333% | F252: Mix: Other (C6F14): 33.334%; Other (C4F10): 33.333%; Other (C5F12): 33.333% | G252: 128 | H252: 11 | I252: Other gases | J252: Other (no F-gas of Regulation 517/2014) | K252: Other | L252: C4F10 | M252: 0.33333
A253: 228 | B253: of:=FALSE() -> 0 | C253: 9 | D253: Non-HFC mixtures | E253: Mix: Other (C6F14): 33.334%; Other (C4F10): 33.333%; Other (C5F12): 33.333% | F253: Mix: Other (C6F14): 33.334%; Other (C4F10): 33.333%; Other (C5F12): 33.333% | G253: 128 | H253: 11 | I253: Other gases | J253: Other (no F-gas of Regulation 517/2014) | K253: Other | L253: C6F14 | M253: 0.33334
A254: 229 | B254: of:=TRUE() -> 1 | C254: 7 | D254: HFC mixtures | E254: R-448A | F254: R-448A | G254: 3 | H254: 1 | I254: HFCs | J254: HFC-32 (difluoromethane) | K254: HFC-32 | M254: 0.26 | N254: 675 | O254: 675
A255: 229 | B255: of:=TRUE() -> 1 | C255: 7 | D255: HFC mixtures | E255: R-448A | F255: R-448A | G255: 5 | H255: 1 | I255: HFCs | J255: HFC-125 (pentafluoroethane) | K255: HFC-125 | M255: 0.26 | N255: 3500 | O255: 3500
A256: 229 | B256: of:=TRUE() -> 1 | C256: 7 | D256: HFC mixtures | E256: R-448A | F256: R-448A | G256: 7 | H256: 1 | I256: HFCs | J256: HFC-134a (1,1,1,2-tetrafluoroethane) | K256: HFC-134a | M256: 0.21 | N256: 1430 | O256: 1430
A257: 229 | B257: of:=TRUE() -> 1 | C257: 7 | D257: HFC mixtures | E257: R-448A | F257: R-448A | G257: 135 | H257: 3 | I257: Unsaturated HFCs and HCFCs | J257: HFC-1234ze | K257: HFC-1234ze | M257: 0.07 | N257: 7 | O257: 7
A258: 229 | B258: of:=TRUE() -> 1 | C258: 7 | D258: HFC mixtures | E258: R-448A | F258: R-448A | G258: 231 | H258: 3 | I258: Unsaturated HFCs and HCFCs | J258: HFC-1234yf | K258: HFC-1234yf | M258: 0.2 | N258: 4 | O258: 4
A259: 230 | B259: of:=TRUE() -> 1 | C259: 7 | D259: HFC mixtures | E259: R-452A | F259: R-452A | G259: 3 | H259: 1 | I259: HFCs | J259: HFC-32 (difluoromethane) | K259: HFC-32 | M259: 0.11 | N259: 675 | O259: 675
A260: 230 | B260: of:=TRUE() -> 1 | C260: 7 | D260: HFC mixtures | E260: R-452A | F260: R-452A | G260: 5 | H260: 1 | I260: HFCs | J260: HFC-125 (pentafluoroethane) | K260: HFC-125 | M260: 0.59 | N260: 3500 | O260: 3500
A261: 230 | B261: of:=TRUE() -> 1 | C261: 7 | D261: HFC mixtures | E261: R-452A | F261: R-452A | G261: 231 | H261: 3 | I261: Unsaturated HFCs and HCFCs | J261: HFC-1234yf | K261: HFC-1234yf | M261: 0.3 | N261: 4 | O261: 4
A262: 231 | B262: of:=TRUE() -> 1 | C262: 7 | D262: HFC mixtures | E262: R-453A | F262: R-453A | G262: 3 | H262: 1 | I262: HFCs | J262: HFC-32 (difluoromethane) | K262: HFC-32 | M262: 0.2 | N262: 675 | O262: 675
A263: 231 | B263: of:=TRUE() -> 1 | C263: 7 | D263: HFC mixtures | E263: R-453A | F263: R-453A | G263: 5 | H263: 1 | I263: HFCs | J263: HFC-125 (pentafluoroethane) | K263: HFC-125 | M263: 0.2 | N263: 3500 | O263: 3500
A264: 231 | B264: of:=TRUE() -> 1 | C264: 7 | D264: HFC mixtures | E264: R-453A | F264: R-453A | G264: 7 | H264: 1 | I264: HFCs | J264: HFC-134a (1,1,1,2-tetrafluoroethane) | K264: HFC-134a | M264: 0.538 | N264: 1430 | O264: 1430
A265: 231 | B265: of:=TRUE() -> 1 | C265: 7 | D265: HFC mixtures | E265: R-453A | F265: R-453A | G265: 11 | H265: 1 | I265: HFCs | J265: HFC-227ea (1,1,1,2,3,3,3-heptafluoropropane) | K265: HFC-227ea | M265: 0.05 | N265: 3220 | O265: 3220
A266: 231 | B266: of:=TRUE() -> 1 | C266: 7 | D266: HFC mixtures | E266: R-453A | F266: R-453A | G266: 219 | H266: 6 | I266: Non-fluorinated substances | J266: R-600 (Butane) | K266: Butane | M266: 0.006 | N266: 4 | O266: 4
A267: 231 | B267: of:=TRUE() -> 1 | C267: 7 | D267: HFC mixtures | E267: R-453A | F267: R-453A | G267: 222 | H267: 6 | I267: Non-fluorinated substances | J267: R-601A (Isopentane) | K267: Isopentane | M267: 0.006 | N267: 5 | O267: 5
A268: 232 | B268: of:=FALSE() -> 0 | C268: 7 | D268: HFC mixtures | E268: R-513A | F268: R-513A | G268: 7 | H268: 1 | I268: HFCs | J268: HFC-134a (1,1,1,2-tetrafluoroethane) | K268: HFC-134a | M268: 0.44 | N268: 1430 | O268: 1430
A269: 232 | B269: of:=FALSE() -> 0 | C269: 7 | D269: HFC mixtures | E269: R-513A | F269: R-513A | G269: 231 | H269: 3 | I269: Unsaturated HFCs and HCFCs | J269: HFC-1234yf | K269: HFC-1234yf | M269: 0.56 | N269: 4 | O269: 4
A270: 245 | B270: of:=FALSE() -> 0 | C270: 7 | D270: HFC mixtures | E270: Mix: HFC-365mfc: 65%; perfluoropolymethylisopropylether (PFPMIE): 35% | F270: Mix: HFC-365mfc: 65%; perfluoropolymethylisopropylether (PFPMIE): 35% | G270: 17 | H270: 1 | I270: HFCs | J270: HFC-365mfc (1,1,1,3,3-pentafluorobutane) | K270: HFC-365mfc | M270: 0.65 | N270: 794 | O270: 794
A271: 245 | B271: of:=FALSE() -> 0 | C271: 7 | D271: HFC mixtures | E271: Mix: HFC-365mfc: 65%; perfluoropolymethylisopropylether (PFPMIE): 35% | F271: Mix: HFC-365mfc: 65%; perfluoropolymethylisopropylether (PFPMIE): 35% | G271: 207 | H271: 5 | I271: Other perfluorinated compounds | J271: PFPMIE (perfluoropolymethylisopropylether) | K271: perfluoropolymethylisopropylether (PFPMIE) | M271: 0.35 | N271: 10300 | O271: 10300
A272: 246 | B272: of:=FALSE() -> 0 | C272: 7 | D272: HFC mixtures | E272: Mix: HFC-365mfc: 70%; Other (t-DCE): 30% | F272: Mix: HFC-365mfc: 70%; Other (t-DCE): 30% | G272: 17 | H272: 1 | I272: HFCs | J272: HFC-365mfc (1,1,1,3,3-pentafluorobutane) | K272: HFC-365mfc | M272: 0.7 | N272: 794 | O272: 794
A273: 246 | B273: of:=FALSE() -> 0 | C273: 7 | D273: HFC mixtures | E273: Mix: HFC-365mfc: 70%; Other (t-DCE): 30% | F273: Mix: HFC-365mfc: 70%; Other (t-DCE): 30% | G273: 128 | H273: 11 | I273: Other gases | J273: Other (no F-gas of Regulation 517/2014) | K273: Other | L273: t-DCE | M273: 0.3
A274: 248 | B274: of:=FALSE() -> 0 | C274: 7 | D274: HFC mixtures | E274: Mix: HFC-134a: 89%; HFC-125: 11% | F274: Mix: HFC-134a: 89%; HFC-125: 11% | G274: 5 | H274: 1 | I274: HFCs | J274: HFC-125 (pentafluoroethane) | K274: HFC-125 | M274: 0.11 | N274: 3500 | O274: 3500
A275: 248 | B275: of:=FALSE() -> 0 | C275: 7 | D275: HFC mixtures | E275: Mix: HFC-134a: 89%; HFC-125: 11% | F275: Mix: HFC-134a: 89%; HFC-125: 11% | G275: 7 | H275: 1 | I275: HFCs | J275: HFC-134a (1,1,1,2-tetrafluoroethane) | K275: HFC-134a | M275: 0.89 | N275: 1430 | O275: 1430
A276: 257 | B276: of:=FALSE() -> 0 | C276: 9 | D276: Non-HFC mixtures | E276: Mix: PFC-3-1-10: 33.334%; PFC-5-1-14: 33.333%; PFC-4-1-12: 33.333% | F276: Mix: PFC-3-1-10: 33.334%; PFC-5-1-14: 33.333%; PFC-4-1-12: 33.333% | G276: 23 | H276: 2 | I276: PFCs | J276: PFC-3-1-10 (C4F10) | K276: PFC-3-1-10 | M276: 0.33334 | N276: 8860 | O276: 8860
A277: 257 | B277: of:=FALSE() -> 0 | C277: 9 | D277: Non-HFC mixtures | E277: Mix: PFC-3-1-10: 33.334%; PFC-5-1-14: 33.333%; PFC-4-1-12: 33.333% | F277: Mix: PFC-3-1-10: 33.334%; PFC-5-1-14: 33.333%; PFC-4-1-12: 33.333% | G277: 24 | H277: 2 | I277: PFCs | J277: PFC-4-1-12 (C5F12) | K277: PFC-4-1-12 | M277: 0.33333 | N277: 9160 | O277: 9160
A278: 257 | B278: of:=FALSE() -> 0 | C278: 9 | D278: Non-HFC mixtures | E278: Mix: PFC-3-1-10: 33.334%; PFC-5-1-14: 33.333%; PFC-4-1-12: 33.333% | F278: Mix: PFC-3-1-10: 33.334%; PFC-5-1-14: 33.333%; PFC-4-1-12: 33.333% | G278: 25 | H278: 2 | I278: PFCs | J278: PFC-5-1-14 (C6F14) | K278: PFC-5-1-14 | M278: 0.33333 | N278: 9300 | O278: 9300
A279: 268 | B279: of:=FALSE() -> 0 | C279: 7 | D279: HFC mixtures | E279: Mix: HFC-125: 75%; HFC-134a: 25% | F279: Mix: HFC-125: 75%; HFC-134a: 25% | G279: 5 | H279: 1 | I279: HFCs | J279: HFC-125 (pentafluoroethane) | K279: HFC-125 | M279: 0.75 | N279: 3500 | O279: 3500
A280: 268 | B280: of:=FALSE() -> 0 | C280: 7 | D280: HFC mixtures | E280: Mix: HFC-125: 75%; HFC-134a: 25% | F280: Mix: HFC-125: 75%; HFC-134a: 25% | G280: 7 | H280: 1 | I280: HFCs | J280: HFC-134a (1,1,1,2-tetrafluoroethane) | K280: HFC-134a | M280: 0.25 | N280: 1430 | O280: 1430
A281: 269 | B281: of:=FALSE() -> 0 | C281: 7 | D281: HFC mixtures | E281: Mix: HFC-134a: 87%; HFC-125: 13% | F281: Mix: HFC-134a: 87%; HFC-125: 13% | G281: 5 | H281: 1 | I281: HFCs | J281: HFC-125 (pentafluoroethane) | K281: HFC-125 | M281: 0.13 | N281: 3500 | O281: 3500
A282: 269 | B282: of:=FALSE() -> 0 | C282: 7 | D282: HFC mixtures | E282: Mix: HFC-134a: 87%; HFC-125: 13% | F282: Mix: HFC-134a: 87%; HFC-125: 13% | G282: 7 | H282: 1 | I282: HFCs | J282: HFC-134a (1,1,1,2-tetrafluoroethane) | K282: HFC-134a | M282: 0.87 | N282: 1430 | O282: 1430
A283: 270 | B283: of:=FALSE() -> 0 | C283: 7 | D283: HFC mixtures | E283: Mix: Other (1,2 Trans DCE (156-60-5)): 95%; Other (Methoxytridecafluoroheptene isomers): 4%; HFC-43-10mee: 1% | F283: Mix: Other (1,2 Trans DCE (156-60-5)): 95%; Other (Methoxytridecafluoroheptene isomers): 4%; HFC-43-10mee: 1% | G283: 18 | H283: 1 | I283: HFCs | J283: HFC-43-10mee (1,1,1,2,2,3,4,5,5,5-decafluoropentane) | K283: HFC-43-10mee | M283: 0.01 | N283: 1640 | O283: 1640
A284: 270 | B284: of:=FALSE() -> 0 | C284: 7 | D284: HFC mixtures | E284: Mix: Other (1,2 Trans DCE (156-60-5)): 95%; Other (Methoxytridecafluoroheptene isomers): 4%; HFC-43-10mee: 1% | F284: Mix: Other (1,2 Trans DCE (156-60-5)): 95%; Other (Methoxytridecafluoroheptene isomers): 4%; HFC-43-10mee: 1% | G284: 128 | H284: 11 | I284: Other gases | J284: Other (no F-gas of Regulation 517/2014) | K284: Other | L284: 1,2 Trans DCE (156-60-5) | M284: 0.95
A285: 270 | B285: of:=FALSE() -> 0 | C285: 7 | D285: HFC mixtures | E285: Mix: Other (1,2 Trans DCE (156-60-5)): 95%; Other (Methoxytridecafluoroheptene isomers): 4%; HFC-43-10mee: 1% | F285: Mix: Other (1,2 Trans DCE (156-60-5)): 95%; Other (Methoxytridecafluoroheptene isomers): 4%; HFC-43-10mee: 1% | G285: 128 | H285: 11 | I285: Other gases | J285: Other (no F-gas of Regulation 517/2014) | K285: Other | L285: Methoxytridecafluoroheptene isomers | M285: 0.04
A286: 271 | B286: of:=FALSE() -> 0 | C286: 7 | D286: HFC mixtures | E286: Mix: HFC-134a: 95.7%; Dimethyl ether: 4.3% | F286: Mix: HFC-134a: 95.7%; Dimethyl ether: 4.3% | G286: 7 | H286: 1 | I286: HFCs | J286: HFC-134a (1,1,1,2-tetrafluoroethane) | K286: HFC-134a | M286: 0.957 | N286: 1430 | O286: 1430
A287: 271 | B287: of:=FALSE() -> 0 | C287: 7 | D287: HFC mixtures | E287: Mix: HFC-134a: 95.7%; Dimethyl ether: 4.3% | F287: Mix: HFC-134a: 95.7%; Dimethyl ether: 4.3% | G287: 213 | H287: 6 | I287: Non-fluorinated substances | J287: E-170 (Dimethyl ether) | K287: Dimethyl ether | M287: 0.043 | N287: 1 | O287: 1
A288: 272 | B288: of:=FALSE() -> 0 | C288: 7 | D288: HFC mixtures | E288: Mix: HFC-1234yf: 55%; HFC-134a: 45% | F288: Mix: HFC-1234yf: 55%; HFC-134a: 45% | G288: 7 | H288: 1 | I288: HFCs | J288: HFC-134a (1,1,1,2-tetrafluoroethane) | K288: HFC-134a | M288: 0.45 | N288: 1430 | O288: 1430
A289: 272 | B289: of:=FALSE() -> 0 | C289: 7 | D289: HFC mixtures | E289: Mix: HFC-1234yf: 55%; HFC-134a: 45% | F289: Mix: HFC-1234yf: 55%; HFC-134a: 45% | G289: 231 | H289: 3 | I289: Unsaturated HFCs and HCFCs | J289: HFC-1234yf | K289: HFC-1234yf | L289: HFO-1234yf | M289: 0.55 | N289: 4 | O289: 4
A290: 273 | B290: of:=FALSE() -> 0 | C290: 7 | D290: HFC mixtures | E290: Mix: HFC-125: 57.2%; HFC-1234yf: 30.1%; HFC-32: 12.7% | F290: Mix: HFC-125: 57.2%; HFC-1234yf: 30.1%; HFC-32: 12.7% | G290: 3 | H290: 1 | I290: HFCs | J290: HFC-32 (difluoromethane) | K290: HFC-32 | M290: 0.127 | N290: 675 | O290: 675
A291: 273 | B291: of:=FALSE() -> 0 | C291: 7 | D291: HFC mixtures | E291: Mix: HFC-125: 57.2%; HFC-1234yf: 30.1%; HFC-32: 12.7% | F291: Mix: HFC-125: 57.2%; HFC-1234yf: 30.1%; HFC-32: 12.7% | G291: 5 | H291: 1 | I291: HFCs | J291: HFC-125 (pentafluoroethane) | K291: HFC-125 | M291: 0.572 | N291: 3500 | O291: 3500
A292: 273 | B292: of:=FALSE() -> 0 | C292: 7 | D292: HFC mixtures | E292: Mix: HFC-125: 57.2%; HFC-1234yf: 30.1%; HFC-32: 12.7% | F292: Mix: HFC-125: 57.2%; HFC-1234yf: 30.1%; HFC-32: 12.7% | G292: 231 | H292: 3 | I292: Unsaturated HFCs and HCFCs | J292: HFC-1234yf | K292: HFC-1234yf | L292: HFO-1234yf | M292: 0.301 | N292: 4 | O292: 4
A293: 274 | B293: of:=FALSE() -> 0 | C293: 7 | D293: HFC mixtures | E293: Mix: Other (1,2 Trans DCE (156-60-5)): 68.2%; HFC-43-10mee: 25.5%; Other (Ethanol): 6.3% | F293: Mix: Other (1,2 Trans DCE (156-60-5)): 68.2%; HFC-43-10mee: 25.5%; Other (Ethanol): 6.3% | G293: 18 | H293: 1 | I293: HFCs | J293: HFC-43-10mee (1,1,1,2,2,3,4,5,5,5-decafluoropentane) | K293: HFC-43-10mee | M293: 0.255 | N293: 1640 | O293: 1640
A294: 274 | B294: of:=FALSE() -> 0 | C294: 7 | D294: HFC mixtures | E294: Mix: Other (1,2 Trans DCE (156-60-5)): 68.2%; HFC-43-10mee: 25.5%; Other (Ethanol): 6.3% | F294: Mix: Other (1,2 Trans DCE (156-60-5)): 68.2%; HFC-43-10mee: 25.5%; Other (Ethanol): 6.3% | G294: 128 | H294: 11 | I294: Other gases | J294: Other (no F-gas of Regulation 517/2014) | K294: Other | L294: Ethanol | M294: 0.063
A295: 274 | B295: of:=FALSE() -> 0 | C295: 7 | D295: HFC mixtures | E295: Mix: Other (1,2 Trans DCE (156-60-5)): 68.2%; HFC-43-10mee: 25.5%; Other (Ethanol): 6.3% | F295: Mix: Other (1,2 Trans DCE (156-60-5)): 68.2%; HFC-43-10mee: 25.5%; Other (Ethanol): 6.3% | G295: 128 | H295: 11 | I295: Other gases | J295: Other (no F-gas of Regulation 517/2014) | K295: Other | L295: 1,2 Trans DCE (156-60-5) | M295: 0.682
A296: 275 | B296: of:=FALSE() -> 0 | C296: 7 | D296: HFC mixtures | E296: Mix: Other (1,2 Trans DCE (156-60-5)): 83%; HFC-43-10mee: 10%; Other (Heptafluorocyclopentane (15290-77-4)): 7% | F296: Mix: Other (1,2 Trans DCE (156-60-5)): 83%; HFC-43-10mee: 10%; Other (Heptafluorocyclopentane (15290-77-4)): 7% | G296: 18 | H296: 1 | I296: HFCs | J296: HFC-43-10mee (1,1,1,2,2,3,4,5,5,5-decafluoropentane) | K296: HFC-43-10mee | M296: 0.1 | N296: 1640 | O296: 1640
A297: 275 | B297: of:=FALSE() -> 0 | C297: 7 | D297: HFC mixtures | E297: Mix: Other (1,2 Trans DCE (156-60-5)): 83%; HFC-43-10mee: 10%; Other (Heptafluorocyclopentane (15290-77-4)): 7% | F297: Mix: Other (1,2 Trans DCE (156-60-5)): 83%; HFC-43-10mee: 10%; Other (Heptafluorocyclopentane (15290-77-4)): 7% | G297: 128 | H297: 11 | I297: Other gases | J297: Other (no F-gas of Regulation 517/2014) | K297: Other | L297: Heptafluorocyclopentane (15290-77-4) | M297: 0.07
A298: 275 | B298: of:=FALSE() -> 0 | C298: 7 | D298: HFC mixtures | E298: Mix: Other (1,2 Trans DCE (156-60-5)): 83%; HFC-43-10mee: 10%; Other (Heptafluorocyclopentane (15290-77-4)): 7% | F298: Mix: Other (1,2 Trans DCE (156-60-5)): 83%; HFC-43-10mee: 10%; Other (Heptafluorocyclopentane (15290-77-4)): 7% | G298: 128 | H298: 11 | I298: Other gases | J298: Other (no F-gas of Regulation 517/2014) | K298: Other | L298: 1,2 Trans DCE (156-60-5) | M298: 0.83
A299: 276 | B299: of:=FALSE() -> 0 | C299: 7 | D299: HFC mixtures | E299: Mix: Other (1,2 Trans DCE (156-60-5)): 67.2%; HFC-43-10mee: 18%; Other (Heptafluorocyclopentane (15290-77-4)): 12%; Other (Methanol (67-56-1)): 2.8% | F299: Mix: Other (1,2 Trans DCE (156-60-5)): 67.2%; HFC-43-10mee: 18%; Other (Heptafluorocyclopentane (15290-77-4)): 12%; Other (Methanol (67-56-1)): 2.8% | G299: 18 | H299: 1 | I299: HFCs | J299: HFC-43-10mee (1,1,1,2,2,3,4,5,5,5-decafluoropentane) | K299: HFC-43-10mee | M299: 0.18 | N299: 1640 | O299: 1640
A300: 276 | B300: of:=FALSE() -> 0 | C300: 7 | D300: HFC mixtures | E300: Mix: Other (1,2 Trans DCE (156-60-5)): 67.2%; HFC-43-10mee: 18%; Other (Heptafluorocyclopentane (15290-77-4)): 12%; Other (Methanol (67-56-1)): 2.8% | F300: Mix: Other (1,2 Trans DCE (156-60-5)): 67.2%; HFC-43-10mee: 18%; Other (Heptafluorocyclopentane (15290-77-4)): 12%; Other (Methanol (67-56-1)): 2.8% | G300: 128 | H300: 11 | I300: Other gases | J300: Other (no F-gas of Regulation 517/2014) | K300: Other | L300: Methanol (67-56-1) | M300: 0.028
A301: 276 | B301: of:=FALSE() -> 0 | C301: 7 | D301: HFC mixtures | E301: Mix: Other (1,2 Trans DCE (156-60-5)): 67.2%; HFC-43-10mee: 18%; Other (Heptafluorocyclopentane (15290-77-4)): 12%; Other (Methanol (67-56-1)): 2.8% | F301: Mix: Other (1,2 Trans DCE (156-60-5)): 67.2%; HFC-43-10mee: 18%; Other (Heptafluorocyclopentane (15290-77-4)): 12%; Other (Methanol (67-56-1)): 2.8% | G301: 128 | H301: 11 | I301: Other gases | J301: Other (no F-gas of Regulation 517/2014) | K301: Other | L301: Heptafluorocyclopentane (15290-77-4) | M301: 0.12
A302: 276 | B302: of:=FALSE() -> 0 | C302: 7 | D302: HFC mixtures | E302: Mix: Other (1,2 Trans DCE (156-60-5)): 67.2%; HFC-43-10mee: 18%; Other (Heptafluorocyclopentane (15290-77-4)): 12%; Other (Methanol (67-56-1)): 2.8% | F302: Mix: Other (1,2 Trans DCE (156-60-5)): 67.2%; HFC-43-10mee: 18%; Other (Heptafluorocyclopentane (15290-77-4)): 12%; Other (Methanol (67-56-1)): 2.8% | G302: 128 | H302: 11 | I302: Other gases | J302: Other (no F-gas of Regulation 517/2014) | K302: Other | L302: 1,2 Trans DCE (156-60-5) | M302: 0.672
A303: 277 | B303: of:=FALSE() -> 0 | C303: 7 | D303: HFC mixtures | E303: Mix: Other (1,2 Trans DCE (156-60-5)): 85%; HFC-43-10mee: 15% | F303: Mix: Other (1,2 Trans DCE (156-60-5)): 85%; HFC-43-10mee: 15% | G303: 18 | H303: 1 | I303: HFCs | J303: HFC-43-10mee (1,1,1,2,2,3,4,5,5,5-decafluoropentane) | K303: HFC-43-10mee | M303: 0.15 | N303: 1640 | O303: 1640
A304: 277 | B304: of:=FALSE() -> 0 | C304: 7 | D304: HFC mixtures | E304: Mix: Other (1,2 Trans DCE (156-60-5)): 85%; HFC-43-10mee: 15% | F304: Mix: Other (1,2 Trans DCE (156-60-5)): 85%; HFC-43-10mee: 15% | G304: 128 | H304: 11 | I304: Other gases | J304: Other (no F-gas of Regulation 517/2014) | K304: Other | L304: 1,2 Trans DCE (156-60-5) | M304: 0.85
A305: 278 | B305: of:=FALSE() -> 0 | C305: 7 | D305: HFC mixtures | E305: Mix: HFC-43-10mee: 62%; Other (1,2 Trans DCE (156-60-5)): 38% | F305: Mix: HFC-43-10mee: 62%; Other (1,2 Trans DCE (156-60-5)): 38% | G305: 18 | H305: 1 | I305: HFCs | J305: HFC-43-10mee (1,1,1,2,2,3,4,5,5,5-decafluoropentane) | K305: HFC-43-10mee | M305: 0.62 | N305: 1640 | O305: 1640
A306: 278 | B306: of:=FALSE() -> 0 | C306: 7 | D306: HFC mixtures | E306: Mix: HFC-43-10mee: 62%; Other (1,2 Trans DCE (156-60-5)): 38% | F306: Mix: HFC-43-10mee: 62%; Other (1,2 Trans DCE (156-60-5)): 38% | G306: 128 | H306: 11 | I306: Other gases | J306: Other (no F-gas of Regulation 517/2014) | K306: Other | L306: 1,2 Trans DCE (156-60-5) | M306: 0.38
A307: 279 | B307: of:=FALSE() -> 0 | C307: 7 | D307: HFC mixtures | E307: Mix: HFC-43-10mee: 50%; Other (1,2 Trans DCE (156-60-5)): 45%; Other (Cyclopentane (287-92-3)): 5% | F307: Mix: HFC-43-10mee: 50%; Other (1,2 Trans DCE (156-60-5)): 45%; Other (Cyclopentane (287-92-3)): 5% | G307: 18 | H307: 1 | I307: HFCs | J307: HFC-43-10mee (1,1,1,2,2,3,4,5,5,5-decafluoropentane) | K307: HFC-43-10mee | M307: 0.5 | N307: 1640 | O307: 1640
A308: 279 | B308: of:=FALSE() -> 0 | C308: 7 | D308: HFC mixtures | E308: Mix: HFC-43-10mee: 50%; Other (1,2 Trans DCE (156-60-5)): 45%; Other (Cyclopentane (287-92-3)): 5% | F308: Mix: HFC-43-10mee: 50%; Other (1,2 Trans DCE (156-60-5)): 45%; Other (Cyclopentane (287-92-3)): 5% | G308: 128 | H308: 11 | I308: Other gases | J308: Other (no F-gas of Regulation 517/2014) | K308: Other | L308: Cyclopentane (287-92-3) | M308: 0.05
A309: 279 | B309: of:=FALSE() -> 0 | C309: 7 | D309: HFC mixtures | E309: Mix: HFC-43-10mee: 50%; Other (1,2 Trans DCE (156-60-5)): 45%; Other (Cyclopentane (287-92-3)): 5% | F309: Mix: HFC-43-10mee: 50%; Other (1,2 Trans DCE (156-60-5)): 45%; Other (Cyclopentane (287-92-3)): 5% | G309: 128 | H309: 11 | I309: Other gases | J309: Other (no F-gas of Regulation 517/2014) | K309: Other | L309: 1,2 Trans DCE (156-60-5) | M309: 0.45
A310: 280 | B310: of:=FALSE() -> 0 | C310: 7 | D310: HFC mixtures | E310: Mix: HFC-43-10mee: 52.9%; Other (1,2 Trans DCE (156-60-5)): 43%; Other (Methanol (67-56-1)): 4%; Other (Nitromethane (75-52-5)): 0.1% | F310: Mix: HFC-43-10mee: 52.9%; Other (1,2 Trans DCE (156-60-5)): 43%; Other (Methanol (67-56-1)): 4%; Other (Nitromethane (75-52-5)): 0.1% | G310: 18 | H310: 1 | I310: HFCs | J310: HFC-43-10mee (1,1,1,2,2,3,4,5,5,5-decafluoropentane) | K310: HFC-43-10mee | M310: 0.529 | N310: 1640 | O310: 1640
A311: 280 | B311: of:=FALSE() -> 0 | C311: 7 | D311: HFC mixtures | E311: Mix: HFC-43-10mee: 52.9%; Other (1,2 Trans DCE (156-60-5)): 43%; Other (Methanol (67-56-1)): 4%; Other (Nitromethane (75-52-5)): 0.1% | F311: Mix: HFC-43-10mee: 52.9%; Other (1,2 Trans DCE (156-60-5)): 43%; Other (Methanol (67-56-1)): 4%; Other (Nitromethane (75-52-5)): 0.1% | G311: 128 | H311: 11 | I311: Other gases | J311: Other (no F-gas of Regulation 517/2014) | K311: Other | L311: Nitromethane (75-52-5) | M311: 0.001
A312: 280 | B312: of:=FALSE() -> 0 | C312: 7 | D312: HFC mixtures | E312: Mix: HFC-43-10mee: 52.9%; Other (1,2 Trans DCE (156-60-5)): 43%; Other (Methanol (67-56-1)): 4%; Other (Nitromethane (75-52-5)): 0.1% | F312: Mix: HFC-43-10mee: 52.9%; Other (1,2 Trans DCE (156-60-5)): 43%; Other (Methanol (67-56-1)): 4%; Other (Nitromethane (75-52-5)): 0.1% | G312: 128 | H312: 11 | I312: Other gases | J312: Other (no F-gas of Regulation 517/2014) | K312: Other | L312: Methanol (67-56-1) | M312: 0.04
A313: 280 | B313: of:=FALSE() -> 0 | C313: 7 | D313: HFC mixtures | E313: Mix: HFC-43-10mee: 52.9%; Other (1,2 Trans DCE (156-60-5)): 43%; Other (Methanol (67-56-1)): 4%; Other (Nitromethane (75-52-5)): 0.1% | F313: Mix: HFC-43-10mee: 52.9%; Other (1,2 Trans DCE (156-60-5)): 43%; Other (Methanol (67-56-1)): 4%; Other (Nitromethane (75-52-5)): 0.1% | G313: 128 | H313: 11 | I313: Other gases | J313: Other (no F-gas of Regulation 517/2014) | K313: Other | L313: 1,2 Trans DCE (156-60-5) | M313: 0.43
A314: 281 | B314: of:=FALSE() -> 0 | C314: 7 | D314: HFC mixtures | E314: Mix: HFC-43-10mee: 99.4%; Other (Nitromethane (75-52-5)): 0.5%; Other (Zonyl UR-BALD (206009-80-5)): 0.1% | F314: Mix: HFC-43-10mee: 99.4%; Other (Nitromethane (75-52-5)): 0.5%; Other (Zonyl UR-BALD (206009-80-5)): 0.1% | G314: 18 | H314: 1 | I314: HFCs | J314: HFC-43-10mee (1,1,1,2,2,3,4,5,5,5-decafluoropentane) | K314: HFC-43-10mee | M314: 0.994 | N314: 1640 | O314: 1640
A315: 281 | B315: of:=FALSE() -> 0 | C315: 7 | D315: HFC mixtures | E315: Mix: HFC-43-10mee: 99.4%; Other (Nitromethane (75-52-5)): 0.5%; Other (Zonyl UR-BALD (206009-80-5)): 0.1% | F315: Mix: HFC-43-10mee: 99.4%; Other (Nitromethane (75-52-5)): 0.5%; Other (Zonyl UR-BALD (206009-80-5)): 0.1% | G315: 128 | H315: 11 | I315: Other gases | J315: Other (no F-gas of Regulation 517/2014) | K315: Other | L315: Nitromethane (75-52-5) | M315: 0.005
A316: 281 | B316: of:=FALSE() -> 0 | C316: 7 | D316: HFC mixtures | E316: Mix: HFC-43-10mee: 99.4%; Other (Nitromethane (75-52-5)): 0.5%; Other (Zonyl UR-BALD (206009-80-5)): 0.1% | F316: Mix: HFC-43-10mee: 99.4%; Other (Nitromethane (75-52-5)): 0.5%; Other (Zonyl UR-BALD (206009-80-5)): 0.1% | G316: 128 | H316: 11 | I316: Other gases | J316: Other (no F-gas of Regulation 517/2014) | K316: Other | L316: Zonyl UR-BALD (206009-80-5) | M316: 0.001
A317: 282 | B317: of:=FALSE() -> 0 | C317: 7 | D317: HFC mixtures | E317: Mix: HFC-43-10mee: 61.94%; Other (1,2 Trans DCE (156-60-5)): 37.96%; Other (Surfactant 621 (74665-00-2)): 0.1% | F317: Mix: HFC-43-10mee: 61.94%; Other (1,2 Trans DCE (156-60-5)): 37.96%; Other (Surfactant 621 (74665-00-2)): 0.1% | G317: 18 | H317: 1 | I317: HFCs | J317: HFC-43-10mee (1,1,1,2,2,3,4,5,5,5-decafluoropentane) | K317: HFC-43-10mee | M317: 0.6194 | N317: 1640 | O317: 1640
A318: 282 | B318: of:=FALSE() -> 0 | C318: 7 | D318: HFC mixtures | E318: Mix: HFC-43-10mee: 61.94%; Other (1,2 Trans DCE (156-60-5)): 37.96%; Other (Surfactant 621 (74665-00-2)): 0.1% | F318: Mix: HFC-43-10mee: 61.94%; Other (1,2 Trans DCE (156-60-5)): 37.96%; Other (Surfactant 621 (74665-00-2)): 0.1% | G318: 128 | H318: 11 | I318: Other gases | J318: Other (no F-gas of Regulation 517/2014) | K318: Other | L318: 1,2 Trans DCE (156-60-5) | M318: 0.3796
A319: 282 | B319: of:=FALSE() -> 0 | C319: 7 | D319: HFC mixtures | E319: Mix: HFC-43-10mee: 61.94%; Other (1,2 Trans DCE (156-60-5)): 37.96%; Other (Surfactant 621 (74665-00-2)): 0.1% | F319: Mix: HFC-43-10mee: 61.94%; Other (1,2 Trans DCE (156-60-5)): 37.96%; Other (Surfactant 621 (74665-00-2)): 0.1% | G319: 128 | H319: 11 | I319: Other gases | J319: Other (no F-gas of Regulation 517/2014) | K319: Other | L319: Surfactant 621 (74665-00-2) | M319: 0.001
A320: 283 | B320: of:=FALSE() -> 0 | C320: 7 | D320: HFC mixtures | E320: Mix: HFC-43-10mee: 96%; Other (Ethanol (64-17-5)): 4% | F320: Mix: HFC-43-10mee: 96%; Other (Ethanol (64-17-5)): 4% | G320: 18 | H320: 1 | I320: HFCs | J320: HFC-43-10mee (1,1,1,2,2,3,4,5,5,5-decafluoropentane) | K320: HFC-43-10mee | M320: 0.96 | N320: 1640 | O320: 1640
A321: 283 | B321: of:=FALSE() -> 0 | C321: 7 | D321: HFC mixtures | E321: Mix: HFC-43-10mee: 96%; Other (Ethanol (64-17-5)): 4% | F321: Mix: HFC-43-10mee: 96%; Other (Ethanol (64-17-5)): 4% | G321: 128 | H321: 11 | I321: Other gases | J321: Other (no F-gas of Regulation 517/2014) | K321: Other | L321: Ethanol (64-17-5) | M321: 0.04
A322: 284 | B322: of:=FALSE() -> 0 | C322: 7 | D322: HFC mixtures | E322: Mix: HFC-43-10mee: 50.9%; Other (1,2 Trans DCE (156-60-5)): 43%; Other (Methanol (67-56-1)): 4%; Other (Cyclopentane (287-92-3)): 2%; Other (Nitromethane (75-52-5)): 0.1% | F322: Mix: HFC-43-10mee: 50.9%; Other (1,2 Trans DCE (156-60-5)): 43%; Other (Methanol (67-56-1)): 4%; Other (Cyclopentane (287-92-3)): 2%; Other (Nitromethane (75-52-5)): 0.1% | G322: 18 | H322: 1 | I322: HFCs | J322: HFC-43-10mee (1,1,1,2,2,3,4,5,5,5-decafluoropentane) | K322: HFC-43-10mee | M322: 0.509 | N322: 1640 | O322: 1640
A323: 284 | B323: of:=FALSE() -> 0 | C323: 7 | D323: HFC mixtures | E323: Mix: HFC-43-10mee: 50.9%; Other (1,2 Trans DCE (156-60-5)): 43%; Other (Methanol (67-56-1)): 4%; Other (Cyclopentane (287-92-3)): 2%; Other (Nitromethane (75-52-5)): 0.1% | F323: Mix: HFC-43-10mee: 50.9%; Other (1,2 Trans DCE (156-60-5)): 43%; Other (Methanol (67-56-1)): 4%; Other (Cyclopentane (287-92-3)): 2%; Other (Nitromethane (75-52-5)): 0.1% | G323: 128 | H323: 11 | I323: Other gases | J323: Other (no F-gas of Regulation 517/2014) | K323: Other | L323: Cyclopentane (287-92-3) | M323: 0.02
A324: 284 | B324: of:=FALSE() -> 0 | C324: 7 | D324: HFC mixtures | E324: Mix: HFC-43-10mee: 50.9%; Other (1,2 Trans DCE (156-60-5)): 43%; Other (Methanol (67-56-1)): 4%; Other (Cyclopentane (287-92-3)): 2%; Other (Nitromethane (75-52-5)): 0.1% | F324: Mix: HFC-43-10mee: 50.9%; Other (1,2 Trans DCE (156-60-5)): 43%; Other (Methanol (67-56-1)): 4%; Other (Cyclopentane (287-92-3)): 2%; Other (Nitromethane (75-52-5)): 0.1% | G324: 128 | H324: 11 | I324: Other gases | J324: Other (no F-gas of Regulation 517/2014) | K324: Other | L324: Methanol (67-56-1) | M324: 0.04
A325: 284 | B325: of:=FALSE() -> 0 | C325: 7 | D325: HFC mixtures | E325: Mix: HFC-43-10mee: 50.9%; Other (1,2 Trans DCE (156-60-5)): 43%; Other (Methanol (67-56-1)): 4%; Other (Cyclopentane (287-92-3)): 2%; Other (Nitromethane (75-52-5)): 0.1% | F325: Mix: HFC-43-10mee: 50.9%; Other (1,2 Trans DCE (156-60-5)): 43%; Other (Methanol (67-56-1)): 4%; Other (Cyclopentane (287-92-3)): 2%; Other (Nitromethane (75-52-5)): 0.1% | G325: 128 | H325: 11 | I325: Other gases | J325: Other (no F-gas of Regulation 517/2014) | K325: Other | L325: 1,2 Trans DCE (156-60-5) | M325: 0.43
A326: 284 | B326: of:=FALSE() -> 0 | C326: 7 | D326: HFC mixtures | E326: Mix: HFC-43-10mee: 50.9%; Other (1,2 Trans DCE (156-60-5)): 43%; Other (Methanol (67-56-1)): 4%; Other (Cyclopentane (287-92-3)): 2%; Other (Nitromethane (75-52-5)): 0.1% | F326: Mix: HFC-43-10mee: 50.9%; Other (1,2 Trans DCE (156-60-5)): 43%; Other (Methanol (67-56-1)): 4%; Other (Cyclopentane (287-92-3)): 2%; Other (Nitromethane (75-52-5)): 0.1% | G326: 128 | H326: 11 | I326: Other gases | J326: Other (no F-gas of Regulation 517/2014) | K326: Other | L326: Nitromethane (75-52-5) | M326: 0.001
A327: 285 | B327: of:=FALSE() -> 0 | C327: 7 | D327: HFC mixtures | E327: Mix: HFC-43-10mee: 96.75%; Other (Isopropyl alcohol (IPA) (67-63-0)): 3.25% | F327: Mix: HFC-43-10mee: 96.75%; Other (Isopropyl alcohol (IPA) (67-63-0)): 3.25% | G327: 18 | H327: 1 | I327: HFCs | J327: HFC-43-10mee (1,1,1,2,2,3,4,5,5,5-decafluoropentane) | K327: HFC-43-10mee | M327: 0.9675 | N327: 1640 | O327: 1640
A328: 285 | B328: of:=FALSE() -> 0 | C328: 7 | D328: HFC mixtures | E328: Mix: HFC-43-10mee: 96.75%; Other (Isopropyl alcohol (IPA) (67-63-0)): 3.25% | F328: Mix: HFC-43-10mee: 96.75%; Other (Isopropyl alcohol (IPA) (67-63-0)): 3.25% | G328: 128 | H328: 11 | I328: Other gases | J328: Other (no F-gas of Regulation 517/2014) | K328: Other | L328: Isopropyl alcohol (IPA) (67-63-0) | M328: 0.0325
A329: 286 | B329: of:=FALSE() -> 0 | C329: 7 | D329: HFC mixtures | E329: Mix: HFC-43-10mee: 57%; Other (OS-10 (107-46-0)): 43% | F329: Mix: HFC-43-10mee: 57%; Other (OS-10 (107-46-0)): 43% | G329: 18 | H329: 1 | I329: HFCs | J329: HFC-43-10mee (1,1,1,2,2,3,4,5,5,5-decafluoropentane) | K329: HFC-43-10mee | M329: 0.57 | N329: 1640 | O329: 1640
A330: 286 | B330: of:=FALSE() -> 0 | C330: 7 | D330: HFC mixtures | E330: Mix: HFC-43-10mee: 57%; Other (OS-10 (107-46-0)): 43% | F330: Mix: HFC-43-10mee: 57%; Other (OS-10 (107-46-0)): 43% | G330: 128 | H330: 11 | I330: Other gases | J330: Other (no F-gas of Regulation 517/2014) | K330: Other | L330: OS-10 (107-46-0) | M330: 0.43
A331: 288 | B331: of:=FALSE() -> 0 | C331: 7 | D331: HFC mixtures | E331: Mix: PFC-14: 36.5%; HFC-245fa: 22%; PFC-218: 12.5%; HFC-23: 11%; Isobutane: 7%; Other (Argon): 4%; Methane: 3.5%; Ethane: 3.5% | F331: Mix: PFC-14: 36.5%; HFC-245fa: 22%; PFC-218: 12.5%; HFC-23: 11%; Isobutane: 7%; Other (Argon): 4%; Methane: 3.5%; Ethane: 3.5% | G331: 2 | H331: 1 | I331: HFCs | J331: HFC-23 (trifluoromethane, fluoroform) | K331: HFC-23 | M331: 0.11 | N331: 14800 | O331: 14800
A332: 288 | B332: of:=FALSE() -> 0 | C332: 7 | D332: HFC mixtures | E332: Mix: PFC-14: 36.5%; HFC-245fa: 22%; PFC-218: 12.5%; HFC-23: 11%; Isobutane: 7%; Other (Argon): 4%; Methane: 3.5%; Ethane: 3.5% | F332: Mix: PFC-14: 36.5%; HFC-245fa: 22%; PFC-218: 12.5%; HFC-23: 11%; Isobutane: 7%; Other (Argon): 4%; Methane: 3.5%; Ethane: 3.5% | G332: 16 | H332: 1 | I332: HFCs | J332: HFC-245fa (1,1,1,3,3-pentafluoropropane) | K332: HFC-245fa | M332: 0.22 | N332: 1030 | O332: 1030
A333: 288 | B333: of:=FALSE() -> 0 | C333: 7 | D333: HFC mixtures | E333: Mix: PFC-14: 36.5%; HFC-245fa: 22%; PFC-218: 12.5%; HFC-23: 11%; Isobutane: 7%; Other (Argon): 4%; Methane: 3.5%; Ethane: 3.5% | F333: Mix: PFC-14: 36.5%; HFC-245fa: 22%; PFC-218: 12.5%; HFC-23: 11%; Isobutane: 7%; Other (Argon): 4%; Methane: 3.5%; Ethane: 3.5% | G333: 19 | H333: 2 | I333: PFCs | J333: PFC-14 (CF4) | K333: PFC-14 | M333: 0.365 | N333: 7390 | O333: 7390
A334: 288 | B334: of:=FALSE() -> 0 | C334: 7 | D334: HFC mixtures | E334: Mix: PFC-14: 36.5%; HFC-245fa: 22%; PFC-218: 12.5%; HFC-23: 11%; Isobutane: 7%; Other (Argon): 4%; Methane: 3.5%; Ethane: 3.5% | F334: Mix: PFC-14: 36.5%; HFC-245fa: 22%; PFC-218: 12.5%; HFC-23: 11%; Isobutane: 7%; Other (Argon): 4%; Methane: 3.5%; Ethane: 3.5% | G334: 21 | H334: 2 | I334: PFCs | J334: PFC-218 (C3F8) | K334: PFC-218 | M334: 0.125 | N334: 8830 | O334: 8830
A335: 288 | B335: of:=FALSE() -> 0 | C335: 7 | D335: HFC mixtures | E335: Mix: PFC-14: 36.5%; HFC-245fa: 22%; PFC-218: 12.5%; HFC-23: 11%; Isobutane: 7%; Other (Argon): 4%; Methane: 3.5%; Ethane: 3.5% | F335: Mix: PFC-14: 36.5%; HFC-245fa: 22%; PFC-218: 12.5%; HFC-23: 11%; Isobutane: 7%; Other (Argon): 4%; Methane: 3.5%; Ethane: 3.5% | G335: 128 | H335: 11 | I335: Other gases | J335: Other (no F-gas of Regulation 517/2014) | K335: Other | L335: Argon | M335: 0.04
A336: 288 | B336: of:=FALSE() -> 0 | C336: 7 | D336: HFC mixtures | E336: Mix: PFC-14: 36.5%; HFC-245fa: 22%; PFC-218: 12.5%; HFC-23: 11%; Isobutane: 7%; Other (Argon): 4%; Methane: 3.5%; Ethane: 3.5% | F336: Mix: PFC-14: 36.5%; HFC-245fa: 22%; PFC-218: 12.5%; HFC-23: 11%; Isobutane: 7%; Other (Argon): 4%; Methane: 3.5%; Ethane: 3.5% | G336: 211 | H336: 6 | I336: Non-fluorinated substances | J336: CH4 (Methane) | K336: Methane | M336: 0.035 | N336: 25 | O336: 25
A337: 288 | B337: of:=FALSE() -> 0 | C337: 7 | D337: HFC mixtures | E337: Mix: PFC-14: 36.5%; HFC-245fa: 22%; PFC-218: 12.5%; HFC-23: 11%; Isobutane: 7%; Other (Argon): 4%; Methane: 3.5%; Ethane: 3.5% | F337: Mix: PFC-14: 36.5%; HFC-245fa: 22%; PFC-218: 12.5%; HFC-23: 11%; Isobutane: 7%; Other (Argon): 4%; Methane: 3.5%; Ethane: 3.5% | G337: 217 | H337: 6 | I337: Non-fluorinated substances | J337: R-170 (Ethane) | K337: Ethane | M337: 0.035 | N337: 6 | O337: 6
A338: 288 | B338: of:=FALSE() -> 0 | C338: 7 | D338: HFC mixtures | E338: Mix: PFC-14: 36.5%; HFC-245fa: 22%; PFC-218: 12.5%; HFC-23: 11%; Isobutane: 7%; Other (Argon): 4%; Methane: 3.5%; Ethane: 3.5% | F338: Mix: PFC-14: 36.5%; HFC-245fa: 22%; PFC-218: 12.5%; HFC-23: 11%; Isobutane: 7%; Other (Argon): 4%; Methane: 3.5%; Ethane: 3.5% | G338: 220 | H338: 6 | I338: Non-fluorinated substances | J338: R-600A (Isobutane) | K338: Isobutane | M338: 0.07 | N338: 3 | O338: 3
A339: 290 | B339: of:=FALSE() -> 0 | C339: 9 | D339: Non-HFC mixtures | E339: Mix: Other (R 22): 99%; Other (R12): 1% | F339: Mix: Other (R 22): 99%; Other (R12): 1% | G339: 128 | H339: 11 | I339: Other gases | J339: Other (no F-gas of Regulation 517/2014) | K339: Other | L339: R12 | M339: 0.01
A340: 290 | B340: of:=FALSE() -> 0 | C340: 9 | D340: Non-HFC mixtures | E340: Mix: Other (R 22): 99%; Other (R12): 1% | F340: Mix: Other (R 22): 99%; Other (R12): 1% | G340: 128 | H340: 11 | I340: Other gases | J340: Other (no F-gas of Regulation 517/2014) | K340: Other | L340: R 22 | M340: 0.99
A341: 292 | B341: of:=FALSE() -> 0 | C341: 7 | D341: HFC mixtures | E341: Mix: HFC-134a: 25.7%; HFC-1234yf: 25.3%; HFC-125: 24.7%; HFC-32: 24.3% | F341: Mix: HFC-134a: 25.7%; HFC-1234yf: 25.3%; HFC-125: 24.7%; HFC-32: 24.3% | G341: 3 | H341: 1 | I341: HFCs | J341: HFC-32 (difluoromethane) | K341: HFC-32 | M341: 0.243 | N341: 675 | O341: 675
A342: 292 | B342: of:=FALSE() -> 0 | C342: 7 | D342: HFC mixtures | E342: Mix: HFC-134a: 25.7%; HFC-1234yf: 25.3%; HFC-125: 24.7%; HFC-32: 24.3% | F342: Mix: HFC-134a: 25.7%; HFC-1234yf: 25.3%; HFC-125: 24.7%; HFC-32: 24.3% | G342: 5 | H342: 1 | I342: HFCs | J342: HFC-125 (pentafluoroethane) | K342: HFC-125 | M342: 0.247 | N342: 3500 | O342: 3500
A343: 292 | B343: of:=FALSE() -> 0 | C343: 7 | D343: HFC mixtures | E343: Mix: HFC-134a: 25.7%; HFC-1234yf: 25.3%; HFC-125: 24.7%; HFC-32: 24.3% | F343: Mix: HFC-134a: 25.7%; HFC-1234yf: 25.3%; HFC-125: 24.7%; HFC-32: 24.3% | G343: 7 | H343: 1 | I343: HFCs | J343: HFC-134a (1,1,1,2-tetrafluoroethane) | K343: HFC-134a | M343: 0.257 | N343: 1430 | O343: 1430
A344: 292 | B344: of:=FALSE() -> 0 | C344: 7 | D344: HFC mixtures | E344: Mix: HFC-134a: 25.7%; HFC-1234yf: 25.3%; HFC-125: 24.7%; HFC-32: 24.3% | F344: Mix: HFC-134a: 25.7%; HFC-1234yf: 25.3%; HFC-125: 24.7%; HFC-32: 24.3% | G344: 231 | H344: 3 | I344: Unsaturated HFCs and HCFCs | J344: HFC-1234yf | K344: HFC-1234yf | M344: 0.253 | N344: 4 | O344: 4
A345: 293 | B345: of:=FALSE() -> 0 | C345: 7 | D345: HFC mixtures | E345: Mix: HFC-245fa: 30%; PFC-14: 29%; HFC-23: 23%; HFC-125: 13%; Other (Argon): 5% | F345: Mix: HFC-245fa: 30%; PFC-14: 29%; HFC-23: 23%; HFC-125: 13%; Other (Argon): 5% | G345: 2 | H345: 1 | I345: HFCs | J345: HFC-23 (trifluoromethane, fluoroform) | K345: HFC-23 | M345: 0.23 | N345: 14800 | O345: 14800
A346: 293 | B346: of:=FALSE() -> 0 | C346: 7 | D346: HFC mixtures | E346: Mix: HFC-245fa: 30%; PFC-14: 29%; HFC-23: 23%; HFC-125: 13%; Other (Argon): 5% | F346: Mix: HFC-245fa: 30%; PFC-14: 29%; HFC-23: 23%; HFC-125: 13%; Other (Argon): 5% | G346: 5 | H346: 1 | I346: HFCs | J346: HFC-125 (pentafluoroethane) | K346: HFC-125 | M346: 0.13 | N346: 3500 | O346: 3500
A347: 293 | B347: of:=FALSE() -> 0 | C347: 7 | D347: HFC mixtures | E347: Mix: HFC-245fa: 30%; PFC-14: 29%; HFC-23: 23%; HFC-125: 13%; Other (Argon): 5% | F347: Mix: HFC-245fa: 30%; PFC-14: 29%; HFC-23: 23%; HFC-125: 13%; Other (Argon): 5% | G347: 16 | H347: 1 | I347: HFCs | J347: HFC-245fa (1,1,1,3,3-pentafluoropropane) | K347: HFC-245fa | M347: 0.3 | N347: 1030 | O347: 1030
A348: 293 | B348: of:=FALSE() -> 0 | C348: 7 | D348: HFC mixtures | E348: Mix: HFC-245fa: 30%; PFC-14: 29%; HFC-23: 23%; HFC-125: 13%; Other (Argon): 5% | F348: Mix: HFC-245fa: 30%; PFC-14: 29%; HFC-23: 23%; HFC-125: 13%; Other (Argon): 5% | G348: 19 | H348: 2 | I348: PFCs | J348: PFC-14 (CF4) | K348: PFC-14 | M348: 0.29 | N348: 7390 | O348: 7390
A349: 293 | B349: of:=FALSE() -> 0 | C349: 7 | D349: HFC mixtures | E349: Mix: HFC-245fa: 30%; PFC-14: 29%; HFC-23: 23%; HFC-125: 13%; Other (Argon): 5% | F349: Mix: HFC-245fa: 30%; PFC-14: 29%; HFC-23: 23%; HFC-125: 13%; Other (Argon): 5% | G349: 128 | H349: 11 | I349: Other gases | J349: Other (no F-gas of Regulation 517/2014) | K349: Other | L349: Argon | M349: 0.05
A350: 294 | B350: of:=FALSE() -> 0 | C350: 7 | D350: HFC mixtures | E350: Mix: HFC-236fa: 33%; PFC-14: 30%; HFC-23: 20%; HFC-125: 13%; Other (Argon): 4% | F350: Mix: HFC-236fa: 33%; PFC-14: 30%; HFC-23: 20%; HFC-125: 13%; Other (Argon): 4% | G350: 2 | H350: 1 | I350: HFCs | J350: HFC-23 (trifluoromethane, fluoroform) | K350: HFC-23 | M350: 0.2 | N350: 14800 | O350: 14800
A351: 294 | B351: of:=FALSE() -> 0 | C351: 7 | D351: HFC mixtures | E351: Mix: HFC-236fa: 33%; PFC-14: 30%; HFC-23: 20%; HFC-125: 13%; Other (Argon): 4% | F351: Mix: HFC-236fa: 33%; PFC-14: 30%; HFC-23: 20%; HFC-125: 13%; Other (Argon): 4% | G351: 5 | H351: 1 | I351: HFCs | J351: HFC-125 (pentafluoroethane) | K351: HFC-125 | M351: 0.13 | N351: 3500 | O351: 3500
A352: 294 | B352: of:=FALSE() -> 0 | C352: 7 | D352: HFC mixtures | E352: Mix: HFC-236fa: 33%; PFC-14: 30%; HFC-23: 20%; HFC-125: 13%; Other (Argon): 4% | F352: Mix: HFC-236fa: 33%; PFC-14: 30%; HFC-23: 20%; HFC-125: 13%; Other (Argon): 4% | G352: 14 | H352: 1 | I352: HFCs | J352: HFC-236fa (1,1,1,3,3,3-hexafluoropropane) | K352: HFC-236fa | M352: 0.33 | N352: 9810 | O352: 9810
A353: 294 | B353: of:=FALSE() -> 0 | C353: 7 | D353: HFC mixtures | E353: Mix: HFC-236fa: 33%; PFC-14: 30%; HFC-23: 20%; HFC-125: 13%; Other (Argon): 4% | F353: Mix: HFC-236fa: 33%; PFC-14: 30%; HFC-23: 20%; HFC-125: 13%; Other (Argon): 4% | G353: 19 | H353: 2 | I353: PFCs | J353: PFC-14 (CF4) | K353: PFC-14 | M353: 0.3 | N353: 7390 | O353: 7390
A354: 294 | B354: of:=FALSE() -> 0 | C354: 7 | D354: HFC mixtures | E354: Mix: HFC-236fa: 33%; PFC-14: 30%; HFC-23: 20%; HFC-125: 13%; Other (Argon): 4% | F354: Mix: HFC-236fa: 33%; PFC-14: 30%; HFC-23: 20%; HFC-125: 13%; Other (Argon): 4% | G354: 128 | H354: 11 | I354: Other gases | J354: Other (no F-gas of Regulation 517/2014) | K354: Other | L354: Argon | M354: 0.04
A355: 295 | B355: of:=FALSE() -> 0 | C355: 7 | D355: HFC mixtures | E355: Mix: HFC-236fa: 38%; PFC-14: 28%; HFC-125: 15%; HFC-23: 15%; Other (argon): 4% | F355: Mix: HFC-236fa: 38%; PFC-14: 28%; HFC-125: 15%; HFC-23: 15%; Other (argon): 4% | G355: 2 | H355: 1 | I355: HFCs | J355: HFC-23 (trifluoromethane, fluoroform) | K355: HFC-23 | M355: 0.15 | N355: 14800 | O355: 14800
A356: 295 | B356: of:=FALSE() -> 0 | C356: 7 | D356: HFC mixtures | E356: Mix: HFC-236fa: 38%; PFC-14: 28%; HFC-125: 15%; HFC-23: 15%; Other (argon): 4% | F356: Mix: HFC-236fa: 38%; PFC-14: 28%; HFC-125: 15%; HFC-23: 15%; Other (argon): 4% | G356: 5 | H356: 1 | I356: HFCs | J356: HFC-125 (pentafluoroethane) | K356: HFC-125 | M356: 0.15 | N356: 3500 | O356: 3500
A357: 295 | B357: of:=FALSE() -> 0 | C357: 7 | D357: HFC mixtures | E357: Mix: HFC-236fa: 38%; PFC-14: 28%; HFC-125: 15%; HFC-23: 15%; Other (argon): 4% | F357: Mix: HFC-236fa: 38%; PFC-14: 28%; HFC-125: 15%; HFC-23: 15%; Other (argon): 4% | G357: 14 | H357: 1 | I357: HFCs | J357: HFC-236fa (1,1,1,3,3,3-hexafluoropropane) | K357: HFC-236fa | M357: 0.38 | N357: 9810 | O357: 9810
A358: 295 | B358: of:=FALSE() -> 0 | C358: 7 | D358: HFC mixtures | E358: Mix: HFC-236fa: 38%; PFC-14: 28%; HFC-125: 15%; HFC-23: 15%; Other (argon): 4% | F358: Mix: HFC-236fa: 38%; PFC-14: 28%; HFC-125: 15%; HFC-23: 15%; Other (argon): 4% | G358: 19 | H358: 2 | I358: PFCs | J358: PFC-14 (CF4) | K358: PFC-14 | M358: 0.28 | N358: 7390 | O358: 7390
A359: 295 | B359: of:=FALSE() -> 0 | C359: 7 | D359: HFC mixtures | E359: Mix: HFC-236fa: 38%; PFC-14: 28%; HFC-125: 15%; HFC-23: 15%; Other (argon): 4% | F359: Mix: HFC-236fa: 38%; PFC-14: 28%; HFC-125: 15%; HFC-23: 15%; Other (argon): 4% | G359: 128 | H359: 11 | I359: Other gases | J359: Other (no F-gas of Regulation 517/2014) | K359: Other | L359: argon | M359: 0.04
A360: 297 | B360: of:=FALSE() -> 0 | C360: 7 | D360: HFC mixtures | E360: Mix: HFC-125: 67.39%; HFC-134a: 32.61% | F360: Mix: HFC-125: 67.39%; HFC-134a: 32.61% | G360: 5 | H360: 1 | I360: HFCs | J360: HFC-125 (pentafluoroethane) | K360: HFC-125 | M360: 0.6739 | N360: 3500 | O360: 3500
A361: 297 | B361: of:=FALSE() -> 0 | C361: 7 | D361: HFC mixtures | E361: Mix: HFC-125: 67.39%; HFC-134a: 32.61% | F361: Mix: HFC-125: 67.39%; HFC-134a: 32.61% | G361: 7 | H361: 1 | I361: HFCs | J361: HFC-134a (1,1,1,2-tetrafluoroethane) | K361: HFC-134a | M361: 0.3261 | N361: 1430 | O361: 1430
A362: 299 | B362: of:=FALSE() -> 0 | C362: 7 | D362: HFC mixtures | E362: Mix: HFC-134a: 80.1%; HFC-125: 19.9% | F362: Mix: HFC-134a: 80.1%; HFC-125: 19.9% | G362: 5 | H362: 1 | I362: HFCs | J362: HFC-125 (pentafluoroethane) | K362: HFC-125 | M362: 0.199 | N362: 3500 | O362: 3500
A363: 299 | B363: of:=FALSE() -> 0 | C363: 7 | D363: HFC mixtures | E363: Mix: HFC-134a: 80.1%; HFC-125: 19.9% | F363: Mix: HFC-134a: 80.1%; HFC-125: 19.9% | G363: 7 | H363: 1 | I363: HFCs | J363: HFC-134a (1,1,1,2-tetrafluoroethane) | K363: HFC-134a | M363: 0.801 | N363: 1430 | O363: 1430
A364: 300 | B364: of:=FALSE() -> 0 | C364: 7 | D364: HFC mixtures | E364: Mix: HFC-227ea: 20%; HFC-125: 20%; HFC-143a: 20%; HFC-32: 20%; HFC-134a: 20% | F364: Mix: HFC-227ea: 20%; HFC-125: 20%; HFC-143a: 20%; HFC-32: 20%; HFC-134a: 20% | G364: 3 | H364: 1 | I364: HFCs | J364: HFC-32 (difluoromethane) | K364: HFC-32 | M364: 0.2 | N364: 675 | O364: 675
A365: 300 | B365: of:=FALSE() -> 0 | C365: 7 | D365: HFC mixtures | E365: Mix: HFC-227ea: 20%; HFC-125: 20%; HFC-143a: 20%; HFC-32: 20%; HFC-134a: 20% | F365: Mix: HFC-227ea: 20%; HFC-125: 20%; HFC-143a: 20%; HFC-32: 20%; HFC-134a: 20% | G365: 5 | H365: 1 | I365: HFCs | J365: HFC-125 (pentafluoroethane) | K365: HFC-125 | M365: 0.2 | N365: 3500 | O365: 3500
A366: 300 | B366: of:=FALSE() -> 0 | C366: 7 | D366: HFC mixtures | E366: Mix: HFC-227ea: 20%; HFC-125: 20%; HFC-143a: 20%; HFC-32: 20%; HFC-134a: 20% | F366: Mix: HFC-227ea: 20%; HFC-125: 20%; HFC-143a: 20%; HFC-32: 20%; HFC-134a: 20% | G366: 7 | H366: 1 | I366: HFCs | J366: HFC-134a (1,1,1,2-tetrafluoroethane) | K366: HFC-134a | M366: 0.2 | N366: 1430 | O366: 1430
A367: 300 | B367: of:=FALSE() -> 0 | C367: 7 | D367: HFC mixtures | E367: Mix: HFC-227ea: 20%; HFC-125: 20%; HFC-143a: 20%; HFC-32: 20%; HFC-134a: 20% | F367: Mix: HFC-227ea: 20%; HFC-125: 20%; HFC-143a: 20%; HFC-32: 20%; HFC-134a: 20% | G367: 9 | H367: 1 | I367: HFCs | J367: HFC-143a (1,1,1-trifluoroethane) | K367: HFC-143a | M367: 0.2 | N367: 4470 | O367: 4470
A368: 300 | B368: of:=FALSE() -> 0 | C368: 7 | D368: HFC mixtures | E368: Mix: HFC-227ea: 20%; HFC-125: 20%; HFC-143a: 20%; HFC-32: 20%; HFC-134a: 20% | F368: Mix: HFC-227ea: 20%; HFC-125: 20%; HFC-143a: 20%; HFC-32: 20%; HFC-134a: 20% | G368: 11 | H368: 1 | I368: HFCs | J368: HFC-227ea (1,1,1,2,3,3,3-heptafluoropropane) | K368: HFC-227ea | M368: 0.2 | N368: 3220 | O368: 3220
A369: 301 | B369: of:=FALSE() -> 0 | C369: 7 | D369: HFC mixtures | E369: Mix: HFE-347 mcc3 (HFE-7000): 34%; PFC-14: 26%; HFC-125: 26%; Ethane: 5%; HFC-23: 5%; Other (Argon): 4% | F369: Mix: HFE-347 mcc3 (HFE-7000): 34%; PFC-14: 26%; HFC-125: 26%; Ethane: 5%; HFC-23: 5%; Other (Argon): 4% | G369: 2 | H369: 1 | I369: HFCs | J369: HFC-23 (trifluoromethane, fluoroform) | K369: HFC-23 | M369: 0.05 | N369: 14800 | O369: 14800
A370: 301 | B370: of:=FALSE() -> 0 | C370: 7 | D370: HFC mixtures | E370: Mix: HFE-347 mcc3 (HFE-7000): 34%; PFC-14: 26%; HFC-125: 26%; Ethane: 5%; HFC-23: 5%; Other (Argon): 4% | F370: Mix: HFE-347 mcc3 (HFE-7000): 34%; PFC-14: 26%; HFC-125: 26%; Ethane: 5%; HFC-23: 5%; Other (Argon): 4% | G370: 5 | H370: 1 | I370: HFCs | J370: HFC-125 (pentafluoroethane) | K370: HFC-125 | M370: 0.26 | N370: 3500 | O370: 3500
A371: 301 | B371: of:=FALSE() -> 0 | C371: 7 | D371: HFC mixtures | E371: Mix: HFE-347 mcc3 (HFE-7000): 34%; PFC-14: 26%; HFC-125: 26%; Ethane: 5%; HFC-23: 5%; Other (Argon): 4% | F371: Mix: HFE-347 mcc3 (HFE-7000): 34%; PFC-14: 26%; HFC-125: 26%; Ethane: 5%; HFC-23: 5%; Other (Argon): 4% | G371: 19 | H371: 2 | I371: PFCs | J371: PFC-14 (CF4) | K371: PFC-14 | M371: 0.26 | N371: 7390 | O371: 7390
A372: 301 | B372: of:=FALSE() -> 0 | C372: 7 | D372: HFC mixtures | E372: Mix: HFE-347 mcc3 (HFE-7000): 34%; PFC-14: 26%; HFC-125: 26%; Ethane: 5%; HFC-23: 5%; Other (Argon): 4% | F372: Mix: HFE-347 mcc3 (HFE-7000): 34%; PFC-14: 26%; HFC-125: 26%; Ethane: 5%; HFC-23: 5%; Other (Argon): 4% | G372: 128 | H372: 11 | I372: Other gases | J372: Other (no F-gas of Regulation 517/2014) | K372: Other | L372: Argon | M372: 0.04
A373: 301 | B373: of:=FALSE() -> 0 | C373: 7 | D373: HFC mixtures | E373: Mix: HFE-347 mcc3 (HFE-7000): 34%; PFC-14: 26%; HFC-125: 26%; Ethane: 5%; HFC-23: 5%; Other (Argon): 4% | F373: Mix: HFE-347 mcc3 (HFE-7000): 34%; PFC-14: 26%; HFC-125: 26%; Ethane: 5%; HFC-23: 5%; Other (Argon): 4% | G373: 180 | H373: 4 | I373: HFEs and alcohols | J373: HFE-347 mcc3 (HFE-7000) | K373: HFE-347 mcc3 (HFE-7000) | M373: 0.34 | N373: 575 | O373: 575
A374: 301 | B374: of:=FALSE() -> 0 | C374: 7 | D374: HFC mixtures | E374: Mix: HFE-347 mcc3 (HFE-7000): 34%; PFC-14: 26%; HFC-125: 26%; Ethane: 5%; HFC-23: 5%; Other (Argon): 4% | F374: Mix: HFE-347 mcc3 (HFE-7000): 34%; PFC-14: 26%; HFC-125: 26%; Ethane: 5%; HFC-23: 5%; Other (Argon): 4% | G374: 217 | H374: 6 | I374: Non-fluorinated substances | J374: R-170 (Ethane) | K374: Ethane | M374: 0.05 | N374: 6 | O374: 6
A375: 302 | B375: of:=FALSE() -> 0 | C375: 7 | D375: HFC mixtures | E375: Mix: HFE-347 mcc3 (HFE-7000): 33%; PFC-14: 28%; HFC-125: 25%; Ethane: 5%; HFC-23: 5%; Other (Argon): 4% | F375: Mix: HFE-347 mcc3 (HFE-7000): 33%; PFC-14: 28%; HFC-125: 25%; Ethane: 5%; HFC-23: 5%; Other (Argon): 4% | G375: 2 | H375: 1 | I375: HFCs | J375: HFC-23 (trifluoromethane, fluoroform) | K375: HFC-23 | M375: 0.05 | N375: 14800 | O375: 14800
A376: 302 | B376: of:=FALSE() -> 0 | C376: 7 | D376: HFC mixtures | E376: Mix: HFE-347 mcc3 (HFE-7000): 33%; PFC-14: 28%; HFC-125: 25%; Ethane: 5%; HFC-23: 5%; Other (Argon): 4% | F376: Mix: HFE-347 mcc3 (HFE-7000): 33%; PFC-14: 28%; HFC-125: 25%; Ethane: 5%; HFC-23: 5%; Other (Argon): 4% | G376: 5 | H376: 1 | I376: HFCs | J376: HFC-125 (pentafluoroethane) | K376: HFC-125 | M376: 0.25 | N376: 3500 | O376: 3500
A377: 302 | B377: of:=FALSE() -> 0 | C377: 7 | D377: HFC mixtures | E377: Mix: HFE-347 mcc3 (HFE-7000): 33%; PFC-14: 28%; HFC-125: 25%; Ethane: 5%; HFC-23: 5%; Other (Argon): 4% | F377: Mix: HFE-347 mcc3 (HFE-7000): 33%; PFC-14: 28%; HFC-125: 25%; Ethane: 5%; HFC-23: 5%; Other (Argon): 4% | G377: 19 | H377: 2 | I377: PFCs | J377: PFC-14 (CF4) | K377: PFC-14 | M377: 0.28 | N377: 7390 | O377: 7390
A378: 302 | B378: of:=FALSE() -> 0 | C378: 7 | D378: HFC mixtures | E378: Mix: HFE-347 mcc3 (HFE-7000): 33%; PFC-14: 28%; HFC-125: 25%; Ethane: 5%; HFC-23: 5%; Other (Argon): 4% | F378: Mix: HFE-347 mcc3 (HFE-7000): 33%; PFC-14: 28%; HFC-125: 25%; Ethane: 5%; HFC-23: 5%; Other (Argon): 4% | G378: 128 | H378: 11 | I378: Other gases | J378: Other (no F-gas of Regulation 517/2014) | K378: Other | L378: Argon | M378: 0.04
A379: 302 | B379: of:=FALSE() -> 0 | C379: 7 | D379: HFC mixtures | E379: Mix: HFE-347 mcc3 (HFE-7000): 33%; PFC-14: 28%; HFC-125: 25%; Ethane: 5%; HFC-23: 5%; Other (Argon): 4% | F379: Mix: HFE-347 mcc3 (HFE-7000): 33%; PFC-14: 28%; HFC-125: 25%; Ethane: 5%; HFC-23: 5%; Other (Argon): 4% | G379: 180 | H379: 4 | I379: HFEs and alcohols | J379: HFE-347 mcc3 (HFE-7000) | K379: HFE-347 mcc3 (HFE-7000) | M379: 0.33 | N379: 575 | O379: 575
A380: 302 | B380: of:=FALSE() -> 0 | C380: 7 | D380: HFC mixtures | E380: Mix: HFE-347 mcc3 (HFE-7000): 33%; PFC-14: 28%; HFC-125: 25%; Ethane: 5%; HFC-23: 5%; Other (Argon): 4% | F380: Mix: HFE-347 mcc3 (HFE-7000): 33%; PFC-14: 28%; HFC-125: 25%; Ethane: 5%; HFC-23: 5%; Other (Argon): 4% | G380: 217 | H380: 6 | I380: Non-fluorinated substances | J380: R-170 (Ethane) | K380: Ethane | M380: 0.05 | N380: 6 | O380: 6
A381: 303 | B381: of:=FALSE() -> 0 | C381: 7 | D381: HFC mixtures | E381: Mix: PFC-14: 37%; HFC-125: 25%; HFE-347 mcc3 (HFE-7000): 24%; Other (Argon): 6%; HFC-23: 5%; Ethane: 3% | F381: Mix: PFC-14: 37%; HFC-125: 25%; HFE-347 mcc3 (HFE-7000): 24%; Other (Argon): 6%; HFC-23: 5%; Ethane: 3% | G381: 2 | H381: 1 | I381: HFCs | J381: HFC-23 (trifluoromethane, fluoroform) | K381: HFC-23 | M381: 0.05 | N381: 14800 | O381: 14800
A382: 303 | B382: of:=FALSE() -> 0 | C382: 7 | D382: HFC mixtures | E382: Mix: PFC-14: 37%; HFC-125: 25%; HFE-347 mcc3 (HFE-7000): 24%; Other (Argon): 6%; HFC-23: 5%; Ethane: 3% | F382: Mix: PFC-14: 37%; HFC-125: 25%; HFE-347 mcc3 (HFE-7000): 24%; Other (Argon): 6%; HFC-23: 5%; Ethane: 3% | G382: 5 | H382: 1 | I382: HFCs | J382: HFC-125 (pentafluoroethane) | K382: HFC-125 | M382: 0.25 | N382: 3500 | O382: 3500
A383: 303 | B383: of:=FALSE() -> 0 | C383: 7 | D383: HFC mixtures | E383: Mix: PFC-14: 37%; HFC-125: 25%; HFE-347 mcc3 (HFE-7000): 24%; Other (Argon): 6%; HFC-23: 5%; Ethane: 3% | F383: Mix: PFC-14: 37%; HFC-125: 25%; HFE-347 mcc3 (HFE-7000): 24%; Other (Argon): 6%; HFC-23: 5%; Ethane: 3% | G383: 19 | H383: 2 | I383: PFCs | J383: PFC-14 (CF4) | K383: PFC-14 | M383: 0.37 | N383: 7390 | O383: 7390
A384: 303 | B384: of:=FALSE() -> 0 | C384: 7 | D384: HFC mixtures | E384: Mix: PFC-14: 37%; HFC-125: 25%; HFE-347 mcc3 (HFE-7000): 24%; Other (Argon): 6%; HFC-23: 5%; Ethane: 3% | F384: Mix: PFC-14: 37%; HFC-125: 25%; HFE-347 mcc3 (HFE-7000): 24%; Other (Argon): 6%; HFC-23: 5%; Ethane: 3% | G384: 128 | H384: 11 | I384: Other gases | J384: Other (no F-gas of Regulation 517/2014) | K384: Other | L384: Argon | M384: 0.06
A385: 303 | B385: of:=FALSE() -> 0 | C385: 7 | D385: HFC mixtures | E385: Mix: PFC-14: 37%; HFC-125: 25%; HFE-347 mcc3 (HFE-7000): 24%; Other (Argon): 6%; HFC-23: 5%; Ethane: 3% | F385: Mix: PFC-14: 37%; HFC-125: 25%; HFE-347 mcc3 (HFE-7000): 24%; Other (Argon): 6%; HFC-23: 5%; Ethane: 3% | G385: 180 | H385: 4 | I385: HFEs and alcohols | J385: HFE-347 mcc3 (HFE-7000) | K385: HFE-347 mcc3 (HFE-7000) | M385: 0.24 | N385: 575 | O385: 575
A386: 303 | B386: of:=FALSE() -> 0 | C386: 7 | D386: HFC mixtures | E386: Mix: PFC-14: 37%; HFC-125: 25%; HFE-347 mcc3 (HFE-7000): 24%; Other (Argon): 6%; HFC-23: 5%; Ethane: 3% | F386: Mix: PFC-14: 37%; HFC-125: 25%; HFE-347 mcc3 (HFE-7000): 24%; Other (Argon): 6%; HFC-23: 5%; Ethane: 3% | G386: 217 | H386: 6 | I386: Non-fluorinated substances | J386: R-170 (Ethane) | K386: Ethane | M386: 0.03 | N386: 6 | O386: 6
A387: 304 | B387: of:=FALSE() -> 0 | C387: 7 | D387: HFC mixtures | E387: Mix: HFC-125: 30%; HFE-347 mcc3 (HFE-7000): 30%; PFC-14: 27%; Other (Argon): 5%; Ethane: 4%; HFC-23: 4% | F387: Mix: HFC-125: 30%; HFE-347 mcc3 (HFE-7000): 30%; PFC-14: 27%; Other (Argon): 5%; Ethane: 4%; HFC-23: 4% | G387: 2 | H387: 1 | I387: HFCs | J387: HFC-23 (trifluoromethane, fluoroform) | K387: HFC-23 | M387: 0.04 | N387: 14800 | O387: 14800
A388: 304 | B388: of:=FALSE() -> 0 | C388: 7 | D388: HFC mixtures | E388: Mix: HFC-125: 30%; HFE-347 mcc3 (HFE-7000): 30%; PFC-14: 27%; Other (Argon): 5%; Ethane: 4%; HFC-23: 4% | F388: Mix: HFC-125: 30%; HFE-347 mcc3 (HFE-7000): 30%; PFC-14: 27%; Other (Argon): 5%; Ethane: 4%; HFC-23: 4% | G388: 5 | H388: 1 | I388: HFCs | J388: HFC-125 (pentafluoroethane) | K388: HFC-125 | M388: 0.3 | N388: 3500 | O388: 3500
A389: 304 | B389: of:=FALSE() -> 0 | C389: 7 | D389: HFC mixtures | E389: Mix: HFC-125: 30%; HFE-347 mcc3 (HFE-7000): 30%; PFC-14: 27%; Other (Argon): 5%; Ethane: 4%; HFC-23: 4% | F389: Mix: HFC-125: 30%; HFE-347 mcc3 (HFE-7000): 30%; PFC-14: 27%; Other (Argon): 5%; Ethane: 4%; HFC-23: 4% | G389: 19 | H389: 2 | I389: PFCs | J389: PFC-14 (CF4) | K389: PFC-14 | M389: 0.27 | N389: 7390 | O389: 7390
A390: 304 | B390: of:=FALSE() -> 0 | C390: 7 | D390: HFC mixtures | E390: Mix: HFC-125: 30%; HFE-347 mcc3 (HFE-7000): 30%; PFC-14: 27%; Other (Argon): 5%; Ethane: 4%; HFC-23: 4% | F390: Mix: HFC-125: 30%; HFE-347 mcc3 (HFE-7000): 30%; PFC-14: 27%; Other (Argon): 5%; Ethane: 4%; HFC-23: 4% | G390: 128 | H390: 11 | I390: Other gases | J390: Other (no F-gas of Regulation 517/2014) | K390: Other | L390: Argon | M390: 0.05
A391: 304 | B391: of:=FALSE() -> 0 | C391: 7 | D391: HFC mixtures | E391: Mix: HFC-125: 30%; HFE-347 mcc3 (HFE-7000): 30%; PFC-14: 27%; Other (Argon): 5%; Ethane: 4%; HFC-23: 4% | F391: Mix: HFC-125: 30%; HFE-347 mcc3 (HFE-7000): 30%; PFC-14: 27%; Other (Argon): 5%; Ethane: 4%; HFC-23: 4% | G391: 180 | H391: 4 | I391: HFEs and alcohols | J391: HFE-347 mcc3 (HFE-7000) | K391: HFE-347 mcc3 (HFE-7000) | M391: 0.3 | N391: 575 | O391: 575
A392: 304 | B392: of:=FALSE() -> 0 | C392: 7 | D392: HFC mixtures | E392: Mix: HFC-125: 30%; HFE-347 mcc3 (HFE-7000): 30%; PFC-14: 27%; Other (Argon): 5%; Ethane: 4%; HFC-23: 4% | F392: Mix: HFC-125: 30%; HFE-347 mcc3 (HFE-7000): 30%; PFC-14: 27%; Other (Argon): 5%; Ethane: 4%; HFC-23: 4% | G392: 217 | H392: 6 | I392: Non-fluorinated substances | J392: R-170 (Ethane) | K392: Ethane | M392: 0.04 | N392: 6 | O392: 6
A393: 305 | B393: of:=FALSE() -> 0 | C393: 7 | D393: HFC mixtures | E393: Mix: PFC-14: 60%; Other (Argon): 12%; HFC-125: 12%; Ethane: 9%; HFC-23: 7% | F393: Mix: PFC-14: 60%; Other (Argon): 12%; HFC-125: 12%; Ethane: 9%; HFC-23: 7% | G393: 2 | H393: 1 | I393: HFCs | J393: HFC-23 (trifluoromethane, fluoroform) | K393: HFC-23 | M393: 0.07 | N393: 14800 | O393: 14800
A394: 305 | B394: of:=FALSE() -> 0 | C394: 7 | D394: HFC mixtures | E394: Mix: PFC-14: 60%; Other (Argon): 12%; HFC-125: 12%; Ethane: 9%; HFC-23: 7% | F394: Mix: PFC-14: 60%; Other (Argon): 12%; HFC-125: 12%; Ethane: 9%; HFC-23: 7% | G394: 5 | H394: 1 | I394: HFCs | J394: HFC-125 (pentafluoroethane) | K394: HFC-125 | M394: 0.12 | N394: 3500 | O394: 3500
A395: 305 | B395: of:=FALSE() -> 0 | C395: 7 | D395: HFC mixtures | E395: Mix: PFC-14: 60%; Other (Argon): 12%; HFC-125: 12%; Ethane: 9%; HFC-23: 7% | F395: Mix: PFC-14: 60%; Other (Argon): 12%; HFC-125: 12%; Ethane: 9%; HFC-23: 7% | G395: 19 | H395: 2 | I395: PFCs | J395: PFC-14 (CF4) | K395: PFC-14 | M395: 0.6 | N395: 7390 | O395: 7390
A396: 305 | B396: of:=FALSE() -> 0 | C396: 7 | D396: HFC mixtures | E396: Mix: PFC-14: 60%; Other (Argon): 12%; HFC-125: 12%; Ethane: 9%; HFC-23: 7% | F396: Mix: PFC-14: 60%; Other (Argon): 12%; HFC-125: 12%; Ethane: 9%; HFC-23: 7% | G396: 128 | H396: 11 | I396: Other gases | J396: Other (no F-gas of Regulation 517/2014) | K396: Other | L396: Argon | M396: 0.12
A397: 305 | B397: of:=FALSE() -> 0 | C397: 7 | D397: HFC mixtures | E397: Mix: PFC-14: 60%; Other (Argon): 12%; HFC-125: 12%; Ethane: 9%; HFC-23: 7% | F397: Mix: PFC-14: 60%; Other (Argon): 12%; HFC-125: 12%; Ethane: 9%; HFC-23: 7% | G397: 217 | H397: 6 | I397: Non-fluorinated substances | J397: R-170 (Ethane) | K397: Ethane | M397: 0.09 | N397: 6 | O397: 6
A398: 306 | B398: of:=FALSE() -> 0 | C398: 7 | D398: HFC mixtures | E398: Mix: HFE-347 mcc3 (HFE-7000): 34%; PFC-14: 31%; HFC-125: 26%; Other (Argon): 3%; Ethane: 3%; HFC-23: 3% | F398: Mix: HFE-347 mcc3 (HFE-7000): 34%; PFC-14: 31%; HFC-125: 26%; Other (Argon): 3%; Ethane: 3%; HFC-23: 3% | G398: 2 | H398: 1 | I398: HFCs | J398: HFC-23 (trifluoromethane, fluoroform) | K398: HFC-23 | M398: 0.03 | N398: 14800 | O398: 14800
A399: 306 | B399: of:=FALSE() -> 0 | C399: 7 | D399: HFC mixtures | E399: Mix: HFE-347 mcc3 (HFE-7000): 34%; PFC-14: 31%; HFC-125: 26%; Other (Argon): 3%; Ethane: 3%; HFC-23: 3% | F399: Mix: HFE-347 mcc3 (HFE-7000): 34%; PFC-14: 31%; HFC-125: 26%; Other (Argon): 3%; Ethane: 3%; HFC-23: 3% | G399: 5 | H399: 1 | I399: HFCs | J399: HFC-125 (pentafluoroethane) | K399: HFC-125 | M399: 0.26 | N399: 3500 | O399: 3500
A400: 306 | B400: of:=FALSE() -> 0 | C400: 7 | D400: HFC mixtures | E400: Mix: HFE-347 mcc3 (HFE-7000): 34%; PFC-14: 31%; HFC-125: 26%; Other (Argon): 3%; Ethane: 3%; HFC-23: 3% | F400: Mix: HFE-347 mcc3 (HFE-7000): 34%; PFC-14: 31%; HFC-125: 26%; Other (Argon): 3%; Ethane: 3%; HFC-23: 3% | G400: 19 | H400: 2 | I400: PFCs | J400: PFC-14 (CF4) | K400: PFC-14 | M400: 0.31 | N400: 7390 | O400: 7390
A401: 306 | B401: of:=FALSE() -> 0 | C401: 7 | D401: HFC mixtures | E401: Mix: HFE-347 mcc3 (HFE-7000): 34%; PFC-14: 31%; HFC-125: 26%; Other (Argon): 3%; Ethane: 3%; HFC-23: 3% | F401: Mix: HFE-347 mcc3 (HFE-7000): 34%; PFC-14: 31%; HFC-125: 26%; Other (Argon): 3%; Ethane: 3%; HFC-23: 3% | G401: 128 | H401: 11 | I401: Other gases | J401: Other (no F-gas of Regulation 517/2014) | K401: Other | L401: Argon | M401: 0.03
A402: 306 | B402: of:=FALSE() -> 0 | C402: 7 | D402: HFC mixtures | E402: Mix: HFE-347 mcc3 (HFE-7000): 34%; PFC-14: 31%; HFC-125: 26%; Other (Argon): 3%; Ethane: 3%; HFC-23: 3% | F402: Mix: HFE-347 mcc3 (HFE-7000): 34%; PFC-14: 31%; HFC-125: 26%; Other (Argon): 3%; Ethane: 3%; HFC-23: 3% | G402: 180 | H402: 4 | I402: HFEs and alcohols | J402: HFE-347 mcc3 (HFE-7000) | K402: HFE-347 mcc3 (HFE-7000) | M402: 0.34 | N402: 575 | O402: 575
A403: 306 | B403: of:=FALSE() -> 0 | C403: 7 | D403: HFC mixtures | E403: Mix: HFE-347 mcc3 (HFE-7000): 34%; PFC-14: 31%; HFC-125: 26%; Other (Argon): 3%; Ethane: 3%; HFC-23: 3% | F403: Mix: HFE-347 mcc3 (HFE-7000): 34%; PFC-14: 31%; HFC-125: 26%; Other (Argon): 3%; Ethane: 3%; HFC-23: 3% | G403: 217 | H403: 6 | I403: Non-fluorinated substances | J403: R-170 (Ethane) | K403: Ethane | M403: 0.03 | N403: 6 | O403: 6
A404: 309 | B404: of:=FALSE() -> 0 | C404: 7 | D404: HFC mixtures | E404: Mix: HFC-365mfc: 65%; Other (perfluoropolymethylisopropylether (PFPMIE)): 35% | F404: Mix: HFC-365mfc: 65%; Other (perfluoropolymethylisopropylether (PFPMIE)): 35% | G404: 17 | H404: 1 | I404: HFCs | J404: HFC-365mfc (1,1,1,3,3-pentafluorobutane) | K404: HFC-365mfc | M404: 0.65 | N404: 794 | O404: 794
A405: 309 | B405: of:=FALSE() -> 0 | C405: 7 | D405: HFC mixtures | E405: Mix: HFC-365mfc: 65%; Other (perfluoropolymethylisopropylether (PFPMIE)): 35% | F405: Mix: HFC-365mfc: 65%; Other (perfluoropolymethylisopropylether (PFPMIE)): 35% | G405: 128 | H405: 11 | I405: Other gases | J405: Other (no F-gas of Regulation 517/2014) | K405: Other | L405: perfluoropolymethylisopropylether (PFPMIE) | M405: 0.35
A406: 318 | B406: of:=FALSE() -> 0 | C406: 7 | D406: HFC mixtures | E406: Mix: HFC-125: 25%; HFC-32: 25%; HFC-1234yf: 25%; HFC-134a: 25% | F406: Mix: HFC-125: 25%; HFC-32: 25%; HFC-1234yf: 25%; HFC-134a: 25% | G406: 3 | H406: 1 | I406: HFCs | J406: HFC-32 (difluoromethane) | K406: HFC-32 | M406: 0.25 | N406: 675 | O406: 675
A407: 318 | B407: of:=FALSE() -> 0 | C407: 7 | D407: HFC mixtures | E407: Mix: HFC-125: 25%; HFC-32: 25%; HFC-1234yf: 25%; HFC-134a: 25% | F407: Mix: HFC-125: 25%; HFC-32: 25%; HFC-1234yf: 25%; HFC-134a: 25% | G407: 5 | H407: 1 | I407: HFCs | J407: HFC-125 (pentafluoroethane) | K407: HFC-125 | M407: 0.25 | N407: 3500 | O407: 3500
A408: 318 | B408: of:=FALSE() -> 0 | C408: 7 | D408: HFC mixtures | E408: Mix: HFC-125: 25%; HFC-32: 25%; HFC-1234yf: 25%; HFC-134a: 25% | F408: Mix: HFC-125: 25%; HFC-32: 25%; HFC-1234yf: 25%; HFC-134a: 25% | G408: 7 | H408: 1 | I408: HFCs | J408: HFC-134a (1,1,1,2-tetrafluoroethane) | K408: HFC-134a | M408: 0.25 | N408: 1430 | O408: 1430
A409: 318 | B409: of:=FALSE() -> 0 | C409: 7 | D409: HFC mixtures | E409: Mix: HFC-125: 25%; HFC-32: 25%; HFC-1234yf: 25%; HFC-134a: 25% | F409: Mix: HFC-125: 25%; HFC-32: 25%; HFC-1234yf: 25%; HFC-134a: 25% | G409: 231 | H409: 3 | I409: Unsaturated HFCs and HCFCs | J409: HFC-1234yf | K409: HFC-1234yf | M409: 0.25 | N409: 4 | O409: 4
A410: 319 | B410: of:=FALSE() -> 0 | C410: 7 | D410: HFC mixtures | E410: Mix: Other (1,2 Trans DCE (156-60-5)): 68.2%; HFC-43-10mee: 25.5%; Other (Ethanol (64-17-5)): 6.3% | F410: Mix: Other (1,2 Trans DCE (156-60-5)): 68.2%; HFC-43-10mee: 25.5%; Other (Ethanol (64-17-5)): 6.3% | G410: 18 | H410: 1 | I410: HFCs | J410: HFC-43-10mee (1,1,1,2,2,3,4,5,5,5-decafluoropentane) | K410: HFC-43-10mee | M410: 0.255 | N410: 1640 | O410: 1640
A411: 319 | B411: of:=FALSE() -> 0 | C411: 7 | D411: HFC mixtures | E411: Mix: Other (1,2 Trans DCE (156-60-5)): 68.2%; HFC-43-10mee: 25.5%; Other (Ethanol (64-17-5)): 6.3% | F411: Mix: Other (1,2 Trans DCE (156-60-5)): 68.2%; HFC-43-10mee: 25.5%; Other (Ethanol (64-17-5)): 6.3% | G411: 128 | H411: 11 | I411: Other gases | J411: Other (no F-gas of Regulation 517/2014) | K411: Other | L411: 1,2 Trans DCE (156-60-5) | M411: 0.682
A412: 319 | B412: of:=FALSE() -> 0 | C412: 7 | D412: HFC mixtures | E412: Mix: Other (1,2 Trans DCE (156-60-5)): 68.2%; HFC-43-10mee: 25.5%; Other (Ethanol (64-17-5)): 6.3% | F412: Mix: Other (1,2 Trans DCE (156-60-5)): 68.2%; HFC-43-10mee: 25.5%; Other (Ethanol (64-17-5)): 6.3% | G412: 128 | H412: 11 | I412: Other gases | J412: Other (no F-gas of Regulation 517/2014) | K412: Other | L412: Ethanol (64-17-5) | M412: 0.063
A413: 328 | B413: of:=FALSE() -> 0 | C413: 7 | D413: HFC mixtures | E413: Mix: HFC-32: 78.5%; HFC-1234yf: 21.5% | F413: Mix: HFC-32: 78.5%; HFC-1234yf: 21.5% | G413: 3 | H413: 1 | I413: HFCs | J413: HFC-32 (difluoromethane) | K413: HFC-32 | M413: 0.785 | N413: 675 | O413: 675
A414: 328 | B414: of:=FALSE() -> 0 | C414: 7 | D414: HFC mixtures | E414: Mix: HFC-32: 78.5%; HFC-1234yf: 21.5% | F414: Mix: HFC-32: 78.5%; HFC-1234yf: 21.5% | G414: 231 | H414: 3 | I414: Unsaturated HFCs and HCFCs | J414: HFC-1234yf | K414: HFC-1234yf | M414: 0.215 | N414: 4 | O414: 4
A415: 329 | B415: of:=FALSE() -> 0 | C415: 7 | D415: HFC mixtures | E415: Mix: HFC-1234yf: 65%; HFC-32: 35% | F415: Mix: HFC-1234yf: 65%; HFC-32: 35% | G415: 3 | H415: 1 | I415: HFCs | J415: HFC-32 (difluoromethane) | K415: HFC-32 | M415: 0.35 | N415: 675 | O415: 675
A416: 329 | B416: of:=FALSE() -> 0 | C416: 7 | D416: HFC mixtures | E416: Mix: HFC-1234yf: 65%; HFC-32: 35% | F416: Mix: HFC-1234yf: 65%; HFC-32: 35% | G416: 231 | H416: 3 | I416: Unsaturated HFCs and HCFCs | J416: HFC-1234yf | K416: HFC-1234yf | M416: 0.65 | N416: 4 | O416: 4
A417: 330 | B417: of:=FALSE() -> 0 | C417: 7 | D417: HFC mixtures | E417: Mix: Ethane: 16.7%; HFE-347 mcc3 (HFE-7000): 16.7%; PFC-14: 16.7%; HFC-23: 16.7%; HFC-125: 16.7%; Other (Argon): 16.5% | F417: Mix: Ethane: 16.7%; HFE-347 mcc3 (HFE-7000): 16.7%; PFC-14: 16.7%; HFC-23: 16.7%; HFC-125: 16.7%; Other (Argon): 16.5% | G417: 2 | H417: 1 | I417: HFCs | J417: HFC-23 (trifluoromethane, fluoroform) | K417: HFC-23 | M417: 0.167 | N417: 14800 | O417: 14800
A418: 330 | B418: of:=FALSE() -> 0 | C418: 7 | D418: HFC mixtures | E418: Mix: Ethane: 16.7%; HFE-347 mcc3 (HFE-7000): 16.7%; PFC-14: 16.7%; HFC-23: 16.7%; HFC-125: 16.7%; Other (Argon): 16.5% | F418: Mix: Ethane: 16.7%; HFE-347 mcc3 (HFE-7000): 16.7%; PFC-14: 16.7%; HFC-23: 16.7%; HFC-125: 16.7%; Other (Argon): 16.5% | G418: 5 | H418: 1 | I418: HFCs | J418: HFC-125 (pentafluoroethane) | K418: HFC-125 | M418: 0.167 | N418: 3500 | O418: 3500
A419: 330 | B419: of:=FALSE() -> 0 | C419: 7 | D419: HFC mixtures | E419: Mix: Ethane: 16.7%; HFE-347 mcc3 (HFE-7000): 16.7%; PFC-14: 16.7%; HFC-23: 16.7%; HFC-125: 16.7%; Other (Argon): 16.5% | F419: Mix: Ethane: 16.7%; HFE-347 mcc3 (HFE-7000): 16.7%; PFC-14: 16.7%; HFC-23: 16.7%; HFC-125: 16.7%; Other (Argon): 16.5% | G419: 19 | H419: 2 | I419: PFCs | J419: PFC-14 (CF4) | K419: PFC-14 | M419: 0.167 | N419: 7390 | O419: 7390
A420: 330 | B420: of:=FALSE() -> 0 | C420: 7 | D420: HFC mixtures | E420: Mix: Ethane: 16.7%; HFE-347 mcc3 (HFE-7000): 16.7%; PFC-14: 16.7%; HFC-23: 16.7%; HFC-125: 16.7%; Other (Argon): 16.5% | F420: Mix: Ethane: 16.7%; HFE-347 mcc3 (HFE-7000): 16.7%; PFC-14: 16.7%; HFC-23: 16.7%; HFC-125: 16.7%; Other (Argon): 16.5% | G420: 128 | H420: 11 | I420: Other gases | J420: Other (no F-gas of Regulation 517/2014) | K420: Other | L420: Argon | M420: 0.165
A421: 330 | B421: of:=FALSE() -> 0 | C421: 7 | D421: HFC mixtures | E421: Mix: Ethane: 16.7%; HFE-347 mcc3 (HFE-7000): 16.7%; PFC-14: 16.7%; HFC-23: 16.7%; HFC-125: 16.7%; Other (Argon): 16.5% | F421: Mix: Ethane: 16.7%; HFE-347 mcc3 (HFE-7000): 16.7%; PFC-14: 16.7%; HFC-23: 16.7%; HFC-125: 16.7%; Other (Argon): 16.5% | G421: 180 | H421: 4 | I421: HFEs and alcohols | J421: HFE-347 mcc3 (HFE-7000) | K421: HFE-347 mcc3 (HFE-7000) | M421: 0.167 | N421: 575 | O421: 575
A422: 330 | B422: of:=FALSE() -> 0 | C422: 7 | D422: HFC mixtures | E422: Mix: Ethane: 16.7%; HFE-347 mcc3 (HFE-7000): 16.7%; PFC-14: 16.7%; HFC-23: 16.7%; HFC-125: 16.7%; Other (Argon): 16.5% | F422: Mix: Ethane: 16.7%; HFE-347 mcc3 (HFE-7000): 16.7%; PFC-14: 16.7%; HFC-23: 16.7%; HFC-125: 16.7%; Other (Argon): 16.5% | G422: 217 | H422: 6 | I422: Non-fluorinated substances | J422: R-170 (Ethane) | K422: Ethane | M422: 0.167 | N422: 6 | O422: 6
A423: 331 | B423: of:=FALSE() -> 0 | C423: 9 | D423: Non-HFC mixtures | E423: Mix: Other (Argon): 50%; PFC-14: 50% | F423: Mix: Other (Argon): 50%; PFC-14: 50% | G423: 19 | H423: 2 | I423: PFCs | J423: PFC-14 (CF4) | K423: PFC-14 | M423: 0.5 | N423: 7390 | O423: 7390
A424: 331 | B424: of:=FALSE() -> 0 | C424: 9 | D424: Non-HFC mixtures | E424: Mix: Other (Argon): 50%; PFC-14: 50% | F424: Mix: Other (Argon): 50%; PFC-14: 50% | G424: 128 | H424: 11 | I424: Other gases | J424: Other (no F-gas of Regulation 517/2014) | K424: Other | L424: Argon | M424: 0.5
A425: 339 | B425: of:=FALSE() -> 0 | C425: 7 | D425: HFC mixtures | E425: Mix: HFC-236fa: 35.7%; PFC-14: 27%; HFC-23: 18.1%; HFC-125: 14.6%; Other (-AR): 4.6% | F425: Mix: HFC-236fa: 35.7%; PFC-14: 27%; HFC-23: 18.1%; HFC-125: 14.6%; Other (-AR): 4.6% | G425: 2 | H425: 1 | I425: HFCs | J425: HFC-23 (trifluoromethane, fluoroform) | K425: HFC-23 | M425: 0.181 | N425: 14800 | O425: 14800
A426: 339 | B426: of:=FALSE() -> 0 | C426: 7 | D426: HFC mixtures | E426: Mix: HFC-236fa: 35.7%; PFC-14: 27%; HFC-23: 18.1%; HFC-125: 14.6%; Other (-AR): 4.6% | F426: Mix: HFC-236fa: 35.7%; PFC-14: 27%; HFC-23: 18.1%; HFC-125: 14.6%; Other (-AR): 4.6% | G426: 5 | H426: 1 | I426: HFCs | J426: HFC-125 (pentafluoroethane) | K426: HFC-125 | M426: 0.146 | N426: 3500 | O426: 3500
A427: 339 | B427: of:=FALSE() -> 0 | C427: 7 | D427: HFC mixtures | E427: Mix: HFC-236fa: 35.7%; PFC-14: 27%; HFC-23: 18.1%; HFC-125: 14.6%; Other (-AR): 4.6% | F427: Mix: HFC-236fa: 35.7%; PFC-14: 27%; HFC-23: 18.1%; HFC-125: 14.6%; Other (-AR): 4.6% | G427: 14 | H427: 1 | I427: HFCs | J427: HFC-236fa (1,1,1,3,3,3-hexafluoropropane) | K427: HFC-236fa | M427: 0.357 | N427: 9810 | O427: 9810
A428: 339 | B428: of:=FALSE() -> 0 | C428: 7 | D428: HFC mixtures | E428: Mix: HFC-236fa: 35.7%; PFC-14: 27%; HFC-23: 18.1%; HFC-125: 14.6%; Other (-AR): 4.6% | F428: Mix: HFC-236fa: 35.7%; PFC-14: 27%; HFC-23: 18.1%; HFC-125: 14.6%; Other (-AR): 4.6% | G428: 19 | H428: 2 | I428: PFCs | J428: PFC-14 (CF4) | K428: PFC-14 | M428: 0.27 | N428: 7390 | O428: 7390
A429: 339 | B429: of:=FALSE() -> 0 | C429: 7 | D429: HFC mixtures | E429: Mix: HFC-236fa: 35.7%; PFC-14: 27%; HFC-23: 18.1%; HFC-125: 14.6%; Other (-AR): 4.6% | F429: Mix: HFC-236fa: 35.7%; PFC-14: 27%; HFC-23: 18.1%; HFC-125: 14.6%; Other (-AR): 4.6% | G429: 128 | H429: 11 | I429: Other gases | J429: Other (no F-gas of Regulation 517/2014) | K429: Other | L429: -AR | M429: 0.046
A430: 340 | B430: of:=FALSE() -> 0 | C430: 7 | D430: HFC mixtures | E430: Mix: HFC-236fa: 37.8%; PFC-14: 27.3%; HFC-23: 17.9%; HFC-125: 11.2%; Other (-AR): 5.8% | F430: Mix: HFC-236fa: 37.8%; PFC-14: 27.3%; HFC-23: 17.9%; HFC-125: 11.2%; Other (-AR): 5.8% | G430: 2 | H430: 1 | I430: HFCs | J430: HFC-23 (trifluoromethane, fluoroform) | K430: HFC-23 | M430: 0.179 | N430: 14800 | O430: 14800
A431: 340 | B431: of:=FALSE() -> 0 | C431: 7 | D431: HFC mixtures | E431: Mix: HFC-236fa: 37.8%; PFC-14: 27.3%; HFC-23: 17.9%; HFC-125: 11.2%; Other (-AR): 5.8% | F431: Mix: HFC-236fa: 37.8%; PFC-14: 27.3%; HFC-23: 17.9%; HFC-125: 11.2%; Other (-AR): 5.8% | G431: 5 | H431: 1 | I431: HFCs | J431: HFC-125 (pentafluoroethane) | K431: HFC-125 | M431: 0.112 | N431: 3500 | O431: 3500
A432: 340 | B432: of:=FALSE() -> 0 | C432: 7 | D432: HFC mixtures | E432: Mix: HFC-236fa: 37.8%; PFC-14: 27.3%; HFC-23: 17.9%; HFC-125: 11.2%; Other (-AR): 5.8% | F432: Mix: HFC-236fa: 37.8%; PFC-14: 27.3%; HFC-23: 17.9%; HFC-125: 11.2%; Other (-AR): 5.8% | G432: 14 | H432: 1 | I432: HFCs | J432: HFC-236fa (1,1,1,3,3,3-hexafluoropropane) | K432: HFC-236fa | M432: 0.378 | N432: 9810 | O432: 9810
A433: 340 | B433: of:=FALSE() -> 0 | C433: 7 | D433: HFC mixtures | E433: Mix: HFC-236fa: 37.8%; PFC-14: 27.3%; HFC-23: 17.9%; HFC-125: 11.2%; Other (-AR): 5.8% | F433: Mix: HFC-236fa: 37.8%; PFC-14: 27.3%; HFC-23: 17.9%; HFC-125: 11.2%; Other (-AR): 5.8% | G433: 19 | H433: 2 | I433: PFCs | J433: PFC-14 (CF4) | K433: PFC-14 | M433: 0.273 | N433: 7390 | O433: 7390
A434: 340 | B434: of:=FALSE() -> 0 | C434: 7 | D434: HFC mixtures | E434: Mix: HFC-236fa: 37.8%; PFC-14: 27.3%; HFC-23: 17.9%; HFC-125: 11.2%; Other (-AR): 5.8% | F434: Mix: HFC-236fa: 37.8%; PFC-14: 27.3%; HFC-23: 17.9%; HFC-125: 11.2%; Other (-AR): 5.8% | G434: 128 | H434: 11 | I434: Other gases | J434: Other (no F-gas of Regulation 517/2014) | K434: Other | L434: -AR | M434: 0.058
A435: 341 | B435: of:=FALSE() -> 0 | C435: 7 | D435: HFC mixtures | E435: Mix: PFC-14: 30.6%; HFC-245fa: 30.3%; HFC-23: 22.2%; HFC-125: 11.9%; Other (-AR): 5% | F435: Mix: PFC-14: 30.6%; HFC-245fa: 30.3%; HFC-23: 22.2%; HFC-125: 11.9%; Other (-AR): 5% | G435: 2 | H435: 1 | I435: HFCs | J435: HFC-23 (trifluoromethane, fluoroform) | K435: HFC-23 | M435: 0.222 | N435: 14800 | O435: 14800
A436: 341 | B436: of:=FALSE() -> 0 | C436: 7 | D436: HFC mixtures | E436: Mix: PFC-14: 30.6%; HFC-245fa: 30.3%; HFC-23: 22.2%; HFC-125: 11.9%; Other (-AR): 5% | F436: Mix: PFC-14: 30.6%; HFC-245fa: 30.3%; HFC-23: 22.2%; HFC-125: 11.9%; Other (-AR): 5% | G436: 5 | H436: 1 | I436: HFCs | J436: HFC-125 (pentafluoroethane) | K436: HFC-125 | M436: 0.119 | N436: 3500 | O436: 3500
A437: 341 | B437: of:=FALSE() -> 0 | C437: 7 | D437: HFC mixtures | E437: Mix: PFC-14: 30.6%; HFC-245fa: 30.3%; HFC-23: 22.2%; HFC-125: 11.9%; Other (-AR): 5% | F437: Mix: PFC-14: 30.6%; HFC-245fa: 30.3%; HFC-23: 22.2%; HFC-125: 11.9%; Other (-AR): 5% | G437: 16 | H437: 1 | I437: HFCs | J437: HFC-245fa (1,1,1,3,3-pentafluoropropane) | K437: HFC-245fa | M437: 0.303 | N437: 1030 | O437: 1030
A438: 341 | B438: of:=FALSE() -> 0 | C438: 7 | D438: HFC mixtures | E438: Mix: PFC-14: 30.6%; HFC-245fa: 30.3%; HFC-23: 22.2%; HFC-125: 11.9%; Other (-AR): 5% | F438: Mix: PFC-14: 30.6%; HFC-245fa: 30.3%; HFC-23: 22.2%; HFC-125: 11.9%; Other (-AR): 5% | G438: 19 | H438: 2 | I438: PFCs | J438: PFC-14 (CF4) | K438: PFC-14 | M438: 0.306 | N438: 7390 | O438: 7390
A439: 341 | B439: of:=FALSE() -> 0 | C439: 7 | D439: HFC mixtures | E439: Mix: PFC-14: 30.6%; HFC-245fa: 30.3%; HFC-23: 22.2%; HFC-125: 11.9%; Other (-AR): 5% | F439: Mix: PFC-14: 30.6%; HFC-245fa: 30.3%; HFC-23: 22.2%; HFC-125: 11.9%; Other (-AR): 5% | G439: 128 | H439: 11 | I439: Other gases | J439: Other (no F-gas of Regulation 517/2014) | K439: Other | L439: -AR | M439: 0.05